MasterYear,Form Number,District,OperatorNumber,DateofLoss,Type_Company_Cd,County,LeaseNumber,Gasident,CommNbr,TypeLiquid,GrossLoss,Recovered,Net Loss,Facility,CauseofLoss,Remedy,Water,WaterName,Location,Remarks,LeaseName,FieldNumber
2015,339,8,ENERGEN RESOURCES CORPORATION,4/7/2015,Producer,WARD,45629,0,0,Crude,103,100,3,Tank Battery,Equipment Failure,Repaired Existing Equipment,None,,"31.521886, -103.198173","REPLACED THE DUMP VALVE, PICKED UP AS MUCH FLUID AS POSSIBLE",UNIVERSITY 42-18,TWO GEORGES (BONE SPRING)
2015,323,8A,ENDEAVOR ENERGY RESOURCES L.P.,4/7/2015,Producer,TERRY,64133,0,0,Crude,3300,3100,200,Tank Battery,Equipment Failure,Other,None,,"33.102169, -102.241878",REMEDIATION IN PROGRESS,SEATON,"BROWNFIELD, S. (STRAWN)"
2015,321,8,"WHEELER ENERGY, LLC",4/7/2015,Producer,LOVING,29452,0,0,Crude,8,0,8,Tank Battery,Equipment Failure,Other,None,,"SEC 89, BLK 1, W&NW RR SURVEY",CLEAN OFF HEATERS & OIL TANKS,"WHEAT, IDA M.",WHEAT (CHERRY CANYON)
2015,320,8,ENERGEN RESOURCES CORPORATION,4/7/2015,Producer,GLASSCOCK,39445,0,0,Crude,30,17,13,Tank Battery,Equipment Failure,Repaired Existing Equipment,None,,"31.668615, -101.377178","SHUT VALVE, REPAIRED LINE, PICKED UP STANDING FLUID",GLASS,SPRABERRY (TREND AREA)
2015,445,7C,TRUE OIL COMPANY LLC,4/7/2015,Producer,UPTON,18244,0,0,Crude,152,150,2,Tank Battery,Equipment Failure,Other,None,,"SEC 68, BLK C, CCSD&RGNG RR CO/SELF, MRS L A",REMEDIATION,KELLI,SPRABERRY (TREND AREA)
2015,1543,7C,"PARSLEY ENERGY OPERATIONS, LLC",4/7/2015,Producer,REAGAN,18928,0,0,Crude,207,205,2,Tank Battery,Equipment Failure,Other,None,,"SEC 10, BLK D, A-788, S & SV RR CO",SPILL CONTAINED IN LINED CONTAINMENT,RINGO 10,SPRABERRY (TREND AREA) R 40 EXC
2015,303,10,CONOCOPHILLIPS COMPANY,4/7/2015,Producer,MOORE,5108,0,0,Crude,9,8,1,Tank Battery,Equipment Failure,Other,None,,"SEC 36, BLK 2, SFRR CO SURVEY","VACUUM TRUCK OUT TO PICK UP FLUIDS, TREAT SPILL SITE W/MRCROBLAZE ","WITHERBEE, H. D.",PANHANDLE MOORE COUNTY FIELD
2015,550,9,KALER OIL COMPANY,4/7/2015,Producer,COOKE,23936,0,0,Crude,115,20,95,Tank Battery,Act of God,Other,None,,"FANNIN COUNTY SCHOOL LAND, SURVEY A-1248, LOT 41",ALL LIQUIDS WERE CONTAINED IN SIDE TANK BATTERY BERM,"WILSON, JOE A.",COOKE COUNTY REGULAR
2015,394,8A,"SHERIDAN PRODUCTION COMPANY, LLC",4/6/2015,Producer,CROSBY,68095,0,0,Crude,10,10,0,Tank Battery,Equipment Failure,Other,None,,AHCU 187,BACKHOE & BLENDED WITH FRESH SOIL. REMEDIATION IS COMPLETE,AOCO-HOOPLE (CLEARFORK) UNIT,HOOPLE (CLEAR FORK)
2015,1469,8,"SHERIDAN PRODUCTION COMPANY, LLC",4/6/2015,Producer,ECTOR,32784,0,0,Crude,5,4,1,Flow Line,Equipment Failure,Other,None,,"SLATOR BATTERY, SLATOR 7",REMEDIATED ON PLASTIC,SLATOR,"CONCHO BLUFF, NORTH (QUEEN)"
2015,345,8,ENCANA OIL & GAS(USA) INC.,4/6/2015,Producer,MIDLAND,6652,0,0,Crude,8,5,3,Tank Battery,Equipment Failure,Other,None,,"31.5444, -101.499",CONTRACTOR ASSIGNMENT UNDERWAY IN BID PROCESS,"POWELL, R. V. ETAL",SPRABERRY (TREND AREA)
2015,302,8,RKI EXPLORATION & PRODUCTION LLC,4/6/2015,Producer,LOVING,43486,0,0,Combined,1,1,0,Pipe Line,Equipment Failure,Other,None,,"31.988385, -103.884176","VACUUM TRUCK, REMEDIATED SOIL",ROBINSON 5,RED BLUFF (CONSOLIDATED)
2015,354,1,ANADARKO E&P ONSHORE LLC,4/6/2015,Other,DIMMIT,0,0,0,Combined,350,50,300,Tank Battery,Equipment Failure,Other,None,,"28.34220, -99.72810",EXCAVATED & IMPACTED SOIL SHREDDER TO AID IN THE REMEDIATION,CACTUS ROSE UNIT,NO FIELD NAME
2015,713,7C,APACHE CORPORATION,4/6/2015,Producer,REAGAN,16968,0,0,Crude,52,50,2,Tank Battery,Equipment Failure,Other,None,,"31.47, -101.447","FREE FLUIDS RECOVERED, SOILS WILL BE BLENDED",SRH NORTH,SPRABERRY (TREND AREA)
2015,336,8,"CROWNQUEST OPERATING, LLC",4/6/2015,Producer,MIDLAND,45417,0,0,Combined,20,19,1,Tank Battery,Equipment Failure,Other,None,,"SEC 9, BLK 37, T&P RR CO SUR","VACUUM TRUCK, SPILLED INSIDE FIREWALL, CONTAINED",FR ARGON 9,SPRABERRY (TREND AREA)
2015,334,8,OXY USA INC.,4/6/2015,Producer,HOWARD,45349,0,0,Crude,12,10,2,Tank Battery,Equipment Failure,Other,None,,"SEC 13, BLK 34, T&P RR CO","VAC TRUCK, FRESH SOIL BLENDED WITH THE CONTAMINATED SOIL",WALDRON,SPRABERRY (TREND AREA)
2015,643,9,"MYERS, A. J.",4/5/2015,Producer,JACK,28761,0,0,Crude,153,0,153,Tank Battery,Equipment Failure,Other,None,,"LOT 33, BLK 2, HENDERSON COUNTY SCHOOL LAND","DAM INSTALLED, FREE OIL COVERED, CONTAMINATED SOIL REMOVED",LEWIS-YATES,MORRIS (CONSOLIDATED CONGL.)
2015,442,7C,OXY USA WTP LP,4/4/2015,Producer,REAGAN,3075,0,0,Crude,10,0,10,Tank Battery,Equipment Failure,Other,None,,"SEC 1, CT&MC SUR","VAC TRUCK, FRESH SOIL BLENDED",BARBEE-B,BARBEE (WICHITA-ALBANY)
2015,1058,8,"RELIANCE ENERGY, INC.",4/4/2015,Producer,MIDLAND,41814,0,0,Crude,500,50,450,Tank Battery,Equipment Failure,Other,None,,"SEC 8, BLK 38, SUR G&MMB&A",CLEANUP & CONFIRMATION OF REGULATORY COMPLIANCE,MABEE 138,LOWE (ATOKA)
2015,283,10,"CHESAPEAKE OPERATING, L.L.C.",4/3/2015,Producer,LIPSCOMB,8883,0,0,Crude,7,5,2,Tank Battery,Equipment Failure,Other,None,,"SEC 1082, BLK 43, H&TC RR CO/PARKER, WILLIAM H","TILLING SOIL, MIXING FRESH DIRT & TREATING WITH CHEMICAL SOLUTION ",BENSCH FAMILY TRUST 1082 LIP,KIOWA CREEK (MARMATON)
2015,1277,1,"SWIFT ENERGY OPERATING, LLC",4/3/2015,Producer,LA SALLE,0,0,5111,Crude,8,0,8,Tank Battery,Equipment Failure,Other,None,,"28.20611, -99.23611",ON SITE SOIL REMEDIATION,ALEXANDER UNIT,NO FIELD NAME
2015,444,7C,HUNT OIL COMPANY,4/3/2015,Producer,UPTON,18548,0,0,Crude,6,5,1,Tank Battery,Equipment Failure,Other,None,,"SEC 28, SUR HE&WT RR CO/BUCKLAND, CJ","VACUUM TRUCK, MIXED WITH FRESH DIRT & TILLED",CEMETERY '28',SPRABERRY (TREND AREA)
2015,430,8,ANADARKO E&P ONSHORE LLC,4/3/2015,Producer,WARD,40322,0,0,Combined,10,10,0,Tank Battery,Equipment Failure,Other,None,,"31.57748, -103.35957","RECOVERED STANDING FLUIDS, WASHED CONTAINMENT; DISPOSED OF",MONROE 34-220,PHANTOM (WOLFCAMP)
2015,376,8,"PIONEER NATURAL RES. USA, INC.",4/2/2015,Producer,GLASSCOCK,15400,0,0,Crude,10,5,5,Tank Battery,Equipment Failure,Other,None,,"31.603801, 101.716919","VACUUM TRUCK, BACKFILLING EXCAVATION",SPRABERRY DRIVER UNIT,SPRABERRY (TREND AREA)
2015,565,8A,"TEXLAND PETROLEUM, L.P.",4/2/2015,Producer,GAINES,70331,0,0,Crude,2,0,2,Valve,Equipment Failure,Other,None,,"SEC 12, BLK A-21, PSL SUR","FIELD MISTED WITH OIL, NO PUDDLES, BACKHOE PARTIALLY BACK DRUG",MORIAH,SEMINOLE DRAW (SAN ANDRES)
2015,343,8,ENCANA OIL & GAS(USA) INC.,4/2/2015,Producer,MARTIN,38475,0,0,Crude,12,12,0,Other,Equipment Failure,Other,None,,"32.309867, -102.156264","CONTRACTOR ASSIGNMENT UNDERWAY, CLOSURE WILL BE PROVIDED",DOROTHY FAYE-K-,SPRABERRY (TREND AREA)
2015,522,8,ENTERPRISE CRUDE OIL LLC,4/2/2015,Transporter,REEVES,0,0,0,Crude,13,0,13,Tank Battery,Company Human Error,Other,None,,"31.840960, -103.834250",CONTRACTORS REMEDIATED IMPACTED TANK BATTERY PAD,WESTBROOK SOUTHEAST UNIT,NO FIELD NAME
2015,319,8,ENERGEN RESOURCES CORPORATION,4/1/2015,Producer,WARD,42498,0,0,Crude,92,65,27,Tank Battery,Company Human Error,Other,None,,"31.603717, -103.420467","SHUT IN, CLOSED VALVE, TIGHTEND HAMMER UNIONS, PICKED UP FLUID",CADENHEAD 18,TWO GEORGES (BONE SPRING)
2015,787,7C,APACHE CORPORATION,4/1/2015,Producer,UPTON,19019,0,0,Crude,7,5,2,Tank Battery,Equipment Failure,Other,None,,"31.181, -101.868","FREE FLUIDS RECOVERED, SOILS WILL BE BLENDED",STONE,SPRABERRY (TREND AREA)
2015,429,7C,NEWFIELD EXPLORATION COMPANY,4/1/2015,Producer,TERRELL,0,217751,0,Gas Well Liquid,82,0,82,Tank Battery,Act of God,Other,None,,"SEC 34, BLK 1, ABS 1685, SUR T C RR CO / J.J. NANCE","ALL LIQUIDS REMAINED IN SECONDARY CONTAINMENT, VAPORIZED BY FIRE",POULTER 34,POULTER (STRAWN)
2015,383,8,"PIONEER NATURAL RES. USA, INC.",3/31/2015,Producer,MIDLAND,22051,0,0,Crude,100,80,20,Tank Battery,Equipment Failure,Other,None,,"32.011166, -102.101.783637","VACUUM TRUCK, EXCAVATED & BLENDED, BIO REMEDIATION",FASKEN,SPRABERRY (TREND AREA)
2015,342,8,ENCANA OIL & GAS(USA) INC.,3/31/2015,Producer,MARTIN,38475,0,0,Crude,80,78,2,Tank Battery,Equipment Failure,Other,None,,"32.306241, -102.135468",CONTRACTOR ASSIGNMENT UNDERWAY,DOROTHY FAYE-K-,SPRABERRY (TREND AREA)
2015,1470,8,"SHERIDAN PRODUCTION COMPANY, LLC",3/31/2015,Producer,ECTOR,32784,0,0,Crude,12,3,9,Tank Battery,Equipment Failure,Other,None,,SLATOR BATTERY,"REMEDIATED ON PLASTIC, MIXTURE OF FERTILIZER & SOIL MENDER",SLATOR,"CONCHO BLUFF, NORTH (QUEEN)"
2015,1550,2,"DEVON ENERGY PRODUCTION CO, L.P.",3/31/2015,Producer,DE WITT,10621,0,0,Crude,8,7,1,Tank Battery,Equipment Failure,Other,None,,"FULCHER, C A-20","LIQUIDS RECOVERED, IMPACTED SOIL REMOVED, TRANSPORTED TO LANDFILL ",MUIR F-MUIR A SA UNIT,EAGLEVILLE (EAGLE FORD-2)
2015,275,8,"TRINITY ENVIRONMENTAL SWD,L.L.C",3/31/2015,Other,GLASSCOCK,0,0,0,Crude,36,30,6,Tank Battery,Equipment Failure,Other,None,,"SEC 45, BLK 33, T5S",REMEDIATION,SEVENGILLS 55-1-25,NO FIELD NAME
2015,682,8,ENDEAVOR ENERGY RESOURCES L.P.,3/31/2015,Producer,HOWARD,43554,0,0,Crude,7,0,7,Tank Battery,Equipment Failure,Other,None,,"32.071200, 101.3702",SOIL WILL BE BLENEDED AND REMEDIATED IN PLACE,QUINN '40',SPRABERRY (TREND AREA)
2015,279,8,DIAMONDBACK E&P LLC,3/31/2015,Producer,MIDLAND,39506,0,0,Crude,18,17,1,Tank Battery,Equipment Failure,Other,None,,"32.101615, -102.168848","CLEAN UP COMPLETE, SYSTEM UPGRADED,",KIMBERLY,SPRABERRY (TREND AREA)
2015,274,8,ANADARKO E&P ONSHORE LLC,3/30/2015,Producer,LOVING,0,275880,0,Crude,71,70,1,Tank Battery,Equipment Failure,Other,None,,"31.9425605, -103.70753",PERFORMED LOCK OUT TAG OUT PROCEDURES & CLOSED VALVES,SEVENGILLS 55-1-25,SANDBAR (BONE SPRING)
2015,466,8,ENDEAVOR ENERGY RESOURCES L.P.,3/30/2015,Producer,MARTIN,38721,0,0,Crude,170,155,15,Tank Battery,Equipment Failure,Other,None,,"32.51845, 101.80570",SOIL WILL BE REMEDIATED IN PLACE,"KOGER ""2""",SPRABERRY (TREND AREA)
2015,309,9,MERIT ENERGY COMPANY,3/30/2015,Producer,COOKE,27427,0,0,Combined,1000,0,1000,Flow Line,Corrosion - Rust,Other,Creek,HICKORYCREEK,CONRAD FUNIASH SURVEY A-369,REMEDIATION IN PROGRESS,WALNUT BEND FIELD UNIT,WALNUT BEND (CONSOLIDATED)
2015,419,7C,COG OPERATING LLC,3/30/2015,Producer,UPTON,18260,0,0,Crude,100,50,50,Tank Battery,Equipment Failure,Other,None,,"SEC 150, BLK E, CCSD&RGNG RR CO",REMEDIATION,QUAIL RANCH 150 SWD,SPRABERRY (TREND AREA)
2015,1303,1,"CHESAPEAKE OPERATING, L.L.C.",3/30/2015,Producer,DIMMIT,0,275731,0,Crude,18,4,14,Tank Battery,Human Error - Other,Other,None,,"SEC 0055, I&GN RR CO AB 456, BLK 8","VAC TRUCK, EXCAVATION & HAUL OFF",FAITH-YANA,BRISCOE RANCH (EAGLEFORD)
2015,370,8A,OCCIDENTAL PERMIAN LTD.,3/30/2015,Producer,HOCKLEY,62842,0,0,Crude,60,55,5,Tank Battery,Equipment Failure,Other,None,,"LEAGUE 43, LABOR 13","VAC TRUCK, BACKHOE BLADED AREA, REMEDIATION","RATLIFF, C. E.",LEVELLAND
2015,577,8,"PIONEER NATURAL RES. USA, INC.",3/30/2015,Producer,MARTIN,38142,0,0,Crude,25,23,2,Tank Battery,Equipment Failure,Other,None,,"32.29670, -102.08150","VAC TRUCK, EXCAVATED & DISPOSED, BACKFILLING EXCAVATION",CHEATHAM,SPRABERRY (TREND AREA)
2015,494,4,"BLUESTONE NATURAL RES. II, LLC",3/29/2015,Producer,WEBB,0,144490,0,Gas Well Liquid,68,68,0,Tank Battery,Equipment Failure,Other,None,,G.C. & S.F. RR CO A-1272,REMEDIATION,DESPAIN,BLACK CREEK (LOBO)
2015,441,7C,"LAREDO PETROLEUM, INC.",3/29/2015,Producer,REAGAN,17210,0,0,Crude,15,5,10,Tank Battery,Equipment Failure,Other,None,,14-16 #7SN,"BACKHOE PERFORMED BLENDING, FURTHER REMEDIATION WILL CONTINUE",TAYLOR-A-,SPRABERRY (TREND AREA)
2015,524,8A,XTO ENERGY INC.,3/29/2015,Producer,GAINES,60580,0,0,Crude,21,20,1,Tank Battery,Equipment Failure,Other,None,,"SEC 4, BLK AX, PSL SURVEY","VACUUM TRUCK, BACKHOE USED TO CLEAN OFF TANK & REMEDIATE",ROBERTSON /CLEARFORK/ UNIT,"ROBERTSON, N. (CLEAR FORK 7100)"
2015,269,8,OXY USA INC.,3/29/2015,Producer,HOWARD,43828,0,0,Crude,20,14,6,Tank Battery,Equipment Failure,Other,None,,"SEC 26, BLK 14",CONTAMINATED SOIL EXCAVATED & BLENDED WITH FRESH SOIL,TIMMERMAN 7,PARKS (CONSOLIDATED)
2015,819,8,ENDEAVOR ENERGY RESOURCES L.P.,3/29/2015,Producer,WINKLER,42517,0,0,Crude,50,45,5,Tank Battery,Equipment Failure,Other,None,,"SEC 11, BLK 20, UNIVERSITY LAND SURVEY",SOIL WILL BE REMEDIATED IN PLACE,"UNIVERSITY UNIT ""11-20""",TWO GEORGES (BONE SPRING)
2015,261,6,BUFFCO PRODUCTION INC.,3/28/2015,Producer,CHEROKEE,12955,0,0,Crude,120,119,1,Other,Equipment Failure,Other,None,,PRODUCTION FACILITY,REMEDIATE SOIL WITH HIGH NITROGEN FERTILIZER & TILL,KEE,GOOD SPRINGS (TRAVIS PEAK)
2015,1406,6,BREITBURN OPERATING L.P.,3/27/2015,Producer,CHEROKEE,1071,0,0,Crude,35,5,30,Flow Line,Equipment Failure,Other,None,,"31.914938, -95.426817","REMEDIATE THE AREA, SKIMMING OIL, ABSORBENTS,",CARTER-STATE -B-,NECHES (WOODBINE)
2015,278,8,BURLINGTON RES O & G CO-MIDLAND,3/27/2015,Transporter,CRANE,0,0,0,Crude,25,25,0,Pipe Line,Equipment Failure,Repaired Existing Equipment,None,,"31.313774, -102.291237",SIGHT GLAS REPLACED REMEDIATION IN PROGRESS,H.B. MORRISON 'B',NO FIELD NAME
2015,346,8,ENCANA OIL & GAS(USA) INC.,3/27/2015,Producer,MARTIN,37553,0,0,Crude,50,50,0,Tank Battery,Equipment Failure,Other,None,,"32.3747492, -102.1002061",CONTRACTOR ASSIGNMENT UNDERWAY IN BID PROCESS,HOLT RANCH -S-,P RANCH (DEVONIAN)
2015,1209,8,ENCANA OIL & GAS(USA) INC.,3/27/2015,Producer,MIDLAND,39902,0,0,Crude,75,70,5,Tank Battery,Equipment Failure,Other,None,,"31.67631, 102.090756",CLSURE WILL BE PROVIDED UPON COMPLETION,"DAVIDSON ""27B""",SPRABERRY (TREND AREA)
2015,335,8,OXY USA WTP LP,3/27/2015,Producer,MIDLAND,32925,0,0,Crude,25,20,5,Flow Line,Corrosion - Rust,Other,None,,"31.792043, -102.286363","PROPERLY MIXED IN PLACE, ON SITE NATURAL BIOREMEDIATION","DOVE ""Y""",SPRABERRY (TREND AREA)
2015,368,8,ENTERPRISE CRUDE OIL LLC,3/27/2015,Producer,REEVES,0,266259,0,Crude,13,0,13,Tank Battery,Human Error - Other,Other,None,,"31.48751, -103.63171",IMPACTED SOIL WILL BE REMEDIATED,OATMAN C18-27,PHANTOM (WOLFCAMP)
2015,527,8,ENCANA OIL & GAS(USA) INC.,3/27/2015,Producer,MIDLAND,34576,0,0,Combined,75,70,5,Other,Equipment Failure,Other,None,,"31.67631, -102.090756",DD CONSTRUCTION HAS BEEN ASSIGNED CLEANUP & CLOSURE OF THIS SITE,"DAVIDSON ""27""",SPRABERRY (TREND AREA)
2015,533,8,ENCANA OIL & GAS(USA) INC.,3/27/2015,Producer,MIDLAND,6652,0,0,Combined,8,5,3,Tank Battery,Equipment Failure,Other,None,,"31.544, -101.499",DD CONSTRUCTION HAS BEEN ASSIGNED CLEANUP & CLOSURE OF SITE,"POWELL, R. V. ETAL",SPRABERRY (TREND AREA)
2015,1007,8A,XTO ENERGY INC.,3/26/2015,Producer,GAINES,5199,0,0,Crude,46,40,6,Tank Battery,Equipment Failure,Repaired Existing Equipment,None,,"SEC 467, BLK G, CCSD & RGNG SUR","VAC TRUCK, REPLACED LINE & CHECK VALVE.","H & J UNIT 1 ""D""",RUSSELL (GLORIETA 6100)
2015,358,2,MURPHY EXPL. & PROD. CO. - USA,3/26/2015,Producer,KARNES,10931,0,0,Crude,7,6,1,Tank Battery,Equipment Failure,Other,None,,"ABS A-4 OF HERNANDEZ, HRS A SURVEY",AFFECTED AREA REMOVED & SENT TO DISPOSAL & REPLACED W/ FREAH SOIL ,ARMAND UNIT,EAGLEVILLE (EAGLE FORD-2)
2015,281,8,"PARSLEY ENERGY OPERATIONS, LLC",3/26/2015,Producer,MIDLAND,45141,0,0,Crude,139,126,13,Tank Battery,Equipment Failure,Other,None,,"SEC 102, BLK 38, T-2-S, L.F. HEARD SURVEY","VACUUM TRUCK, REMEDIATE IMPACTED AREA, BLENDING WITH CLEAN CALICHE",JOHNSON,SPRABERRY (TREND AREA)
2015,489,6,MEMORIAL PRODUCTION OPER. LLC,3/26/2015,Transporter,RUSK,0,0,0,Combined,40,0,40,Tank Battery,Equipment Failure,Other,Creek,BERRYHILL,"32 05 01.87, 94 48 04.73","VAC TRUCKS, EXCAVATED & IS BEING HAULED OFF FOR DISPOSAL",W.T. BRUTON ESTATE,NO FIELD NAME
2015,440,7C,ENCANA OIL & GAS(USA) INC.,3/26/2015,Producer,GREGG,18278,0,0,Crude,10,10,0,Tank Battery,Equipment Failure,Other,None,,"31.5224158, -102.0432556","CLOSURE WILL BE PROVIDED UPON COMPLETION, REMEDIATION",NEAL 46 A,SPRABERRY (TREND AREA)
2015,384,8,ENTERPRISE CRUDE OIL LLC,3/25/2015,Transporter,MIDLAND,0,0,0,Crude,10,0,10,Pipe Line,Equipment Failure,Other,None,,"32.007392, -101.923822",IMPACTED SOIL WILL BE REMEDIATED,FASKEN,NO FIELD NAME
2015,556,8,THREE RIVERS OPERATING CO II LLC,3/25/2015,Producer,ANDREWS,46241,0,0,Crude,8,4,4,Valve,Equipment Failure,Other,None,,"LEAGUE 317, LABOR 19, PARMER COUNTY SCHOOL LAND SUR, A-1380","RECOVER FLUID, MIX & TILL",PARMER 317,SPRABERRY (TREND AREA)
2015,529,8,ENCANA OIL & GAS(USA) INC.,3/25/2015,Producer,MIDLAND,35664,0,0,Crude,25,25,0,Other,Equipment Failure,Other,None,,"31.688286, -102.048477",DD CONSTRUCTION FOR CLEANUP AND CLOSURE OF SITE,"COWDEN ""30""",SPRABERRY (TREND AREA)
2015,560,8,ENCANA OIL & GAS(USA) INC.,3/25/2015,Producer,MIDLAND,35749,0,0,Crude,25,25,0,Tank Battery,Equipment Failure,Other,None,,"31.718241, -102.030583","ASSIGNMENT UNDERWAY, CLOSURE WILL BE PROVIDED UPON COMPLETION","TXL ""N"" 17-1",SPRABERRY (TREND AREA)
2015,1546,1,"CHESAPEAKE OPERATING, INC.",3/25/2015,Producer,LA SALLE,16866,0,0,Crude,22,20,2,Tank Battery,Equipment Failure,Other,None,,SEC 0025,"VAC TRUCK, DHW WILL BE REMEDIATING THE IMPACTED AREA IN PLACE",KINSEL RR UNIT IV LAS,EAGLEVILLE (EAGLE FORD-1)
2015,251,1,"CHESAPEAKE OPERATING, L.L.C.",3/25/2015,Producer,LA SALLE,16866,0,0,Crude,22,20,2,Tank Battery,Equipment Failure,Other,None,,1215 FNL & 335 FEL OF TEXAS SECTION 0025,"VACUUM TRUCKS REMOVED FLUIDS, REMEDIATING THE IMPACTED AREA",KINSEL RR UNIT IV LAS,EAGLEVILLE (EAGLE FORD-1)
2015,730,8,"LINN OPERATING, INC.",3/24/2015,Producer,MARTIN,41680,0,0,Crude,45,38,7,Separator-Gun Barrel-Treater,Equipment Failure,Other,None,,"32.38875, 101.75945","PICKED UP FLUID, WEATHER TO CLEAR UP, CONTAMINATED SOIL TAKEN AWAY",MYRA ROBINSON,SPRABERRY (TREND AREA)
2015,265,8,OXY USA WTP LP,3/24/2015,Transporter,ECTOR,0,0,0,Crude,200,60,140,Tank Battery,Equipment Failure,Other,None,,"SEC 34, BLK 43, T1S, A-672","PICK UP FLUID, MIX & TILL","WITCHER, J. E.",NO FIELD NAME
2015,282,10,"NGL CRUDE LOGISTICS, LLC",3/24/2015,Transporter,LIPSCOMB,0,0,0,Crude,172,42,130,Tank Battery,Equipment Failure,Other,None,,"36.06036, 100.19491","VACUUMED, SAND SPREAD",JOHNSON,NO FIELD NAME
2015,488,3,"ENERGY & EXPL. PRTNRS OPER., LP",3/24/2015,Producer,GREGG,26317,0,0,Combined,50,49,1,Tank Battery,Equipment Failure,Other,None,,"31.077750, -95.603420",TREATED SOIL WAS THEN COMPACTED TO REDUCE EROSION,W.T. BRUTON ESTATE,"FT. TRINIDAD (LEWISVILLE ""A"")"
2015,353,1,"EOG RESOURCES, INC.",3/23/2015,Producer,MCMULLEN,17461,0,0,Crude,11,7,4,Tank Battery,Equipment Failure,Other,None,,"28.55043, 98.78775","VACUUM TRUCK, IMPACTED SOIL EXCAVATED & TRANSPORTED TO DISPOSAL",CACTUS ROSE UNIT,EAGLEVILLE (EAGLE FORD-1)
2015,305,6,"ENABLE MIDSTREAM PARTNERS, LP",3/23/2015,Other,HARRISON,0,0,0,Combined,15,12,3,Tank Battery,Equipment Failure,Other,None,,S. HOLLOWAY SURVEY A-295,"REMEDIATED ON SITE, BLENDED WITH MICRO BLAZE TWICE.","REESE, J. T.",NO FIELD NAME
2015,259,1,"EXCO OPERATING COMPANY, LP",3/23/2015,Producer,DIMMIT,14174,0,0,Crude,190,190,0,Tank Battery,Equipment Failure,Other,None,,I & GN RR CO A-196,"VACUUM TRUCK, REMEDIATED, TREATED WITH BIO REMEDIATION AGENT",NANCE UNIT,PEARSALL (AUSTIN CHALK)
2015,241,1,BUFFCO PRODUCTION INC.,3/23/2015,Producer,ZAVALA,15772,0,0,Crude,30,25,5,Tank Battery,Equipment Failure,Other,None,,O&G PRODUCTION FACILITY,"VACUUMED, REMEDIATING IMPACTED SOIL.",HOWETT,BRISCOE RANCH (EAGLEFORD)
2015,277,8,OCCIDENTAL PERMIAN LTD.,3/23/2015,Producer,WARD,44277,0,0,Crude,7,3,4,Separator-Gun Barrel-Treater,Equipment Failure,Other,None,,"SEC 17, BLK 33, H.&T.C. RR CO SUR","RECOVER FLUID, MIX & TILL IN PLACE",H.B. MORRISON 'B',PHANTOM (WOLFCAMP)
2015,306,6,BUFFCO PRODUCTION INC.,3/23/2015,Producer,RUSK,0,203786,0,Gas Well Liquid,15,14,1,Tank Battery,Equipment Failure,Other,None,,SHEROW #1,"VACUUM TRUCKS, REMEDIATE SOIL WITH HIGH NITROGEN FERTILIZER & TILL",SHEROW,"HENDERSON, E. (COTTON VALLEY)"
2015,371,8A,KINDER MORGAN PRODUCTION CO LLC,3/22/2015,Producer,SCURRY,3137,0,0,Crude,16,1,15,Flow Line,Corrosion - Rust,Other,None,,"SEC 204, BLK 97, H & R C SUR",SOILS WITH VISIBLE CRUDE OI STAINING WILL BE EXCAVATED. REMEDIATE ,SACROC UNIT,KELLY-SNYDER
2015,459,7C,APPROACH OPERATING LLC,3/22/2015,Producer,CROCKETT,17662,0,0,Crude,120,115,5,Tank Battery,Human Error - Other,Other,None,,"SUR UL, BLK 45, SEC 7",STANDING LIQUIDS PULLED OUTSIDE & INSIDE THEN PUT BACK,UNIVERSITY 45,HOLT RANCH (CONSOLIDATED)
2015,280,8,DIAMONDBACK E&P LLC,3/22/2015,Producer,ECTOR,40511,0,0,Crude,140,120,20,Tank Battery,Equipment Failure,Other,None,,"32.00748, 102.40396",CLEAN UP IN PROCESS,WHL,SPRABERRY (TREND AREA)
2015,250,8,ENDEAVOR ENERGY RESOURCES L.P.,3/22/2015,Producer,MARTIN,33055,0,0,Crude,5,4,1,Other,Equipment Failure,Other,None,,"32.42102, -101.734243",REMEDIATION IN PROGRESS,"SHORTES, L. O.",HILL RANCH (FUSSELMAN)
2015,525,8A,XTO ENERGY INC.,3/22/2015,Producer,GAINES,60580,0,0,Crude,105,100,5,Tank Battery,Equipment Failure,Other,None,,"SEC 2, BLK A24, PSL SURVEY","VACUUM TRUCK, BACKHOE USED TO CLEAN OFF TANK & REMEDIATE",ROBERTSON /CLEARFORK/ UNIT,"ROBERTSON, N. (CLEAR FORK 7100)"
2015,421,7C,XTO ENERGY INC.,3/22/2015,Producer,UPTON,17142,0,0,Crude,40,36,4,Tank Battery,Equipment Failure,Other,None,,"SEC 1, BLK 3, T&P RR CO SUR","VAC TRUCK, BACKHOE, SPILL WAS CONTAINED IN THE FIREWALL",CAROLINE,SPRABERRY (TREND AREA)
2015,1273,2,"PENN VIRGINIA OIL & GAS, L.P.",3/22/2015,Producer,LAVACA,9963,0,0,Crude,20,20,0,Tank Battery,Human Error - Other,Other,None,,"PONTON, A., A-35","VAC TRUCK, CONTAMINATED PEA GRAVEL, BERM HAULED OFF, PLASTIC LINED",EFFENBERGER UNIT,EAGLEVILLE (EAGLE FORD-2)
2015,845,9,"CHAPARRAL ENERGY, L.L.C.",3/21/2015,Producer,COOKE,16087,0,0,Crude,30,25,5,Flow Line,Equipment Failure,Other,River,REDRIVER,"33.853682, 97.226923","REMOVED FROM POND & CREEK, POWER WASH, REMOVE TREES FROM FLOW PATH",SIVELLS BEND /STRAWN/ UNIT,SIVELLS BEND
2015,1122,8,XTO ENERGY INC.,3/21/2015,Producer,ANDREWS,1770,0,0,Crude,9,4,5,Tank Battery,Equipment Failure,Other,None,,"SEC 16, BLK A32, PSL SUR","OILY SOIL REMOVED, NEW CALICHE TO REPLACE, VAC TRUCK",FULLERTON CLEARFORK UNIT,FULLERTON
2015,254,8,ENERGEN RESOURCES CORPORATION,3/21/2015,Producer,LOVING,44192,0,0,Crude,91,88,3,Tank Battery,Equipment Failure,Other,None,,"31.794817, -103.515020",RESTORED GAS TO HEATER & PICKED UP AS MUCH FLUID AS POSSIBLE,DIMMIT 53-38,TWO GEORGES (BONE SPRING)
2015,271,8,OXY USA INC.,3/20/2015,Producer,STERLING,44124,0,0,Crude,100,96,4,Tank Battery,Equipment Failure,Other,None,,"SEC 26, BLK 7, SVY H&TC RR CO","VAC TRUCK, CONTAMINATED AREA BLENDED FRO NATURAL REMEDIATION",ATKINSON,"GARDEN CITY, S. (WOLFCAMP)"
2015,751,8,"ACME ENERGY SERVICES, INC.",3/20/2015,Producer,MIDLAND,39655,0,0,Crude,3,2,1,Pump Station or Terminal,Act of God,Other,None,,"31.862296, -101.986615",REMEDIATION IN PROGRESS,SALT LAKE SWD,SPRABERRY (TREND AREA)
2015,721,9,"WILLO OIL & GAS EXPLORATION, LLC",3/20/2015,Producer,WICHITA,31143,0,0,Crude,3,0,3,Tank Battery,Human Error - Other,Other,Creek,WOLFCREEK,INJECTION BAQTTERY,MADE DAMS WITH BACKHOE AND PLACED OVER 9 BOOMS ALONG CREEK,"SAUDER, J. M.",K-M-A
2015,501,8,ENCANA OIL & GAS(USA) INC.,3/20/2015,Producer,MARTIN,37553,0,0,Crude,20,20,0,Tank Battery,Equipment Failure,Other,None,,"32.349345, -102.12684",DOUBLE D CONSTRUCTION HAS BEEN ASSIGNED THE CLEANUP & CLOSURE,HOLT RANCH -S-,P RANCH (DEVONIAN)
2015,247,8,COG OPERATING LLC,3/19/2015,Producer,ANDREWS,39878,0,0,Crude,120,110,10,Tank Battery,Equipment Failure,Other,None,,"SEC 21, BLK 3, PSL","VACUUM TRUCK PICKED UP OIL,",GLENNA,SPRABERRY (TREND AREA)
2015,322,8,"SANDRIDGE EXPL. AND PROD., LLC",3/19/2015,Producer,PECOS,0,240077,0,Crude,53,38,15,Tank Battery,Equipment Failure,Other,None,,"SEC 7, BLK 600, SUR JM HOLBROOKS","REMOVING CONTAMINATED SOIL & USING ABSORBING CHEMICAL, REMEDIATED ",WEST RANCH,PINON (OVERTHRUST)
2015,311,9,"EOG RESOURCES, INC.",3/18/2015,Producer,MONTAGUE,33135,0,0,Crude,25,1,24,Tank Battery,Equipment Failure,Other,None,,NEAR COLLIER A1H SEPARATOR,"VACUUMED TRUCK, EXCAVATED, REMEDIATION MEASURES",COLLIER A UNIT,"NEWARK, EAST (BARNETT SHALE)"
2015,270,8,"PIONEER NATURAL RES. USA, INC.",3/18/2015,Producer,MIDLAND,18187,0,0,Crude,264,240,24,Tank Battery,Equipment Failure,Other,None,,"31.826468, -101.86033","VACUUM TRUCK, EXCAVATED & BLENDED, BIOLOGICAL REMEDIATION AID",SHACKELFORD SPRABERRY UNIT,SPRABERRY (TREND AREA)
2015,216,8,ENDEAVOR ENERGY RESOURCES L.P.,3/18/2015,Producer,HOWARD,43554,0,0,Crude,8,0,8,Tank Battery,Equipment Failure,Other,None,,"32.107223, -101.617806",REMEDIATION IN PROGRESS,QUINN '40',SPRABERRY (TREND AREA)
,,,,,,,,,,,,,,,,,,,,,,
2015,1577,1,BHP BILLITON PET(TXLA OP) CO,3/17/2015,Producer,MCMULLEN,0,0,5320,Crude,200,0,200,Tank Battery,Theft,Other,None,,"SEC 4, HT&B RR CO, REYNOLDS, WR, A-1051","TRANSPORTERS CONTACTED ATTEMPT TO ACCT FOR LOST, NEGATIVE RESULTS ",GLADYS WHEELER,NO FIELD NAME
2015,260,10,"PIONEER NATURAL RES. USA, INC.",3/17/2015,Transporter,HUTCHINSON,0,0,0,Gas Well Liquid,7,0,7,Pipe Line,Corrosion - Rust,Other,None,,"35.37964, 101.37276",EXCAVATED & REMEDIATED ONSITE.,NANCE UNIT,NO FIELD NAME
2015,1579,1,BHP BILLITON PET(TXLA OP) CO,3/17/2015,Producer,MCMULLEN,0,268148,0,Gas Well Liquid,170,0,170,Tank Battery,Theft,Other,None,,"SEC 19, HT & B RR CO SVY, A-253",LOSS REMAINS UNACCOUNTED FOR,GLADYS WHEELER,HAWKVILLE (EAGLEFORD SHALE)
2015,1576,1,BHP BILLITON PET(TXLA OP) CO,3/17/2015,Producer,MCMULLEN,0,271234,0,Gas Well Liquid,180,0,180,Tank Battery,Theft,Other,None,,"SEC 19, HT & B RR CO, A-253",CHECKED WITH AREA TRANSPORTERS & FILED WITH LAW ENFORCEMENT,GLADYS WHEELER,HAWKVILLE (EAGLEFORD SHALE)
2015,246,8,"THOMPSON, J. CLEO",3/17/2015,Producer,ANDREWS,18729,0,0,Crude,350,300,50,Other,Equipment Failure,Other,None,,"32.26471, -102.34136","BRING IN TOP SOIL AND BACK FILL,",W. MEANS /GRBG.-SAN ANDRES/ UNIT,MEANS
2015,307,4,"CHESAPEAKE OPERATING, INC.",3/16/2015,Producer,WEBB,0,261826,0,Crude,89,0,89,Tank Battery,Equipment Failure,Other,None,,"SEC 0033, I&GN RR CO AB 344",EXCAVATION TO REMOVE ALL IMPACTED MATERIAL,SHEROW,NO FIELD NAME
2015,1536,3,ANADARKO E&P ONSHORE LLC,3/16/2015,Producer,GAINES,23640,0,0,Crude,40,37,3,Tank Battery,Corrosion - Rust,Other,None,,"30.78389, -96.68000",VACUUMED AND THE AREA WAS FLUSHED WITH FRESH WATER,ANDREWS UNIT,GIDDINGS (AUSTIN CHALK-3)
