MasterYear,Form Number,District,OperatorNumber,DateofLoss,Type_Company_Cd,County,LeaseNumber,Gasident,CommNbr,TypeLiquid,GrossLoss,Recovered,Net Loss,Facility,CauseofLoss,Remedy,Water,WaterName,Location,Remarks,LeaseName,FieldNumber
2015,701,7C,"BOAZ ENERGY II OPERATING, LLC",6/14/2015,Producer,TOM GREEN,15866,0,0,Crude,88,45,43,Tank Battery,Equipment Failure,Other,None,,AROUND OIL TANK,SHUT WELL IN,"POWELL-HALL ""J""",BEEKEEPER (PALO PINTO)
2015,658,8,OXY USA WTP LP,6/13/2015,Producer,ECTOR,17665,0,0,Combined,10,5,5,Flow Line,Corrosion - Rust,Other,None,,"SEC 28, BLK 44, T2S, T&P RR CO SUR",RECOVER FLUIDS & REMEDIATE IN PLACE,MOSS -E-,HARPER (ELLENBURGER)
2015,627,8,"DEVON ENERGY PRODUCTION CO, L.P.",6/13/2015,Producer,ECTOR,39031,0,0,Crude,10,10,0,Tank Battery,Act of God,Other,None,,"SEC 16, BLK 42, T3S, T&P RR CP SVY",VAC TRUCK CALLED & CONTACTED BCC TO REMEDIATE,ERICA,SALLIE ANN (SPRABERRY-WOLFCAMP)
2015,645,3,"KILMARNOCK OIL COMPANY, INC.",6/13/2015,Producer,BRAZORIA,0,0,1592,Crude,143,0,143,Tank Battery,Act of God,Other,None,,"SEC 4, HT & BNRR CO, SUR A-650","FIRE DEPARTMENT PUT OUT FIRE, VACUUM TRUCK","TWOMEY, J.T.",NO FIELD NAME
2015,1520,8A,OCCIDENTAL PERMIAN LTD.,6/13/2015,Producer,GAINES,18910,0,0,Crude,20,15,5,Tank Battery,Equipment Failure,Other,None,,"SEC 53, BLK AX, PUBLIC SCHOOL LAND SUR",REMEDIATE THE SOIL,DENVER UNIT,WASSON
2015,628,8,COG OPERATING LLC,6/13/2015,Producer,ECTOR,37524,0,0,Crude,20,10,10,Tank Battery,Act of God,Other,None,,"SEC 14, BLK 42, T-3-S, T&P RR CO",REPORTED SPILL TO CDG SPILL REDUCTION TEAM,SALLIE,SALLIE ANN (SPRABERRY-WOLFCAMP)
2015,685,8,APACHE CORPORATION,6/13/2015,Producer,ECTOR,20487,0,0,Crude,80,50,30,Pipe Line,Equipment Failure,Other,None,,"31.88916, -102.72987","FLUIDS RECOVERED, SOIL WILL BE BLENDED",TXL NORTH UNIT,TXL (TUBB)
2015,666,8,"PIONEER NATURAL RES. USA, INC.",6/12/2015,Producer,MIDLAND,37123,0,0,Crude,40,37,3,Other,Equipment Failure,Other,None,,"31.826937, -101.964102","VAC TRUCK, EXCAVATED & BLENDED WITH FRESH SOIL, BIOREMEDIATION","HUTT, DONALD L.'C'",SPRABERRY (TREND AREA)
2015,793,8,"PIONEER NATURAL RES. USA, INC.",6/12/2015,Producer,MARTIN,39474,0,0,Crude,15,10,5,Tank Battery,Equipment Failure,Other,None,,"32.183566, -101.705188","VAC TRUCK, EXCAVATED & BLENDED WITH FRESH SOIL, BIOREMEDIATION","RAGLAND ""2""",SPRABERRY (TREND AREA)
2015,1519,8A,OCCIDENTAL PERMIAN LTD.,6/11/2015,Producer,YOAKUM,18910,0,0,Crude,11,10,1,Tank Battery,Corrosion - Rust,Other,None,,DENVER UNIT SATELLITE,REMEDIATE THE SOIL.,DENVER UNIT,WASSON
2015,1048,8,XTO ENERGY INC.,6/11/2015,Producer,ANDREWS,1770,0,0,Crude,6,5,1,Tank Battery,Equipment Failure,Other,None,,"SEC 8, BLK A48, PSL",CONTAMINATED SOIL REMOVED WITH BACKHOE & NEW CALICHE BROUGHT IN,FULLERTON CLEARFORK UNIT,FULLERTON
2015,1276,1,"EOG RESOURCES, INC.",6/11/2015,Producer,LA SALLE,17504,0,0,Crude,20,20,0,Tank Battery,Equipment Failure,Other,None,,"28.4303, -98.9815","VAC TRUCK, CONTAINED TO THE LINED CONTAINMENT",ALEXANDER UNIT,EAGLEVILLE (EAGLE FORD-1)
2015,584,8,ENDEAVOR ENERGY RESOURCES L.P.,6/10/2015,Producer,MARTIN,16189,0,0,Crude,30,25,5,Tank Battery,Equipment Failure,Other,None,,"32.09812, -101.79967",REMEDIATION IN PROGRESS,KADERLI UNIT,SPRABERRY (TREND AREA)
2015,629,8,TREY RESOURCES INC.,6/10/2015,Producer,ANDREWS,30555,0,0,Crude,30,30,0,Tank Battery,Equipment Failure,Other,None,,"PSL A-36, BLK 1","VAC TRUCK, WILL REMEDIATE SOIL WITHIN THE BERM",NICHOLS SISTERLOAD,MEANS
2015,582,8,ENERGEN RESOURCES CORPORATION,6/9/2015,Producer,REEVES,41259,0,0,Crude,40,36,4,Tank Battery,Equipment Failure,Other,None,,"31.608597, -103.648844","RESET PUMPS, PICKED UP AS MUCH FREE STANDING FLUID",STATE 54-8,ARNO (DELAWARE SAND)
2015,581,8,ENERGEN RESOURCES CORPORATION,6/9/2015,Producer,HOWARD,45870,0,0,Crude,85,80,5,Tank Battery,Equipment Failure,Repaired Existing Equipment,None,,"32.442529, -101.668209",REPLACED THE KIMRAY & PICKED UP AS MUCH FLUID,SMITH SN 48-37 02,SPRABERRY (TREND AREA)
2015,702,7C,OXY USA INC.,6/9/2015,Producer,SCHLEICHER,15066,0,0,Crude,9,5,4,Flow Line,Corrosion - Rust,Other,None,,STEEL FLOW LINE,"SHUT IN, VAC TRUCK, CLEAN UP",JONES,REGAL (WOLFCAMP)
2015,703,7C,ENDEAVOR ENERGY RESOURCES L.P.,6/9/2015,Producer,REAGAN,11495,0,0,Crude,65,50,15,Other,Equipment Failure,Other,None,,"31.342917, -101.496532",REMEDIATION IN PROGRESS,"HUGHES, CHARLES H.",SPRABERRY (TREND AREA)
2015,951,8,ENCANA OIL & GAS(USA) INC.,6/9/2015,Producer,MIDLAND,34728,0,0,Crude,10,2,8,Tank Battery,Equipment Failure,Other,None,,"31.661974, -102.056241",DOUBLE D CONSTRUCTION HAS BEEN ASSIGNED CLEANUP & CLOSURE,"DAVIDSON ""38""",SPRABERRY (TREND AREA)
2015,704,7C,MEMORIAL PRODUCTION OPER. LLC,6/9/2015,Producer,CROCKETT,435,0,0,Crude,15,2,13,Flow Line,Equipment Failure,Other,None,,"30538.23, 10121.28","LINE REPAIRED, PW SUCKED UP, FLUSHED, TILL & DESALT ONCE DRY","SHANNON, J. M. -A-",ELKHORN (ELLENBURGER)
2015,760,9,"DALLAS PRODUCTION, INC.",6/9/2015,Other,MONTAGUE,30044,0,0,Crude,204,4,200,Tank Battery,Equipment Failure,Other,None,,"TE&L SEC 3428, ABS 806",ENVIRONMENTAL CLEAN UP,FAT DOG RANCH,"STONEBURG, SW. (MISSISSIPPIAN)"
2015,763,8,ENERGEN RESOURCES CORPORATION,6/9/2015,Producer,REEVES,46665,0,0,Crude,7,0,7,Tank Battery,Equipment Failure,Other,None,,"31.606858, -103.669551","REPAIRED DUMP VALVE, REMEDIATIUON TO BEGIN ON LOCATION",PIPER STATE 54-14,PHANTOM (WOLFCAMP)
2015,917,1,CARRIZO (EAGLE FORD) LLC,6/8/2015,Producer,ATASCOSA,15550,0,0,Crude,8,7,1,Flow Line,Corrosion - Rust,Other,None,,"SEC 10, ABS 1554","VAC TRUCK, DELINEATE THE SURFACE IMPACT, REMEDIATION",PHZ UNIT,EAGLEVILLE (EAGLE FORD-1)
2015,1541,8,"PANTHER EXPLORATION, LLC",6/8/2015,Producer,REEVES,47829,0,0,Crude,25,25,0,Tank Battery,Equipment Failure,Other,None,,"SEC 32, BLK 55, T-4, T&P RR CO SURVEY","PRESSURE WASH WATER TANK, CONTAINMENT AREA, TRANSFERRED BACK",MONROE STATE 32,PHANTOM (WOLFCAMP)
2015,623,8,OXY USA INC.,6/8/2015,Producer,HOWARD,43758,0,0,Crude,8,5,3,Tank Battery,Equipment Failure,Other,None,,"SEC 267, SUR MOORE CSL, LEAGUE 267, LABOR 16",RECOVER FLUIDS & REMEDIATE IN PLACE,"BROWN, J '16'",SPRABERRY (TREND AREA)
2015,583,8A,CENTURION PIPELINE L.P.,6/8/2015,Transporter,YOAKUM,0,0,0,Crude,80,60,20,Tank Battery,Equipment Failure,Other,None,,"SEC 893, BLK D, JOHN H GIBSON",BLENDED WITH CLEAN SOIL,STATE 54-8,NO FIELD NAME
2015,588,7C,"PIONEER NATURAL RES. USA, INC.",6/8/2015,Producer,UPTON,3913,0,0,Crude,50,35,15,Tank Battery,Equipment Failure,Other,None,,"31.613417, 101.825833","VACUUM TRUCK, BACKFILLING THE EXCAVATION",NORTH PEMBROOK SPRABERRY UNIT,SPRABERRY (TREND AREA)
2015,639,10,"DEVON ENERGY PRODUCTION CO, L.P.",6/7/2015,Producer,HEMPHILL,0,52360,0,Crude,33,28,5,Other,Equipment Failure,Other,None,,"SEC 158, BLK 41, H&RC RR SUR","REMOVAL OF FREESTANDING LIQUIDS, PERFEX HANDLED GROUND WORK",MATHERS RANCH 157,"CANADIAN, SE (DOUGLAS)"
2015,991,9,"BRAMMER PETROLEUM, INC.",6/7/2015,Producer,COOKE,10370,0,0,Crude,10,10,0,Tank Battery,Equipment Failure,Other,Creek,WHEELER,"33.655674, -97.060968","USED VAC TRUCK, SKIMMERS, BOOMS, DIAPERS, CHAIN SAWS, WEED BLOWERS","BUGG, J. F. -B-",PRINCE (STRAWN)
2015,1518,8A,OCCIDENTAL PERMIAN LTD.,6/7/2015,Producer,YOAKUM,62541,0,0,Crude,10,0,10,Tank Battery,Equipment Failure,Other,None,,GIBSON UNIT WATER INJECTION STATION,REMEDIATE THE SOIL,GIBSON UNIT,WASSON 72
2015,631,8A,"FASKEN OIL AND RANCH, LTD.",6/7/2015,Producer,DAWSON,69470,0,0,Combined,15,0,15,Flow Line,Equipment Failure,Repaired Existing Equipment,None,,"SEC 9, BLK 35, T-5-N, T&P RR CO SUR","FLOW LINE REPAIRED, MOST SATURATE SOIL REMVOED TO BATTERY",LOS YBANEZ SPRABERRY UNIT,LOS YBANEZ (SPRABERRY)
2015,586,7C,"PARSLEY ENERGY OPERATIONS, LLC",6/7/2015,Producer,UPTON,17322,0,0,Crude,35,26,9,Tank Battery,Equipment Failure,Other,None,,"SW/4, SEC 46, BLK 39, T&P RR","VAC TRUCK, WILL REMEDIATE IN IMPACTED AREA, BLENDING","CRAWFORD ""46""",SPRABERRY (TREND AREA)
2015,697,7C,CONCHO OILFIELD SERV & OPER CO.,6/6/2015,Producer,CONCHO,11540,0,0,Crude,18,14,4,Tank Battery,Equipment Failure,Other,None,,"SEC 51, H & RC RR CO SUR, ABS 407","BACKHOE, DIG UP & MIXED WITH CLEAN SOIL, REMEDIATION",CANNING,ROYCE (STRAWN)
2015,705,7C,"LAREDO PETROLEUM, INC.",6/6/2015,Producer,REAGAN,16843,0,0,Crude,35,25,10,Separator-Gun Barrel-Treater,Equipment Failure,Other,None,,106 #7NU,"VAC TRUCK, BACKHOE, BLENDING OF IMPACTED SOIL, REMEDIATION",SUGG-D-,SPRABERRY (TREND AREA)
2015,744,8A,TARGA MIDSTREAM SERVICES LLC,6/5/2015,Transporter,COCHRAN,0,0,0,Crude,6,2,4,Pipe Line,Equipment Failure,Other,None,,"CARSON CSL A-111, LGE 130",EXCAVATED SOIL TO EXPOSE & REPAIR LEAK,"WINN, PAUL",NO FIELD NAME
2015,755,8,TARGA SOUTHTEX MIDSTREAM CO LP,6/5/2015,Transporter,MCMULLEN,0,0,0,Crude,6,2,4,Pipe Line,Equipment Failure,Other,None,,"CARSON CSL, A-111, LGE 130","EXCAVATED SOIL AND REPAIR LEAK,",BILBO UNIT,NO FIELD NAME
2015,640,10,"DCP MIDSTREAM MARKETING, LLC",6/5/2015,Other,OCHILTREE,0,0,0,Combined,10,0,10,Pipe Line,Equipment Failure,Repaired Existing Equipment,None,,"SEC 1008, BLK 43, SUR H&TC",LINE WAS REPAIRED & PLACED BACK IN SERVICE,MATHERS RANCH 157,NO FIELD NAME
2015,573,8,BURLINGTON RES O & G CO-MIDLAND,6/4/2015,Producer,CRANE,7155,0,0,Crude,170,169,1,Pipe Line,Equipment Failure,Other,None,,"31 36 14.87, 102 29 53.69","VAC TRUCKS USED TO PICK UP SPILL, AFFECTED SPILL AREA REMEDIATED","WADDELL, W. N.",WADDELL
2015,759,9,LAYLINE ENERGY I LLC,6/4/2015,Producer,WICHITA,13350,0,0,Crude,2,2,0,Tank Battery,Equipment Failure,Other,None,,"SEC 1, A-379","CONTAINED RELEASE, FLUSHED WITH FRESH WATER, PICKED UP FLUIDS","HONAKER, W. B. NCT-1",WICHITA COUNTY REGULAR
2015,587,7C,COG OPERATING LLC,6/4/2015,Producer,IRION,17918,0,0,Crude,110,0,110,Tank Battery,Equipment Failure,Other,None,,"SEC 3071, BLK 28, H & TC RR CO",REBUID TANK BATTERY & HAVE HSE DEPT EVALUATE FOR CLEANUP,SUGG 3071,SPRABERRY (TREND AREA)
2015,1274,2,"KD ENERGY, LLC",6/3/2015,Producer,JACKSON,4778,0,0,Crude,7,7,0,Tank Battery,Equipment Failure,Other,None,,ABRAHAM M. CLARE A-12,"VAC TRUCK, HYDROCARBON EATING MICROS PLACE TO ABSORB RESIDUAL",MAURBRO FIELD /MARG./ UNIT #1,MAURBRO
2015,644,6,BIG RUN PRODUCTION COMPANY,6/3/2015,Producer,PANOLA,10674,0,0,Crude,40,20,20,Other,Equipment Failure,Other,None,,"94.203600, 32.034300","VACUUM, RAKED UP, APPLIED OIL ABSORBANT PADS, BIOLOGICAL AGENTS","TWOMEY, J.T.",PAXTON (RODESSA)
2015,675,8,ENCANA OIL & GAS(USA) INC.,6/3/2015,Producer,MARTIN,37512,0,0,Crude,315,310,5,Tank Battery,Equipment Failure,Other,None,,"32.403176, -102.137122",DOUBLE D CONSTRUCTION FOR CLEANUP & CLOSURE,HOLT RANCH -1-,SPRABERRY (TREND AREA)
2015,551,8A,OCCIDENTAL PERMIAN LTD.,6/3/2015,Producer,HOCKLEY,3780,0,0,Crude,3,3,0,Tank Battery,Equipment Failure,Other,None,,"LEAGUE 28, LABOR 7","VACUUM TRUCK, BACKHOE BLADED AREA, REMEDIATION COMPLETED",LEVELLAND UNIT,LEVELLAND
2015,572,8A,MEMORIAL PRODUCTION OPER. LLC,6/3/2015,Producer,GAINES,67897,0,0,Crude,40,38,2,Tank Battery,Equipment Failure,Other,None,,"32 38 58.51, 102 21 27.55","PIN TIMER REPAIRED, VACUUM & RESURFACED",BIRGE-FORBES UNIT,NEW ERA (GLORIETA)
2015,575,8,"BTA OIL PRODUCERS, LLC",6/2/2015,Producer,ANDREWS,32154,0,0,Crude,7,1,6,Flow Line,Equipment Failure,Other,None,,"SEC 12, BLK A-47, PSL SUR","CONTAMINATED SOIL WILL BE REMOVED, BLENDED WITH CLEAN SOIL",8802 JV-P FUHRMAN,NIX (CLEARFORK)
2015,673,8,ENCANA OIL & GAS(USA) INC.,6/2/2015,Producer,MARTIN,42049,0,0,Crude,170,165,5,Tank Battery,Equipment Failure,Other,None,,"32.31709444, -102.126028",DOUBLE D CONSTRUCTION FOR CLEANUP & CLOSURE,HOLT 2,SPRABERRY (TREND AREA)
2015,624,8,OXY USA WTP LP,6/2/2015,Producer,REEVES,42864,0,0,Crude,17,15,2,Tank Battery,Equipment Failure,Other,None,,"SEC 21, BLK 51, T7S, SUR T&P RR CO",RECOVER FLUIDS & REMEDIATE IN PLACE,LYDA 21,WOLFBONE (TREND AREA)
2015,621,8,ENCANA OIL & GAS(USA) INC.,6/2/2015,Producer,HOWARD,43778,0,0,Crude,48,45,3,Tank Battery,Equipment Failure,Other,None,,"32.34179722, -101.5042556","VAC TRUCK DISPATCHED TO PICK UP ALL STANDING FLUIDS, VALVE CLOSED ",LONG 7,SPRABERRY (TREND AREA)
2015,612,7B,TREY RESOURCES INC.,6/2/2015,Producer,PALO PINTO,3139,0,0,Crude,20,20,0,Tank Battery,Act of God,Other,None,,"SEC 71, BLK 4 T & P RR CO SURVEY",VACUUM TRUCKS CALLED TO CLEAN UP THE SPILL,"STUART, J. N.",PALO PINTO COUNTY REGULAR
2015,571,8,BURLINGTON RES O & G CO-MIDLAND,6/2/2015,Producer,CRANE,5294,0,0,Crude,92,80,12,Tank Battery,Equipment Failure,Other,None,,"313118.52, 1023755.05",REMEDIATION IN PROGRESS,"WADDELL, W. N., ETAL",SAND HILLS (TUBB)
2015,1295,1,BHP BILLITON PET(TXLA OP) CO,6/2/2015,Producer,MCMULLEN,0,272115,0,Combined,15,0,15,Tank Battery,Equipment Failure,Other,None,,"HT & B RR CO/REYNOLDS, WR, BLK 4, SEC 4, A-1051",LINE SHUT IN & CREWS CALLED OUT FOR SITE ASSESSMENT & CLEAN UP,LOWE,HAWKVILLE (EAGLEFORD SHALE)
2015,1238,8,APACHE CORPORATION,6/2/2015,Producer,GLASSCOCK,40247,0,0,Crude,6,5,1,Tank Battery,Equipment Failure,Other,None,,"31.9267, -101.4624","FREE FLUIDS RECOVERED, SOILS WILL BE BLENDED",BALLENGER,SPRABERRY (TREND AREA)
2015,1275,1,"EOG RESOURCES, INC.",6/2/2015,Producer,GONZALES,15523,0,0,Crude,55,0,55,Tank Battery,Equipment Failure,Other,None,,"29.3425, -97.4065","VAC TRUCK, EXCAVATED, TRANSPORTED TO FACILITY,",KERNER CARSON UNIT,EAGLEVILLE (EAGLE FORD-1)
2015,566,4,"JETTA OPERATING COMPANY, INC.",6/1/2015,Producer,JIM WELLS,6280,0,0,Crude,27,27,0,Tank Battery,Equipment Failure,Other,None,,SEELINGSON UNIT,REMIDIATE INSIDE OF FIREWALL WITH GYPSUM & TILLER AS NEEDED,SEELIGSON UNIT,SEELIGSON (COMBINED ZONES)
2015,555,8,TREY RESOURCES INC.,6/1/2015,Producer,ANDREWS,29524,0,0,Crude,8,3,5,Tank Battery,Equipment Failure,Other,None,,"BLK 14, SEC 15, UNIVERSITY SURVEY","VACUUM TRUCKS, BACKHOE TO TAKE OUT SOIL DIRT FOR REMEDIATION",UNIVERSITY BLOCK 14 CONS.,SHAFTER LAKE (SAN ANDRES)
2015,1513,3,"ENERGY & EXPL. PRTNRS OPER., LP",6/1/2015,Producer,MADISON,26419,0,0,Crude,1000,1000,0,Tank Battery,Equipment Failure,Other,River,TRINITYRIVER,"S LARRY SUR, A-21","CLEAN UP ACHIEVED THROUGH BOOMS, VAC, EFFORTS SUCCESSFUL",WAKEFIELD-JONES UNIT,"FORT TRINIDAD, EAST (BUDA)"
2015,537,8A,OCCIDENTAL PERMIAN LTD.,6/1/2015,Producer,HOCKLEY,3780,0,0,Combined,900,0,900,Tank Battery,Equipment Failure,Other,None,,"LEAGUE 71, LABOR 24","VACUUM TRUCK, BACKHOE BLADED AREA, REMEDIATION",LEVELLAND UNIT,LEVELLAND
2015,989,3,"BURK ROYALTY CO., LTD.",6/1/2015,Producer,MADISON,25845,0,0,Combined,100,0,100,Tank Battery,Equipment Failure,Repaired Existing Equipment,None,,DANIEL LARRISON SUR A-20,TANK BATTERY REPAIRED,CHAMBLESS,FORT TRINIDAD (DEXTER)
2015,887,4,"EOG RESOURCES, INC.",5/31/2015,Producer,KLEBERG,6544,0,0,Combined,1500,500,1000,Tank Battery,Equipment Failure,Other,None,,"27.50795, -98.02368","REMEDIATION, SOIL HAULED OFF","BORREGOS, K. R. & SEELIGSON",BORREGOS (COMBINED ZONES)
2015,610,9,"JETTA OPERATING COMPANY, INC.",5/31/2015,Producer,GRAYSON,29589,0,0,Crude,5,3,2,Pipe Line,Equipment Failure,Other,Lake,LAKETEXHOMA,"33 44 24.2, 96 47 15","DOUBLED BOOMED THE AREA & VAC UP, BLOWING TOWARDS SHORE, VAC TRUCK",SUPER UNIT,BIG MINERAL CREEK (CONSOLIDATED)
2015,625,8,OXY USA WTP LP,5/31/2015,Producer,REEVES,40365,0,0,Combined,10,5,5,Tank Battery,Equipment Failure,Other,None,,"SEC 29, BLK 51, T7S, SUR T&P RR CO",RECOVER FLUIDS & REMEDIATE IN PLACE,CHEVRON MINERALS 29,WOLFBONE (TREND AREA)
2015,568,4,"CRIMSON EXPLORATION OPER., INC.",5/31/2015,Producer,BROOKS,0,191885,0,Gas Well Liquid,20,10,10,Tank Battery,Act of God,Other,None,,TM RR CO #710/JESUS GUZMAN,"BIO REMEDIATION, MAJORITY OF FLUID BURNED OFF",CAGE RANCH STATE GAS UNIT I,CAGE RANCH (8025 VICKSBURG)
2015,626,8,OXY USA WTP LP,5/31/2015,Producer,REEVES,42864,0,0,Crude,26,25,1,Tank Battery,Equipment Failure,Other,None,,"SEC 21, BLK 51, T7S, SUR T&P RR CO",RECOVER FLUIDS & REMEDIATE IN PLACE,LYDA 21,WOLFBONE (TREND AREA)
2015,716,7B,H & D PRODUCERS,5/31/2015,Producer,BROWN,16450,0,0,Crude,92,0,92,Tank Battery,Theft,Other,None,,"SEC 606, A MARSHALL SUR",REPORTED TO BROWN COUNTY SHERRIFF'S OFFICE,"HARRISS, HARVEY",BROWN COUNTY REGULAR
2015,592,7C,APPROACH OPERATING LLC,5/31/2015,Producer,CROCKETT,17265,0,0,Crude,20,17,3,Tank Battery,Equipment Failure,Other,None,,"SEC 11, BLK 42, SUR UNIVERSITY LAND","BERMED, PULLED UP, DUG & PUT ON PLASTIC TARP INSIDE BERMED, REMED ",UNIVERSITY 42,HOLT RANCH (CONSOLIDATED)
2015,616,3,"ALEGRE ENERGY, INC.",5/30/2015,Producer,BRAZORIA,21103,0,0,Crude,140,135,5,Tank Battery,Equipment Failure,Other,None,,SHAUBAEL MARSH SUR A-81-82,"VACUUMED, TILLED & BACKHOED GROUND",WORRELL-NORTHRUP,"CHENANGO, NORTH (FRIO 10500)"
2015,591,7C,APPROACH OPERATING LLC,5/30/2015,Producer,CROCKETT,17265,0,0,Crude,15,14,1,Tank Battery,Equipment Failure,Other,None,,"SEC 11, BLK 42, SUR UNIVERSITY LAND","AREA WAS BERMED, DUG & PUT INTO PLASTIC TARP INSIDE BERMED, REMED ",UNIVERSITY 42,HOLT RANCH (CONSOLIDATED)
2015,1475,8,"ACME ENERGY SERVICES, INC.",5/30/2015,Producer,MIDLAND,36785,0,0,Crude,35,30,5,Tank Battery,Equipment Failure,Other,None,,"31.805961, -102.04619",REMEDIATION IN PROGRESS,BARROW SWD,SPRABERRY (TREND AREA)
2015,561,8,"CROWNQUEST OPERATING, LLC",5/30/2015,Producer,MARTIN,46021,0,0,Combined,16,14,2,Stuffing Box,Equipment Failure,Other,None,,"SEC 36, BLK 37, T&P RR CO SURVEY","VACUUM TRUCK, LAND OWNER WAS NOTIFIED",DOUBLE DAVIS 36,SPRABERRY (TREND AREA) R 40 EXC
2015,636,5,"MICRO OPERATING, INC.",5/30/2015,Producer,NAVARRO,3933,0,0,Crude,60,0,60,Tank Battery,Theft,Other,None,,P.J. BURROW A-110,"OFFENSE REPORTED,",CRESPO,CORSICANA (SHALLOW)
2015,553,8,BMD MARTIN LLC,5/30/2015,Other,MARTIN,0,0,0,Crude,100,100,0,Other,Act of God,Other,None,,"SEC 31, BLK 36 T2N, SURVEY T&P RR CO","VACUUM TRUCKS, BUILT UP DIRT BERMS, DISPOSED OF",LEVELLAND UNIT,NO FIELD NAME
2015,579,8,BMD ANGELES LLC,5/30/2015,Other,REEVES,0,0,0,Crude,400,400,0,Other,Human Error - Other,Other,None,,"SEC 45, BLK 57 T1, SUR T&P RR CO","VACUUM TRUCKS, FIRE DEPART RAN OUT OF WATER",CHEATHAM,NO FIELD NAME
2015,532,8,ENDEAVOR ENERGY RESOURCES L.P.,5/30/2015,Producer,MIDLAND,36785,0,0,Crude,35,30,5,Other,Equipment Failure,Other,None,,"31.805961, -102.04619",REMEDIATION IN PROGRESS,BARROW SWD,SPRABERRY (TREND AREA)
2015,630,8,"PLAINS MARKETING, L.P.",5/29/2015,Transporter,WINKLER,0,0,0,Crude,5,0,5,Tank Battery,Human Error - Other,Other,None,,"31.77032, 103.251032",BROUGHT TO THE SURFACE FOR ON SITE BIO REMEDIATION,NICHOLS SISTERLOAD,NO FIELD NAME
2015,562,8,ENERGEN RESOURCES CORPORATION,5/29/2015,Producer,MIDLAND,42007,0,0,Crude,300,230,70,Tank Battery,Equipment Failure,Repaired Existing Equipment,None,,"31.817947, -102.202049","SHUT IN TILL CASING IS FIXED, REPAIRED THE BERM, PICKED UP FLUID",SONJA,SPRABERRY (TREND AREA)
2015,679,8A,KINDER MORGAN PRODUCTION CO LLC,5/29/2015,Producer,SCURRY,3137,0,0,Crude,24,15,9,Tank Battery,Equipment Failure,Other,None,,MANIFOLD 49,"EXCAVATED, REMEDIATE THE SPILL ON LOCATION,",SACROC UNIT,KELLY-SNYDER
2015,593,7C,CALLON PETROLEUM OPERATING CO,5/29/2015,Producer,UPTON,17203,0,0,Crude,8,4,4,Tank Battery,Equipment Failure,Other,None,,SEC 1,"VACUUM, CONTAMINATED SOIL WILL BE REMEDIATED ON LOCATION",NEAL,SPRABERRY (TREND AREA)
2015,594,7C,CALLON PETROLEUM OPERATING CO,5/29/2015,Producer,REAGAN,18294,0,0,Crude,26,25,1,Tank Battery,Equipment Failure,Other,None,,"SEC 9, ABS 184","VAC TRUCK, LINER WILL BE PRESSURE WASHED WITH FRESH WATER",SCHWARTZ 91 POOLED UNIT,LIN (WOLFCAMP)
2015,680,8,OXY USA INC.,5/29/2015,Producer,ECTOR,22784,0,0,Crude,15,10,5,Tank Battery,Equipment Failure,Other,None,,JOHNSON DEEP,"PICKUP FLUID, MIX & TILL",JOHNSON DEEP UNIT,JOHNSON (HOLT)
2015,745,8,SAGA PETROLEUM LLC OF COLORADO,5/28/2015,Producer,ECTOR,8643,0,0,Crude,91,0,91,Tank Battery,Act of God,Other,None,,"SEC 21, BLK 43, T-3-S, T&P RR CO SURVEY","FIRE DEPART CALLED, REMAINED SHUT IN",ECTOR -A- FEE,DOUBLE -H- (GRAYBURG)
2015,548,5,SUNOCO PIPELINE L.P.,5/28/2015,Transporter,NAVARRO,0,0,0,Crude,20,17,3,Tank Battery,Human Error - Other,Other,None,,#8 LILL LINE NEAR TANK 2662,"VACUUM TRUCKS, CRUDE OIL AFFECTED SOILS WERE TILLED IN PLACE",OLIVAREZ UNIT,NO FIELD NAME
2015,595,7C,"PIONEER NATURAL RES. USA, INC.",5/28/2015,Producer,UPTON,4088,0,0,Crude,9,5,4,Flow Line,Equipment Failure,Other,None,,"31.413875, 101.839726","VACUUM TRUCK, BACKFILLING EXCAVATION",PEMBROOK UNIT,SPRABERRY (TREND AREA)
2015,596,7C,DISCOVERY NATURAL RESOURCES LLC,5/28/2015,Producer,IRION,17105,0,0,Crude,33,0,33,Tank Battery,Act of God,Other,None,,"SEC 1949, JAMES COLLIER SUR A-49","LIQUIDS REMAINED INSIDE LINED BERM, NO IMPACT TO SOIL, WTR REMOVED",ROCKER B 1949,ROCKER -B- (CANYON)
2015,707,7C,APACHE CORPORATION,5/28/2015,Producer,REAGAN,17037,0,0,Crude,30,24,6,Tank Battery,Equipment Failure,Other,None,,"31.533, -101.9993","FLLUIDS RECOVERED, BLENDED, BIO REMEDIATE",CC,SPRABERRY (TREND AREA)
2015,1473,8,"ACME ENERGY SERVICES, INC.",5/28/2015,Producer,MIDLAND,36785,0,0,Crude,10,5,5,Tank Battery,Act of God,Other,None,,"31.809431, -102.028054","LIGHTING, REMEDIATION IN PROGRESS",BARROW SWD,SPRABERRY (TREND AREA)
2015,530,8,ENDEAVOR ENERGY RESOURCES L.P.,5/28/2015,Producer,MIDLAND,36785,0,0,Crude,10,5,5,Pump Station or Terminal,Act of God,Other,None,,"31.809431, -102.028054",REMEDIATION IN PROGRESS,BARROW SWD,SPRABERRY (TREND AREA)
2015,1271,1,SABINE OIL & GAS CORPORATION,5/28/2015,Producer,GONZALES,18157,0,0,Crude,90,83,7,Tank Battery,Equipment Failure,Other,None,,B. LOCKHART A-37,"VAC TRUCK, SCRAPED UP OIL IMPACTED SOILS",WHIDDON,SMILEY (AUSTIN CHALK)
2015,538,8,OCCIDENTAL PERMIAN LTD.,5/28/2015,Producer,HOWARD,44177,0,0,Crude,9,6,3,Valve,Equipment Failure,Other,None,,"SEC 24, BLK A BAUER & COCKRELL SUR",ON SITE ENHANCED BIOREMEDITATION,HENDRIX,SPRABERRY (TREND AREA)
2015,552,8A,ENTERPRISE PRODUCTS OPERATINGLLC,5/28/2015,Transporter,HOCKLEY,0,0,0,Combined,67,0,67,Pipe Line,Equipment Failure,Other,None,,"31.52359, -103.44936","BLOCKED IN, BLOWN DOWN, SHUT DOWN, EXCAVATED & REMOVED",LEVELLAND UNIT,NO FIELD NAME
2015,756,9,"MYERS, JAMES B.",5/27/2015,Producer,BAYLOR,1365,0,0,Crude,70,0,70,Tank Battery,Act of God,Other,None,,"BLK 1587, TE&L SUR","PUT BOOMS OUT, REMOVED SHEEN",PORTWOOD -D-,BAYLOR COUNTY REGULAR
2015,589,7C,"DEVON ENERGY PRODUCTION CO, L.P.",5/27/2015,Producer,CROCKETT,18641,0,0,Crude,8,8,0,Tank Battery,Equipment Failure,Other,None,,"BLK 50, SEC 14","VAC TRUCK, TERRACON WILL PROVIDE REMEDIATION SERVICES",UNIVERSITY 50-14,LIN (WOLFCAMP)
2015,597,7C,"EOG RESOURCES, INC.",5/27/2015,Producer,IRION,17171,0,0,Crude,5,3,2,Tank Battery,Equipment Failure,Other,None,,"31.0808, -101.2041","VAC TRUCK, CLAMP USED TO STOP LEAK, IMPACTED SOILS EXCAVATED",UNIVERSITY 40,LIN (WOLFCAMP)
2015,598,7C,APPROACH OPERATING LLC,5/27/2015,Producer,CROCKETT,17780,0,0,Crude,30,28,2,Pipe Line,Equipment Failure,Other,None,,"SEC 57, BLK BB ABS 3119, SUR G.C. & S.F. RR CO","AREA WAS BERMED, SOILS DUG & PUT ONTO PLASTIC TARP, REMEDIATION",PANGEA WEST,HOLT RANCH (CONSOLIDATED)
2015,1387,8,"SHERIDAN PRODUCTION COMPANY, LLC",5/26/2015,Producer,ANDREWS,26664,0,0,Products,25,0,25,Tank Battery,Equipment Failure,Other,None,,"SEC 7, BLK A42, SUR PSL",DIG AND HAUL,THORNBERRY -7-,FUHRMAN-MASCHO
2015,531,8,ENERGEN RESOURCES CORPORATION,5/26/2015,Producer,GLASSCOCK,43257,0,0,Crude,11,6,5,Valve,Equipment Failure,Repaired Existing Equipment,None,,"31.674527, -101.348642","SHUT IN THE WELL, REPAIRED FLOWLINE, PICKED UP FLUID",JONES 46,SPRABERRY (TREND AREA)
2015,791,8,ENERGEN RESOURCES CORPORATION,5/26/2015,Producer,REEVES,46665,0,0,Crude,42,30,12,Tank Battery,Equipment Failure,Other,None,,"31.606858, -103.669551","REPLACED BLOWN FUSE, FIXED WELLHEAD, PICKED UP STANDING FLUID",PIPER STATE 54-14,PHANTOM (WOLFCAMP)
2015,600,7C,"PIONEER NATURAL RES. USA, INC.",5/26/2015,Producer,UPTON,15713,0,0,Crude,5,0,5,Tank Battery,Equipment Failure,Other,None,,"31.494125, 102.032691",BACKFILLING EXCAVATION,GIDDINGS ESTATE FEE 'A',SPRABERRY (TREND AREA)
2015,599,7C,"LAREDO PETROLEUM, INC.",5/26/2015,Producer,REAGAN,16734,0,0,Crude,15,10,5,Tank Battery,Equipment Failure,Other,None,,WELL 109,"BACKHOE BLENDING SOIL, PRESSURE SPRAYER, REMEDIATION",SUGG-B-,SPRABERRY (TREND AREA)
2015,618,8,ENCANA OIL & GAS(USA) INC.,5/26/2015,Producer,GLASSCOCK,42808,0,0,Crude,18,15,3,Tank Battery,Equipment Failure,Other,None,,"31.675462, -101.516224","VACUUM TRUCK, CLEAN UP WILL OCCUR ACCORDING TO REQUIREMENT",WILKINSON 31,SPRABERRY (TREND AREA)
2015,499,8,ENCANA OIL & GAS(USA) INC.,5/26/2015,Producer,MARTIN,43639,0,0,Crude,53,50,3,Tank Battery,Equipment Failure,Other,None,,"32.31776219, -102.1217848",DOUBLE D CONSTRUCTION HAS BEEN ASSIGNED THE CLEANUP & CLOSURE,DOROTHY FAYE A320,SPRABERRY (TREND AREA)
2015,1508,8A,OCCIDENTAL PERMIAN LTD.,5/26/2015,Producer,GAINES,18910,0,0,Crude,10,8,2,Tank Battery,Equipment Failure,Other,None,,"SEC 49, BLK AX, PUBLIC SCHOOL LAND",REMEDIAION,DENVER UNIT,WASSON
2015,569,3,"MAVERICK PROD. CO., INC.",5/26/2015,Producer,FORT BEND,24423,0,0,Crude,23,21,2,Tank Battery,Equipment Failure,Repaired Existing Equipment,None,,THOMAS HOBERMAKER SUR A-191,"INSTALLED NEW WATER LEG & PIPING, REMEDIATED SOIL","WEST-SCHENCK ""B""",BLUE RIDGE
2015,706,7C,APACHE CORPORATION,5/26/2015,Producer,REAGAN,6191,0,0,Crude,6,5,1,Flow Line,Equipment Failure,Other,None,,"31.6262, -101.5624","FREE FLUIDS RECOVERED, SOILS WILL BE BLENDED",MALONE -45-,SPRABERRY (TREND AREA)
2015,545,10,"COURSON OIL & GAS, INC.",5/25/2015,Producer,OCHILTREE,0,209468,0,Gas Well Liquid,44,0,44,Tank Battery,Act of God,Other,None,,"SEC 663, BLK 43, H&TC SUR",ROUSTABOUT CREW CLEANED UP LOCATION & HAULED OFF JUNK,BILL 663,DUDE WILSON (NOVI LIME)
2015,1264,1,EAGLE HYDROCARBONS INC.,5/25/2015,Producer,CALDWELL,15696,0,0,Crude,159,16,143,Tank Battery,Act of God,Other,None,,"HINDS, J, A-14","VAC, REMEDIATED FLUIDS W/ABSORBANTS, HAULED SOILS TO DISPOSAL SITE",NORTHCUTT DYE,SALT FLAT (EDWARDS)
2015,539,8,"PIONEER NATURAL RES. USA, INC.",5/25/2015,Producer,HOWARD,15400,0,0,Crude,15,13,2,Tank Battery,Equipment Failure,Other,None,,"31.58776, 101.731392","VACUUM TRUCK, BACKFILLING EXCAVATION",SPRABERRY DRIVER UNIT,SPRABERRY (TREND AREA)
