MasterYear,Form Number,District,OperatorNumber,DateofLoss,Type_Company_Cd,County,LeaseNumber,Gasident,CommNbr,TypeLiquid,GrossLoss,Recovered,Net Loss,Facility,CauseofLoss,Remedy,Water,WaterName,Location,Remarks,LeaseName,FieldNumber,FieldNumber,Into_Water,Unique_ID
2014,810,1,"K.A. BARNES OIL & GAS OPER, LLC",9/22/2014,Producer,BEXAR,10932,0,0,Crude,72,0,72,Tank Battery,Corrosion - Rust,Other,0,None,,GENEVIERE POWELL,"SOIL REMEDIATED INSIDE FIREWALL, REPLACED TANK",PERRY,SOMERSET,FALSE,63085
2014,772,8A,ZARVONA ENERGY LLC,9/21/2014,Producer,GAINES,65822,0,0,Combined,5,0,5,Tank Battery,Equipment Failure,Other,0,None,,"SEC 14, BLK G C&M RAILROAD COMPANY",WORKING ON REMEDIATION OPTIONS,"BUTCHEE, C. D. ""14""",LUPUS (SILURIAN),FALSE,63047
2014,802,8,"CROWNQUEST OPERATING, LLC",9/21/2014,Producer,MARTIN,45142,0,0,Combined,46,45,1,Tank Battery,Act of God,Other,0,None,,"SEC 6, BLK 34, T & P RR CO SURVEY","VACUUM TRUCK CALLED, REMEDIATE",BAKER 6,SPRABERRY (TREND AREA),FALSE,63077
2014,852,8A,SM ENERGY COMPANY,9/20/2014,Producer,GARZA,69653,0,0,Crude,24,22,2,Tank Battery,Equipment Failure,Other,0,None,,"SEC 12, BLK 10, E.L. & RR CO","VACUUM TRUCKS USED, PICK UP CONTAMINATED SOIL & GRAVEL",DANA,PEG'S DRAW (MISSISSIPPIAN),FALSE,63127
2014,894,7C,"PLAINS MARKETING, L.P.",9/20/2014,Transporter,REAGAN,0,0,0,Crude,75,70,5,Tank Battery,Human Error - Other,Other,0,None,,"31.2466, -101.6173",WILL BE BROUGHT TO SURFACE FOR ON SITE BIO REMEDIATION,MCELROY RANCH,NO FIELD NAME,FALSE,63169
2014,941,8,"DCP MIDSTREAM MARKETING, LLC",9/20/2014,Transporter,ECTOR,0,0,0,Combined,60,55,5,Tank Battery,Equipment Failure,Other,0,None,,"T&P RR CO SURVEY BLK 45, T1S, ABS A-1280","VACUUM TRUCK HAS REMOVED FREE FLUIDS, WILL DIRECT REMEDIAL ACTION ","HILL ""A""",NO FIELD NAME,FALSE,63216
2014,809,1,TALISMAN ENERGY USA INC.,9/20/2014,Producer,MCMULLEN,15838,0,0,Combined,75,70,5,Tank Battery,Equipment Failure,Other,0,None,,"24.480823, -98.466463",CONTAMINATED SOIL REMOVED,BRACKEN,EAGLEVILLE (EAGLE FORD-1),FALSE,63084
2014,1097,8A,APACHE CORPORATION,9/19/2014,Producer,HOCKLEY,6169,0,0,Crude,15,5,10,Tank Battery,Equipment Failure,Other,0,None,,"33.65473, -102.18627",FREE OIL REMOVED AND SOILS BEING BLENDED,"ELLWOOD ""A""",SMYER,FALSE,63372
2014,938,7B,"BASIC ENERGY SERVICES, L.P.",9/19/2014,Transporter,PALO PINTO,0,0,0,Combined,20,0,20,"Vehicle (Truck-Barge, Etc)",Human Error - Other,Other,0,None,,5.5 MILES EAST OF GRAFORD TX,REMEDIATE,"HILL ""A""",NO FIELD NAME,FALSE,63213
2014,1426,2,HOUSTON PIPE LINE COMPANY LP,9/19/2014,Transporter,LIVE OAK,0,0,0,Gas Well Liquid,10,0,10,Pipe Line,Corrosion - Rust,Other,0,None,,COUNTY RD 157,EXCAVATE ALL CONTAMINATED SOIL,WHITSETT-MASSENGALE UNIT,NO FIELD NAME,FALSE,63699
2014,811,2,HOUSTON PETROLEUM COMPANY,9/19/2014,Transporter,LIVE OAK,0,0,0,Gas Well Liquid,10,0,10,Pipe Line,Corrosion - Rust,Other,0,None,,COUNTY RD 157 OFF OF I-H 59 SOUTH,EXCAVATE ALL CONTAMINATED SOIL,PERRY,NO FIELD NAME,FALSE,63086
2014,1158,7C,LEGACY RESERVES OPERATING LP,9/19/2014,Producer,REAGAN,10096,0,0,Crude,100,20,80,Tank Battery,Act of God,Other,0,None,,"UL, BLK 2, SEC 33",SOIL AT SIGHT TILLED & BLENDED IN PLACE,UNIVERSITY 33,SPRABERRY (TREND AREA),FALSE,63433
2014,1380,8A,OCCIDENTAL PERMIAN LTD.,9/19/2014,Producer,YOAKUM,66222,0,0,Combined,10,5,5,Tank Battery,Equipment Failure,Other,0,None,,CENTRAL TANK BATTERY,SOIL HAS BEEN REMEDIATED,CENTRAL OWNBY UNIT,"OWNBY (CLEAR FORK, UPPER)",FALSE,63655
2014,860,2,MURPHY EXPL. & PROD. CO. - USA,9/18/2014,Producer,KARNES,9637,0,0,Crude,6,6,0,Other,Equipment Failure,Other,0,None,,"ABS 4, SURVEY, HERNANDEZ HRS A","FREE LIQUIDS WERE RECOVERED, AFFECTED SOIL REMOVED TO DISPOSAL",KAS UNIT NORTH,EAGLEVILLE (EAGLE FORD-2),FALSE,63135
2014,800,1,EAGLE HYDROCARBONS (TEXAS) INC.,9/18/2014,Producer,CALDWELL,15173,0,0,Crude,50,46,4,Tank Battery,Act of God,Other,0,None,,"HINDS, J. SURVEY A-14",VACUUM/REMEDIATED FLUIDS,SMITH B UNIT,SALT FLAT (EDWARDS),FALSE,63075
2014,912,8,"REGENCY GAS SERVICES WAHA, LP",9/18/2014,Transporter,REEVES,0,0,0,Crude,20,10,10,Tank Battery,Equipment Failure,Repaired Existing Equipment,0,None,,"31.384185, -103.332249","VACUUM TRUCK UTILIZED, CONTRACTED FOR SITE REMEDIATION",BERGER-PORTERFIELD,NO FIELD NAME,FALSE,63187
2014,755,8,"PIONEER NATURAL RES. USA, INC.",9/18/2014,Producer,GLASSCOCK,15400,0,0,Crude,21,13,8,Tank Battery,Equipment Failure,Other,0,None,,"31.675021, 101.745853",PERFORM CLEAN UP SOIL,SPRABERRY DRIVER UNIT,SPRABERRY (TREND AREA),FALSE,63030
2014,1314,4,"SATCO, INC.",9/17/2014,Producer,ZAPATA,4093,0,0,Crude,148,0,148,Tank Battery,Theft,Other,0,None,,RAFAEL VELA; SUR 102,STOLEN,"VELA, EMILIANO",DAVY CROCKETT (CROCKETT SD.),FALSE,63589
2014,778,7C,DIAMONDBACK E&P LLC,9/17/2014,Producer,UPTON,15800,0,0,Crude,40,20,20,Tank Battery,Equipment Failure,Other,0,None,,"31.29243, 101.93958","VACUUM TRUCKS CONTACTED, SITE CLEAN UP","NEAL ""8""",SPRABERRY (TREND AREA),FALSE,63053
2014,908,8A,OCCIDENTAL PERMIAN LTD.,9/17/2014,Producer,HOCKLEY,3780,0,0,Crude,10,3,7,Tank Battery,Equipment Failure,Other,0,None,,"LABOR 2, LEAGUE 44, RAINS CSL",VACUUM TRUCK PICKED UP STANDING FLUID & BACKHOE BLADED AREA,LEVELLAND UNIT,LEVELLAND,FALSE,63183
2014,953,3,"LINC GULF COAST PETROLEUM, INC.",9/17/2014,Producer,HARRIS,20069,0,0,Crude,25,0,25,Tank Battery,Equipment Failure,Other,0,None,,WILLIAM SCOTT LABOR A-67,EXTINGUISHED FIRE. TO CLEAN UP,"TABB ""B""",GOOSE CREEK,FALSE,63228
2014,763,1,"C6 OPERATING, L.L.C.",9/16/2014,Producer,FRIO,13384,0,0,Crude,150,0,150,Tank Battery,Theft,Other,0,None,,"M.J. TREVINO S - 1077, A-633",REPORTED TO FRIO CO SHERRIF'S OFFICE,"KING, ANNIE",PEARSALL (AUSTIN CHALK),FALSE,63038
2014,1244,7C,DISCOVERY NATURAL RESOURCES LLC,9/16/2014,Producer,REAGAN,18048,0,0,Crude,220,215,5,Tank Battery,Equipment Failure,Other,0,None,,"SEC 3048, BLK 24, A903, HT&C RR CO","FREE OIL RECOVERED, AREA WAS FLUSHED WITH FRESH WATER",HIGHLAND A,SPRABERRY (TREND AREA),FALSE,63519
2014,954,3,BHB OPERATING INC.,9/16/2014,Producer,HARDIN,246,0,0,Crude,10,9,1,Tank Battery,Equipment Failure,Other,0,None,,BLK 9 & 10 CHAMPION CHOATE,REMIEDIATED THE SOIL,GULF FEE,BATSON OLD,FALSE,63229
2014,776,10,"CHESAPEAKE OPERATING, INC.",9/16/2014,Producer,WHEELER,0,214442,0,Combined,10,1,9,Tank Battery,Equipment Failure,Other,0,None,,"SEC 69, BLK A7, H&GN, RR CO, A-335",REMEDIATION,ATHERTON 69,STILES RANCH (GRANITE WASH CONS),FALSE,63051
2014,757,8,OCCIDENTAL PERMIAN LTD.,9/16/2014,Producer,HOWARD,43313,0,0,Crude,8,0,8,Tank Battery,Company Human Error,Other,0,None,,"SEC 18, BLK A, SURVEY B&C","CONTAMINATED SOIL COLLECTED INTO A PILE, NATURAL REMEDIATION",CLAPTON,SPRABERRY (TREND AREA),FALSE,63032
2014,962,8,"BRIDGER TRANSPORTATION, LLC",9/16/2014,Transporter,HOWARD,0,0,0,Crude,8,0,8,"Vehicle (Truck-Barge, Etc)",Equipment Failure,Other,0,None,,"32.29755, 101.62936",VACUUM TRUCKS RECOVER RELEASED CRUDE OIL,CANTU B,NO FIELD NAME,FALSE,63237
2014,1372,10,"CONTINENTAL TREND RESOURCES, INC",9/16/2014,Producer,HARTLEY,9345,0,0,Crude,5,4,1,Tank Battery,Equipment Failure,Other,0,None,,"SEC 15, BLK 3, B&B","FLUIDS REMOVED, REMAINING SOIL BIOREMEDIATED",HOWARD 15,HARTLEY WEST (CANYON),FALSE,63647
2014,1115,3,"K-3 RESOURCES, LP",9/15/2014,Transporter,MATAGORDA,25290,0,0,Crude,5,5,0,Tank Battery,Act of God,Other,0,None,,195 FT FWL & 88 FT FSL OF PETER BERTRAND LEAGUE A-5,"MATERIAL SQUEEZED OFF, VACUUMED, RECYCLED INTO REPAIRED BATTERY","RICHERS, E.",HAMMAN,FALSE,63390
2014,759,8,"PARSLEY ENERGY OPERATIONS, LLC",9/15/2014,Producer,MARTIN,44325,0,0,Crude,35,0,35,Tank Battery,Company Human Error,Other,0,None,,"SECTION 40, BLK 36, T&P RR CO",REMEDIATE AREAS OF OILY RESIDUE,MARTIN 40,PETEY (FUSSELMAN),FALSE,63034
2014,836,10,"REGENCY ENERGY, INC.",9/15/2014,Other,HEMPHILL,0,0,0,Combined,17,16,1,Tank Battery,Human Error - Other,Other,0,None,,"SEC 28, BLK 41, H&TC",CONTAMINATED SOIL HAULED TO APPROVED LANDFILL DISPOSAL,NORTHWEST MALLET UNIT,NO FIELD NAME,FALSE,63111
2014,584,6,QEP ENERGY COMPANY,9/15/2014,Producer,HOUSTON,1835,0,0,Combined,5700,2,5698,Flow Line,Equipment Failure,Other,0,Creek,DILLARDCREEK,C.M. ELLIS SURVEY A-371,VACCUMED & CONTAINERIZED FOR OFFSITE DISPOSAL.,"HUFFMAN, L. W.",TRINITY,FALSE,62859
2014,1193,4,REGENCY FIELD SERVICES LLC,9/15/2014,Transporter,WEBB,0,0,0,Combined,60,0,60,Pipe Line,Company Human Error,Other,0,None,,B3 LTE,CLEANUP & REMEDIATION ACTIVITIES ARE UNDERWAY,KRISTEN,NO FIELD NAME,FALSE,63468
2014,819,6,"SAMSON LONE STAR, LLC",9/15/2014,Producer,PANOLA,0,190891,0,Gas Well Liquid,8,8,0,Tank Battery,Human Error - Other,Other,0,None,,"WM PRESSLEY SVY, A-556","VACUUM TRUCK REMOVED FLUIDS, REMEDIATE ON SITE","KELLER, C.","CARTHAGE, NORTH (COTTON VALLEY)",FALSE,63094
2014,801,6,"QUANTUM RESOURCES MANAGEMENT,LLC",9/15/2014,Producer,GREGG,8046,0,0,Crude,8,8,0,Pipe Line,Corrosion - Rust,Other,0,None,,"32.428197, -94.857797","SACKED UP CONTAMINATED DEBRIS, FLUSHING & VACUUMING SPILLED",SMITH B UNIT,NO FIELD NAME,FALSE,63076
2014,765,8,ENERGEN RESOURCES CORPORATION,9/14/2014,Producer,WARD,43750,0,0,Crude,8,7,1,Tank Battery,Equipment Failure,Other,0,None,,"31.535248, -103.217427","REPLACED WATER PUMP, PICKED UP ALL FREE STANDING FLUIDS,",UNIVERSITY 43-18,TWO GEORGES (BONE SPRING),FALSE,63040
2014,766,8,ENERGEN RESOURCES CORPORATION,9/14/2014,Producer,WARD,41768,0,0,Crude,22,20,2,Tank Battery,Company Human Error,Other,0,None,,"31.61077, -103.412949",MOVED OIL TO STORAGE TANKS PICKED UP FREE STANDING FLUIDS,GREER-MCGINLEY,TWO GEORGES (BONE SPRING),FALSE,63041
2014,760,8A,"WALSH PETROLEUM, INC.",9/14/2014,Producer,TERRY,69841,0,0,Crude,50,8,42,Tank Battery,Equipment Failure,Other,0,None,,GLIMP A BETTERY,"FLUID PICKED UP & REMOVED, REMEDIATE","GLIMP ""A""",KINGDOM (ABO REEF),FALSE,63035
2014,752,2,"PENN VIRGINIA OIL & GAS, L.P.",9/14/2014,Producer,LAVACA,10629,0,0,Crude,6,6,0,Tank Battery,Corrosion - Rust,Other,0,None,,D. BURKETT A-4,VACUUM UP OIL TREATED SOIL,STAG HUNTER,EAGLEVILLE (EAGLE FORD-2),FALSE,63027
2014,1156,3,APACHE CORPORATION,9/14/2014,Producer,BURLESON,0,142758,0,Crude,1,1,0,Tank Battery,Corrosion - Rust,Other,0,None,,L. PORTER,"PULLED BY VACUUM TRUCK, SOIL WAS PRESSURED WASHED","PORTER, L. GAS UNIT",LYONS (GEORGETOWN),FALSE,63431
2014,1191,4,REGENCY FIELD SERVICES LLC,9/13/2014,Transporter,WEBB,0,0,0,Combined,15,0,15,Pipe Line,Other,Other,0,None,,B4 LTW TO B5 LTE,CLEANUP AND REMEDIATION ACTIVITIES ARE UNDERWAY,KRISTEN,NO FIELD NAME,FALSE,63466
2014,761,8A,ENERGEN RESOURCES CORPORATION,9/13/2014,Producer,TERRY,60014,0,0,Crude,42,31,11,Tank Battery,Equipment Failure,Other,0,None,,"32.480254, -101.757866","FREE STANDING FLUIDS, PICKED UP CONTAMINATED DIRT",WIGGINS,ACKERLY (DEAN SAND),FALSE,63036
2014,1367,9,"ATLAS BARNETT, LLC",9/13/2014,Producer,JACK,32223,0,0,Crude,93,90,3,Tank Battery,Equipment Failure,Other,0,None,,"RIVES, T A-505","VAC TRUCK, TILLING, FRESH SOIL, TREATING W/REMEDIATION PRODUCTS",SEWELL A,KRS (MARBLE FALLS),FALSE,63642
2014,1250,7C,"PIONEER NATURAL RES. USA, INC.",9/13/2014,Producer,REAGAN,16524,0,0,Crude,30,25,5,Tank Battery,Equipment Failure,Other,0,None,,HWY 67/FM 1555,REMEDIATION,"UNIVERSITY ""3-14""",SPRABERRY (TREND AREA),FALSE,63525
2014,780,7C,"PARSLEY ENERGY OPERATIONS, LLC",9/12/2014,Producer,UPTON,18192,0,0,Crude,15,14,1,Tank Battery,Company Human Error,Other,0,None,,"SEC 11, BLK D, D&W RR CO SURVEY","RECOVERED LIQUID WITH VACUUM TRUCK, WILL REMEDIATE",HALL 11,SPRABERRY (TREND AREA),FALSE,63055
2014,594,8,ENERGEN RESOURCES CORPORATION,9/11/2014,Producer,MARTIN,38895,0,0,Crude,559,150,409,Tank Battery,Human Error - Other,Repaired Existing Equipment,0,None,,"32.346900, -102.012207","WELLS SHUT IN LINE REPAIRED, PICKED UP ALL FREE STANDING FLUIDS",JONES-HOLTON,SPRABERRY (TREND AREA),FALSE,62869
2014,762,1,MARATHON OIL EF LLC,9/11/2014,Producer,ATASCOSA,17021,0,0,Crude,10,10,0,Valve,Equipment Failure,Other,0,None,,WELLHEAD,VACUUM TRUCK REMOVED FREE LIQUIDS CONTAMINATED SOIL REMOVED,WRIGHT-HENKE UNIT,EAGLEVILLE (EAGLE FORD-1),FALSE,63037
2014,1129,7C,"EP ENERGY E&P COMPANY, L.P.",9/10/2014,Producer,CROCKETT,17576,0,0,Crude,20,20,0,Tank Battery,Equipment Failure,Other,0,None,,UNIVERSITY EAST 47-18 AH,"IMPACTED SOIL EXCAVATED, TREATED AND BACKFILLED",UNIVERSITY EAST,LIN (WOLFCAMP),FALSE,63404
2014,777,10,"CHESAPEAKE OPERATING, INC.",9/10/2014,Producer,WHEELER,0,253293,0,Combined,18,9,9,Tank Battery,Human Error - Other,Other,0,None,,"SEC 23, BLK A3, H&GN RR CO A-206,",REMEDIATION,STILES RANCH 23,STILES RANCH (GRANITE WASH CONS),FALSE,63052
2014,767,8,ENDEAVOR ENERGY RESOURCES L.P.,9/10/2014,Producer,MIDLAND,42837,0,0,Crude,3,0,3,Tank Battery,Equipment Failure,Other,0,None,,"32.0143425, -102.2053417",REMEDIATION IN PROGRESS,"SCHARBAUER ""C-27""",SPRABERRY (TREND AREA),FALSE,63042
2014,741,8,"NADEL AND GUSSMAN PERMIAN,L.L.C.",9/10/2014,Producer,ANDREWS,32576,0,0,Crude,2,0,2,Other,Equipment Failure,Repaired Existing Equipment,0,None,,"SEC 1, BLK 9, UNIVERSITY LANDS SURVEY","SHUT WELL IN, RECOVERED FLUID",UNIVERSITY -JB-,UNIVERSITY BLOCK 9 (PENN.),FALSE,63016
2014,896,7C,"AMERICAN ENERGY-PERM BASIN, LLC",9/10/2014,Producer,REAGAN,17946,0,0,Crude,8,7,1,Tank Battery,Equipment Failure,Other,0,None,,"311713.27, 1013643.70",REMEDIATION PLAN IS BEING DISCUSSED,UNIVERSITY 09,LIN (WOLFCAMP),FALSE,63171
2014,782,7C,"LAREDO PETROLEUM, INC.",9/9/2014,Producer,REAGAN,17027,0,0,Crude,93,88,5,Separator-Gun Barrel-Treater,Equipment Failure,Other,0,None,,WELL #2SU,"FREE OIL RECOVERED, BACKHOE & CREW BEGUN INITIAL REMEDIATION",GRAHAM,SPRABERRY (TREND AREA),FALSE,63057
2014,1382,8A,OXY USA INC.,9/9/2014,Producer,HOCKLEY,6014,0,0,Crude,20,18,2,Tank Battery,Equipment Failure,Other,0,None,,"LEAGUE 39, LABOR 42, MAVARICK CSL","VAC TRUCK, BACKHOE BLADED AREA, REMEDIATION","SLAUGHTER, S. A. ""B""",SLAUGHTER,FALSE,63657
2014,795,8,"KINDER MORGAN CO2 COMPANY, L.P.",9/9/2014,Transporter,LOVING,0,0,0,Crude,17,0,17,Tank Battery,Corrosion - Rust,Other,0,None,,"3148.0980, 10347.8079",REMEDIATE THE SPILL,DORA ROBERTS RANCH UNIT,NO FIELD NAME,FALSE,63070
2014,875,8A,OCCIDENTAL PERMIAN LTD.,9/9/2014,Producer,HOCKLEY,6014,0,0,Crude,20,18,2,Tank Battery,Equipment Failure,Other,0,None,,"LEAGUE 39, LABOR 42, MAVERICK CSL","VAC TRUCK PICKED UP FLUID & BACKHOE BLENDED AREA, REMEDIATION","SLAUGHTER, S. A. ""B""",SLAUGHTER,FALSE,63150
2014,804,10,LE NORMAN OPERATING LLC,9/9/2014,Producer,HEMPHILL,7403,0,0,Crude,6,3,3,Tank Battery,Equipment Failure,Other,0,None,,"SEC 54, BLK A1, H&GN RR CO SURVEY",ONSITE REMEDIATION UTILIZING OIL ABSORBING MATERIALS,"FLOWERS ""A""",HEMPHILL (DOUGLAS),FALSE,63079
2014,781,7C,"LAREDO PETROLEUM, INC.",9/9/2014,Producer,REAGAN,17577,0,0,Crude,33,23,10,Tank Battery,Equipment Failure,Other,0,None,,100 BATTERY,"FREE OIL RECOVERED, BACKHOE & CREW BLENDING SOILS, FURTHER REMED",BODINE-B-,SPRABERRY (TREND AREA),FALSE,63056
2014,814,8,"PIONEER NATURAL RES. USA, INC.",9/8/2014,Producer,MIDLAND,32990,0,0,Crude,260,250,10,Tank Battery,Equipment Failure,Other,0,None,,RUCHANAN R-2,WILL REMEDIATE,"BUCHANAN ""R""",SPRABERRY (TREND AREA),FALSE,63089
2014,1046,7C,CALLON PETROLEUM OPERATING CO,9/8/2014,Producer,REAGAN,18248,0,0,Crude,20,7,13,Valve,Equipment Failure,Other,0,None,,"SEC 9, ABS 184","VAC TRUCKS CALLED, ENHANCE REMEDIATION",PEMBROOK 9121 POOLED UNIT,LIN (WOLFCAMP),FALSE,63321
2014,1245,7C,DISCOVERY NATURAL RESOURCES LLC,9/8/2014,Producer,REAGAN,16833,0,0,Crude,15,13,2,Tank Battery,Equipment Failure,Other,0,None,,"SEC 3035, BLK 24, A210, HT&C RR CO SURVEY","FREE PRODUCT RECOVERED, AREA WAS FLUSHED WITH FRESH WATER",TEPEE DRAW,SPRABERRY (TREND AREA),FALSE,63520
2014,1002,8,OXY USA WTP LP,9/8/2014,Producer,REEVES,43761,0,0,Crude,70,70,0,Tank Battery,Equipment Failure,Other,0,None,,"SEC 25, BLK 50, T7S, T&P RR CO SURVEY","PICK UP FLUID, MIX AND TIL","VJ RANCH-SABLE ""25""",BALMORHEA RANCH (BELL CANYON L),FALSE,63277
2014,1424,1,NEWFIELD EXPLORATION COMPANY,9/8/2014,Transporter,MAVERICK,0,0,0,Combined,35,35,0,Tank Battery,Corrosion - Rust,Other,0,None,,"D.A. DERIVAS GRANT SUR, SEC 30, ABS A-788","WTR PUMPED FROM THE LINED PIT INTO GUN BARREL TANK, FLUID RECOVERD","O'CONNOR, TOM (5800 SD) FLD UNIT",NO FIELD NAME,FALSE,63697
2014,829,7C,"PLAINS MARKETING, L.P.",9/8/2014,Transporter,IRION,0,0,0,Crude,17,0,17,Tank Battery,Company Human Error,Other,0,None,,"31.31356, -101.22902",BROGHT TO SURFACE FOR ON SITE BIO REMEDIATION,"SUGG ""214""",NO FIELD NAME,FALSE,63104
2014,1287,10,WO OPERATING COMPANY,9/8/2014,Producer,GRAY,6661,0,0,Crude,35,0,35,Tank Battery,Equipment Failure,Other,0,None,,204/B2/H&GN,AREA MIXED AND TILLED - AREA REMEDIATED,EAKIN,PANHANDLE GRAY COUNTY FIELD,FALSE,63562
2014,1374,8A,OXY USA WTP LP,9/8/2014,Producer,YOAKUM,19308,0,0,Crude,8,0,8,Tank Battery,Equipment Failure,Other,0,None,,WILLARD UNIT 54E,"REMEDIATED THE SOIL,",WILLARD UNIT,WASSON,FALSE,63649
2014,689,8,"BASIC ENERGY SERVICES, L.P.",9/7/2014,Other,MARTIN,40521,0,0,Combined,150,145,5,Other,Corrosion - Rust,Other,0,None,,"SEC 10, BLK 3B T-1-S T&P RR CO SURVEY","STANDING WATER WAS VACUUMED UP, REMEDIATION START",YATER SWD,SPRABERRY (TREND AREA),FALSE,62964
2014,731,8A,"WALSH PETROLEUM, INC.",9/7/2014,Producer,YOAKUM,69170,0,0,Combined,52,50,2,Tank Battery,Act of God,Other,0,None,,"SEC 477, BLK D, J.H. GIBSON","LIQUIDS RECOVERED, REMEDIATE",COY LOWE,"BRAHANEY, EAST (SAN ANDRES)",FALSE,63006
2014,774,8,"BLUESTONE NATURAL RES. II, LLC",9/7/2014,Producer,GAINES,0,0,5714,Crude,53,45,8,Tank Battery,Equipment Failure,Other,0,None,,"BROWN, T. A-133",REMEDIATE,UNIVERSITY 5036,NO FIELD NAME,FALSE,63049
2014,730,8A,HESS CORPORATION,9/7/2014,Producer,GAINES,60475,0,0,Crude,6,5,1,Flow Line,Equipment Failure,Other,0,None,,"SEC 221, BLK G, WTRR SURVEY","FLUIDS RECOVERED WITH VACUUM TRUCK, SOILS EXCAVATED & MIXED",SEMINOLE SAN ANDRES UNIT,SEMINOLE (SAN ANDRES),FALSE,63005
2014,732,8,ENERGEN RESOURCES CORPORATION,9/6/2014,Producer,ANDREWS,21220,0,0,Crude,5,4,1,Flow Line,Equipment Failure,Repaired Existing Equipment,0,None,,"32.218600, -102.711085","REPAIRED CLAMP, RECOVER OIL & WATER",WEST FUHRMAN-MASCHO UNIT,FUHRMAN-MASCHO,FALSE,63007
2014,939,7C,"ATLAS PL MID-CONT. WESTTEX, LLC",9/6/2014,Other,REAGAN,0,0,0,Crude,85,83,2,Pipe Line,Company Human Error,Other,0,None,,"SEC 98, BLK 1, T & P RR CO","USED VACUUM TRUCK, BLENDED SOILS FROM MIST SPRAY","HILL ""A""",NO FIELD NAME,FALSE,63214
2014,1209,8,SHELL WESTERN E&P,9/6/2014,Producer,REEVES,26148,0,0,Crude,10,5,5,Tank Battery,Human Error - Other,Other,0,None,,"31.69265, 103.82457","VACUUM TRUCK REMOVED OIL, SOILS EXCAVATED, REMEDIATION",MEEKER,"ORLA, SOUTHEAST (DELAWARE)",FALSE,63484
2014,821,4,"SWIFT ENERGY OPERATING, LLC",9/5/2014,Producer,MCMULLEN,0,0,5149,Crude,10,1,9,Tank Battery,Equipment Failure,Other,0,None,,"28.226501, -99.200169",REMEDIAL MEASURE TAKEN,BRACKEN,NO FIELD NAME,FALSE,63096
2014,758,8,OXY USA WTP LP,9/5/2014,Producer,MIDLAND,34635,0,0,Crude,35,30,5,Flow Line,Company Human Error,Other,0,None,,6' STILL LINE,"PICK UP FLUID, MIX & TILL",DORA ROBERTS RANCH UNIT,DORA ROBERTS (CONSOLIDATED),FALSE,63033
2014,768,8,FOUNDATION ENERGY MANAGEMENT LLC,9/5/2014,Producer,GLASSCOCK,44392,0,0,Crude,22,20,2,Tank Battery,Equipment Failure,Repaired Existing Equipment,0,None,,"SEC 29, BLK 30, W. & N.W. RR CO ABS A-504","VAC TRUCK CALLED OUT, HOLE TO BE FIXED",CR FOSTER A,CLYDE-REYNOLDS (WOLFCAMP CONS.),FALSE,63043
2014,1048,7C,CALLON PETROLEUM OPERATING CO,9/5/2014,Producer,CROCKETT,16143,0,0,Crude,180,0,180,Tank Battery,Theft,Other,0,None,,"SEC 26, BLK 5, SURVEY UL",POLICE WERE INFORMED,UNIVERSITYSARAH,SHEEP MOUNTAIN (CONSOLIDATED),FALSE,63323
2014,764,8,SHELL WESTERN E&P,9/5/2014,Producer,REEVES,26148,0,0,Crude,10,5,5,Tank Battery,Corrosion - Rust,Other,0,None,,"SECT 28, LOT 56, T&P SURVEY","VACUUM TRUCK REMOVED FREE OIL, EXCAVATED, REMEDIATION",MEEKER,"ORLA, SOUTHEAST (DELAWARE)",FALSE,63039
2014,820,1,TALISMAN ENERGY USA INC.,9/5/2014,Producer,MCMULLEN,15838,0,0,Combined,18,15,3,Tank Battery,Equipment Failure,Repaired Existing Equipment,0,None,,"282850.98, 982759.22",CAM LOCK & HOSE WERE REPLACED. VAC TRUCK USED,BRACKEN,EAGLEVILLE (EAGLE FORD-1),FALSE,63095
2014,935,3,"MOMENTUM OPERATING CO., INC.",9/4/2014,Producer,BRAZORIA,24891,0,0,Crude,2,2,0,Tank Battery,Company Human Error,Other,0,None,,"W.H. SNIDER SURVEY, A-370","ALL OIL STAINED DIRT TILLED, TURNED, & REMEDIATED",SHARPSHOOTER,"HASTINGS, EAST",FALSE,63210
2014,1271,8,QUICKSILVER RESOURCES INC.,9/4/2014,Producer,PECOS,45959,0,0,Crude,25,25,0,Tank Battery,Human Error - Other,Other,0,None,,"SEC 17, BLK 131, ABS 2286, SUR T&STL RR CO","AREA BERMED, DUG THE AFFECTED AREA",STALLINGS,WOLFBONE (TREND AREA),FALSE,63546
2014,840,2,BURLINGTON RESOURCES O & G CO LP,9/4/2014,Producer,LIVE OAK,0,258556,0,Crude,8,5,3,Valve,Company Human Error,Other,0,None,,JAMES INGRAM SURVEY ABS A-261,"CONTAMINATED PAD REMOVED, NEW PAD BROUGHT IN",KUNDE UNIT A,SUGARKANE (AUSTIN CHALK),FALSE,63115
2014,940,7C,CENTURION PIPELINE L.P.,9/3/2014,Transporter,REAGAN,0,0,0,Crude,300,230,70,Pipe Line,Company Human Error,Other,0,None,,"SEC 48, BLK 37, T5S, T&PRRCO",BLENDED WITH CLEAN SOIL,"HILL ""A""",NO FIELD NAME,FALSE,63215
2014,700,1,"SN OPERATING, LLC",9/3/2014,Producer,ZAVALA,16060,0,0,Crude,100,0,100,Tank Battery,Theft,Other,0,None,,"SEC 285, BUB P SURVEY A682",CACULATED 100 BBLS WENT MISSING,MARK & SANDRA UNIT,BRISCOE RANCH (EAGLEFORD),FALSE,62975
2014,792,8,"PIONEER NATURAL RES. USA, INC.",9/3/2014,Producer,MIDLAND,15254,0,0,Crude,20,17,3,Tank Battery,Equipment Failure,Other,0,None,,"31.7332, -101.8906",REMEDIATE,MIDKIFF UNIT,SPRABERRY (TREND AREA),FALSE,63067
2014,771,10,"DCP MIDSTREAM MARKETING, LLC",9/3/2014,Other,OCHILTREE,0,0,0,Combined,7,0,7,Pipe Line,Corrosion - Rust,Other,0,None,,"SEC 575, BLK 43, SURVEY H&TC",CONTAMINATED SOILS WILL BE REMEDIATED,E. BAKER 'A',NO FIELD NAME,FALSE,63046
2014,742,8A,MEMORIAL PRODUCTION OPER. LLC,9/3/2014,Producer,HOCKLEY,65013,0,0,Crude,63,0,63,Tank Battery,Corrosion - Rust,Other,0,None,,COPELAND FARMS TANK BATTERY,"HOLE IN CIRCULATING LINE, REMEDIATE",COPELAND FARMS,"WHITHARRAL (CLEAR FORK, LO.)",FALSE,63017
2014,784,7C,"LAREDO PETROLEUM, INC.",9/3/2014,Producer,REAGAN,17379,0,0,Crude,12,0,12,Tank Battery,Company Human Error,Other,0,None,,13 TANK BATTERY,TREATED IMPACTED SOIL WITH AN ENHANCED BIOREMED LIQUID CHEMICAL,JUSTIN LEE MCMASTER-C-,SPRABERRY (TREND AREA),FALSE,63059
2014,743,8A,MEMORIAL PRODUCTION OPER. LLC,9/2/2014,Producer,TERRY,63221,0,0,Crude,18,12,6,Tank Battery,Equipment Failure,Other,0,None,,"SEC 15, BLK D14, SURVEY C&M RR CO","CLEAN UP FLUIDS W/VACUUM TRUCK, BACK DRAG,",NORTHWEST TERRY (ABO) UNIT,KINGDOM (ABO REEF),FALSE,63018
2014,1134,2,SABINE OIL & GAS LLC,9/2/2014,Producer,DE WITT,0,0,5823,Gas Well Liquid,20,20,0,Tank Battery,Human Error - Other,Other,0,None,,"JOHNSON, N B A-280",VACUUM TRUCK CLEANED UP ALL CONDENSATE,SEVENGILLS 55-1-25,NO FIELD NAME,FALSE,63409
2014,1001,6,FOREST OIL CORPORATION,9/2/2014,Producer,RUSK,0,213668,0,Crude,3,0,3,Tank Battery,Act of God,Other,0,None,,"J.C. MALONE, A-595","CLEARED, SCRAPED AND/OR EXCAVATED",LAKE GAS UNIT 1,"HENDERSON, E. (COTTON VALLEY)",FALSE,63276
2014,675,8,"W&T OFFSHORE, INC.",9/2/2014,Producer,MARTIN,40184,0,0,Crude,30,27,3,Tank Battery,Equipment Failure,Repaired Existing Equipment,0,None,,"SECTION 15, BLOCK 6, UNIVERSITY LAND","HOSE REPLACED, CLEAN UP WAS DONE IMMEDIATELY",UNIVERSITY 6-15,SPRABERRY (TREND AREA),FALSE,62950
2014,698,10,"MGE RESOURCES, INC.",9/2/2014,Producer,OCHILTREE,0,217263,0,Crude,15,12,3,Stuffing Box,Equipment Failure,Other,0,None,,"SEC 1, BLK 12, A-107, SUR H&GN RR CO",REMOVED DIRT & OIL SOAKED DIRT & DISPOSED,MARVIN,PERRYTON (ST. LOUIS),FALSE,62973
2014,684,8,ENDEAVOR ENERGY RESOURCES L.P.,9/1/2014,Producer,LOVING,40119,0,0,Crude,315,290,25,Tank Battery,Equipment Failure,Other,0,None,,"32.549710, -101.868000",REMIEDIATION IN PROGRESS,"KOGER ""32""",SPRABERRY (TREND AREA),FALSE,62959
2014,685,8,ENDEAVOR ENERGY RESOURCES L.P.,8/31/2014,Producer,ECTOR,27968,0,0,Crude,150,55,95,Tank Battery,Corrosion - Rust,Repaired Existing Equipment,0,None,,"32.0503196, -102.3448508",REMEDIATION IN PROGRESS,FASKEN -32-,"CIRCLE BAR, EAST (ATOKA)",FALSE,62960
2014,933,1,"STONE, J. G. OIL CO.",8/31/2014,Producer,EDWARDS,3407,0,0,Crude,185,65,120,Tank Battery,Equipment Failure,Other,0,None,,"SECTION 164, CCSD & RGNGRR CO SURVEY A-2402",WILL REMEDIATE THE OIL ON SITE,"TURNEY, PAUL, MRS. RANCH",TURNEY,FALSE,63208
2014,681,8,R K PETROLEUM CORP.,8/31/2014,Producer,MARTIN,24785,0,0,Crude,30,25,5,Tank Battery,Equipment Failure,Other,0,None,,"32.3372108, -101.9537158",REMEDIATION IS CURRENT WORK IN PROGRESS,"COX,EDWIN",RK (DEVONIAN),FALSE,62956
2014,680,8,BHP BILLITON PET(TXLA OP) CO,8/30/2014,Producer,LOVING,0,270387,0,Crude,20,20,0,Tank Battery,Equipment Failure,Other,0,None,,"SECTION 14, BLOCK 57","VACUUM TRUCK CALLED, NO CLEAN UP TO SOIL IS NEEDED",ABERNATHY 57-T1-14,PHANTOM (WOLFCAMP),FALSE,62955
2014,785,7C,"LAREDO PETROLEUM, INC.",8/30/2014,Producer,REAGAN,17289,0,0,Crude,25,20,5,Tank Battery,Equipment Failure,Other,0,None,,190 BATTERY,"FREE OIL RECOVERED, TREATED W/AN ENHANCED LIQUID BIO-REMEDIATION",BOOK,SPRABERRY (TREND AREA),FALSE,63060
2014,677,8,ENDEAVOR ENERGY RESOURCES L.P.,8/30/2014,Producer,MIDLAND,37082,0,0,Crude,20,0,20,Tank Battery,Equipment Failure,Other,0,None,,"32.0171515, -101.9968908",REMEDIATION IN PROGRESS,"MCDONALD ""46"" # 1",SPRABERRY (TREND AREA),FALSE,62952
2014,989,8,XTO ENERGY INC.,8/30/2014,Producer,ANDREWS,1770,0,0,Crude,22,18,4,Tank Battery,Equipment Failure,Other,0,None,,"SEC 2, BLK 13, UNIVERSITY LANDS","FLUID RECOVERED BY VACUUM TRUCK, CALICHE BROUGHT IN TO REMEDIATE",FULLERTON CLEARFORK UNIT,FULLERTON,FALSE,63264
2014,740,9,XTO ENERGY INC.,8/29/2014,Producer,GRAYSON,17174,0,0,Crude,20,0,20,Flow Line,Corrosion - Rust,Other,0,None,,CRUDE OIL TRANSFER (TRUNK) LINE,"COLLECTED, BLENDED, AND REMEDIATED","HEAD, J. M. ESTATE",SHERMAN,FALSE,63015
