MasterYear,Form Number,District,OperatorNumber,DateofLoss,Type_Company_Cd,County,LeaseNumber,Gasident,CommNbr,TypeLiquid,GrossLoss,Recovered,Net Loss,Facility,CauseofLoss,Remedy,Water,WaterName,Location,Remarks,LeaseName,FieldNumber
2015,954,8A,ENTERPRISE PRODUCTS OPERATINGLLC,8/31/2015,Transporter,COCHRAN,0,0,0,Combined,7,0,7,Tank Battery,Equipment Failure,Other,None,,"31.522468, -103.466068","SHUT DOWN, LIQUIDS SENT TO DISPOSAL, SOIL REMOVED","WRIGHT, J.M. UNIT",NO FIELD NAME
2015,1020,7C,"PARSLEY ENERGY OPERATIONS, LLC",8/31/2015,Producer,REAGAN,16730,0,0,Crude,36,25,11,Tank Battery,Equipment Failure,Other,None,,"SEC 4, BLK 4.5 SUR GC&SF RR CO","VAC TRUCK, REMEDIATE THE IMPACTED AREA",SHEEPSHEAD,BENEDUM (SPRABERRY)
2015,927,1,"EXCO OPERATING COMPANY, LP",8/30/2015,Producer,FRIO,15623,0,0,Crude,97,85,12,Tank Battery,Corrosion - Rust,Other,None,,"28.8451, -99.3621","VAC UP, REMEDIATION CURRENTLY IN PROCESS",MONTE LENOSO FRO,BRISCOE RANCH (EAGLEFORD)
2015,1289,1,SABINE OIL & GAS CORPORATION,8/29/2015,Producer,GONZALES,18163,0,0,Crude,20,19,1,Tank Battery,Equipment Failure,Other,None,,"ARMSTEAD, RS ABS A-87","VAC TRUCK, PAD MATERIALS WERE BACK DRAGGED, ABSORBENTS APPLIED",SPRINGS-PATTESON (AW1),EAGLEVILLE (EAGLE FORD-1)
2015,947,8,ENCANA OIL & GAS(USA) INC.,8/29/2015,Producer,MARTIN,37553,0,0,Crude,408,66,342,Tank Battery,Act of God,Other,None,,"32.349777, -102.126481","VAC TRUCK, CONFINED WITHIN FIRE WALLS",HOLT RANCH -S-,P RANCH (DEVONIAN)
2015,1291,1,GOODRICH PETROLEUM COMPANY,8/29/2015,Producer,LA SALLE,15361,0,0,Crude,25,24,1,Tank Battery,Equipment Failure,Other,None,,"SEC 7, ABS 603, POITEVENT, J.","VAC TRUCK, TREATED WITH ABSORBENT MATERIAL & MICORBIAL REMEDIATION",BURNS RANCH A,BRISCOE RANCH (EAGLEFORD)
2015,968,8A,"TEXLAND PETROLEUM, L.P.",8/28/2015,Producer,GAINES,66731,0,0,Crude,3,0,3,Tank Battery,Act of God,Other,None,,"SEC 2, BLK A-10","VAC TRUCK, BIOREMEDIATION COMPANY CONTACTED TO REMEDIATE",BRANEX/AMERICAN,"STOCKYARD (CLEARFORK, UPPER)"
2015,959,8,ENCANA OIL & GAS(USA) INC.,8/28/2015,Producer,GLASSCOCK,41366,0,0,Crude,25,18,7,Tank Battery,Equipment Failure,Other,None,,"31.768065, -101.532895","SHUT IN, VAC TRUCK,",HIGHT 42,SPRABERRY (TREND AREA)
2015,1408,7C,SUMMIT PETROLEUM LLC,8/27/2015,Producer,UPTON,16756,0,0,Crude,35,20,15,Valve,Human Error - Other,Other,None,,"SEC 26, BLK 42, T&P RR CO","VAC TRUCK, BACKHOE SPRED FRESH DIRT, REMIDIAL RECOMMENDATIONS",NANCY,SPRABERRY (TREND AREA)
2015,932,8,OXY USA INC.,8/27/2015,Producer,GLASSCOCK,39670,0,0,Crude,6,3,3,Flow Line,Corrosion - Rust,Other,None,,"SEC 17, BLK 35, SUR T&P RR CO ABS 301",ON SITE ENHANCED BIOREMEDIATION,ABEL,SPRABERRY (TREND AREA)
2015,1010,7C,"PIONEER NATURAL RES. USA, INC.",8/27/2015,Producer,UPTON,17382,0,0,Crude,50,49,1,Tank Battery,Equipment Failure,Other,None,,"31.2673, -101.7897",REMEDIATION,"UNIVERSITY ""3-19""",SPRABERRY (TREND AREA)
2015,1539,8,ENERGEN RESOURCES CORPORATION,8/26/2015,Producer,HOWARD,2894,0,0,Crude,140,0,140,Tank Battery,Equipment Failure,Other,None,,"32.289606, -101.209016","SHUT OUT SEPARATOR, REPLACE DUMP VALVES, MOVE SCRUBBER",MURRAY B,"IATAN, EAST HOWARD"
2015,943,8,ENCANA OIL & GAS(USA) INC.,8/26/2015,Producer,MIDLAND,34576,0,0,Crude,20,15,5,Tank Battery,Equipment Failure,Other,None,,"31.676310, -102.090756","VAC TRUCK, REMEDIATION WILL COMMENCE","DAVIDSON ""27""",SPRABERRY (TREND AREA)
2015,1163,6,AETHON ENERGY OPERATING LLC,8/26/2015,Producer,SHELBY,0,247335,0,Crude,40,0,40,Tank Battery,Act of God,Other,None,,"31.737117, -94.060693","OBTAINING COST TO REPLACED DAMAGED EQUIP, WILL ENSURE SOIL CLEANED",POWELL,HUXLEY (6100)
2015,1569,8A,CHEVRON U. S. A. INC.,8/25/2015,Producer,HOCKLEY,67166,0,0,Crude,7,6,1,Tank Battery,Equipment Failure,Other,None,,SUNDOWN SLAUGHTER UNIT,"VALVE CLOSED, ISOLATED, VAC TRUCK,",SUNDOWN SLAUGHTER UNIT,SLAUGHTER
2015,935,8,"PIONEER NATURAL RES. USA, INC.",8/25/2015,Producer,GLASSCOCK,15400,0,0,Crude,10,7,3,Tank Battery,Corrosion - Rust,Other,None,,"31.699585, 101.712604","VAC TRUCK, EXCAVATED & BLENDED,",SPRABERRY DRIVER UNIT,SPRABERRY (TREND AREA)
2015,936,8,"GREYSTONE OIL & GAS, LLP",8/25/2015,Producer,ANDREWS,38734,0,0,Crude,5,3,2,Valve,Equipment Failure,Other,None,,CRUDE OIL WELL HEAD,INSTALED HI PRESSURE STUFFING BOX & PACKING,STATE FK,EMMA (ELLENBURGER)
2015,937,8,ENCANA OIL & GAS(USA) INC.,8/25/2015,Producer,MIDLAND,6652,0,0,Crude,55,50,5,Tank Battery,Equipment Failure,Other,None,,"31.912046, -102.134363","VAC TRUCK, SPILL REMEDIATION IS ON GOING","POWELL, R. V. ETAL",SPRABERRY (TREND AREA)
2015,1198,7C,APACHE CORPORATION,8/25/2015,Producer,REAGAN,18900,0,0,Crude,7,5,2,Tank Battery,Equipment Failure,Other,None,,"31.3159, -101.6160","FLUIDS RECOVERED, MICROBIAL ADDITIVE TO ENHANCE BIOREMEDIATION",UNIVERSITY 2303 E HZ UNIT,SPRABERRY (TREND AREA)
2015,939,8,ENERGEN RESOURCES CORPORATION,8/24/2015,Producer,GLASSCOCK,39953,0,0,Crude,20,13,7,Tank Battery,Act of God,Other,None,,"31.710916, -101.496730","PUT THE FIRE OUT, PICK UP AS MUCH FREESTANDING FLUID AS POSSIBLE",CANADIAN,SPRABERRY (TREND AREA)
2015,938,8,ENERGEN RESOURCES CORPORATION,8/24/2015,Producer,REEVES,45512,0,0,Crude,71,70,1,Tank Battery,Equipment Failure,Other,None,,"31.534266, -103.648054",RESTORED POWER & PICKED UP AS MUCH FREESTANDING FLUID AS POSSIBLE ,ENTERPRISE C19-5,PHANTOM (WOLFCAMP)
2015,922,1,"EXCO OPERATING COMPANY, LP",8/24/2015,Producer,DIMMIT,15375,0,0,Combined,188,0,188,Tank Battery,Equipment Failure,Other,None,,"28.6039, -99.8878",MIXED & TILLED THE SOIL WITH SLF-100 REMEDIATION PRODUCT,PENA CREEK I,BRISCOE RANCH (EAGLEFORD)
2015,946,8A,HESS SEMINOLE ASSETS LLC,8/24/2015,Producer,GAINES,62085,0,0,Crude,67,12,55,Tank Battery,Equipment Failure,Other,None,,"SEC 230, BLK G, WTRR SUR,","VAC TRUCK, EXCAVATED & MIXED","SEMINOLE DEEP ""C""",SEMINOLE (DEVONIAN)
2015,909,7C,KIRKPATRICK OIL COMPANY,8/24/2015,Producer,REAGAN,14018,0,0,Crude,29,20,9,Tank Battery,Equipment Failure,Other,None,,MERCHANT 11,"VAC TRUCK, ROUSTABOUT CREW TILLED ABSORBENT MATERIAL",MERCHANT -11-,SPRABERRY (TREND AREA)
2015,908,7C,DISCOVERY NATURAL RESOURCES LLC,8/24/2015,Producer,IRION,17945,0,0,Combined,65,40,25,Tank Battery,Equipment Failure,Other,None,,"BLK 1, T&P RR CO SUR 83","VAC TRUCK, FLUSHED WITH HOT WATER, SKIM OIL, REMEDIATION",WINDY POINT,SPRABERRY (TREND AREA)
2015,969,8A,MEMORIAL PRODUCTION OPER. LLC,8/24/2015,Producer,TERRY,60487,0,0,Combined,370,360,10,Tank Battery,Equipment Failure,Other,None,,"31.185080, 102.335868",VACUUM & RESURFACE,"POOL, LOUISE ET AL","PRENTICE, NW. (SAN ANDRES)"
2015,1022,7C,"PIONEER NATURAL RES. USA, INC.",8/23/2015,Producer,REAGAN,17531,0,0,Crude,28,20,8,Tank Battery,Equipment Failure,Other,None,,"31.277821, -101.47705","VAC TRUCK, EXCAVATED & BLENDED WITH FRESH SOIL, BIOREMEDIATION AID","UNIVERSITY ""10-19""",SPRABERRY (TREND AREA)
2015,885,10,"TAPSTONE ENERGY, LLC",8/23/2015,Producer,WHEELER,8776,0,0,Gas Well Liquid,12,8,4,Tank Battery,Equipment Failure,Other,None,,"SEC 3, BLK A3, H&GN SUR","VAC TRUCK, REMEDIATION",STILES 3,MILLS RANCH (GRANITE WASH CONS.)
2015,956,8,ENTERPRISE PRODUCTS OPERATINGLLC,8/23/2015,Transporter,WINKLER,0,0,0,Combined,10,0,10,Pipe Line,Act of God,Other,None,,"31.79267, -103.07260","FIRE DEPT RESPONDED, REMOVAL OF IMPACTED SOIL,","TXL ""N"" 39-2",NO FIELD NAME
2015,972,6,XTO ENERGY INC.,8/23/2015,Producer,FRANKLIN,15028,0,0,Crude,12,7,5,Tank Battery,Equipment Failure,Other,None,,"33.34077, 095.18642","FLUIDS PICKED UP, FLUSHED WITH FRESH WATER & OILY AREA STABILIZED ",TALCO WEST UNIT,TALCO
2015,962,8,ENTERPRISE PRODUCTS TEXAS OP LLC,8/23/2015,Transporter,WARD,0,0,0,Combined,10,0,10,Pipe Line,Corrosion - Rust,Other,None,,"31.62290, -103.26300",AFFECTED SOIL REMOVED,LONG 13,NO FIELD NAME
2015,907,7C,"LAREDO PETROLEUM, INC.",8/22/2015,Producer,REAGAN,17216,0,0,Crude,15,11,4,Stuffing Box,Equipment Failure,Other,None,,WELL #13-O,"FLUID RECOVERED, BACKHOE BLENDING, REMEDIATION WILL CONTINUE",JUSTIN LEE MCMASTER-A-,SPRABERRY (TREND AREA)
2015,925,2,MARATHON OIL EF LLC,8/22/2015,Producer,KARNES,10060,0,0,Crude,12,0,12,Flow Line,Corrosion - Rust,Other,None,,"28.525915164, 97.562195005","CLAMP WAS PLACED, CHEMICAL TREATMENT PROGRAM WAS IMPLEMENTED",SPAHN-MIKKELSON UNIT,EAGLEVILLE (EAGLE FORD-2)
2015,1561,8A,OCCIDENTAL PERMIAN LTD.,8/22/2015,Producer,YOAKUM,60864,0,0,Crude,110,100,10,Tank Battery,Equipment Failure,Other,None,,"SEC 21, BLK D, JOHN H GIBSON",REMEDIATED,PRENTICE (6700 CLEARFORK) UNIT,PRENTICE (6700)
2015,1099,8,APACHE CORPORATION,8/22/2015,Producer,ANDREWS,37324,0,0,Crude,55,50,5,Tank Battery,Corrosion - Rust,Other,None,,"32.35172, -102.598773","FREE FLUIDS RECOVERED, SOILS WILL BE BLENDED","LINK, L. C.",ANDREWS (WOLFCAMP-PENN.)
2015,1191,7C,"PARSLEY ENERGY OPERATIONS, LLC",8/20/2015,Producer,UPTON,18578,0,0,Crude,50,40,10,Tank Battery,Equipment Failure,Other,None,,"SEC 16, BLK 39, T-5-S, A-1404 T&P RR CO","VAC TRUCK, WILL REMEDIATE IMPACTED AREA",ELWOOD 16,SPRABERRY (TREND AREA) R 40 EXC
2015,944,8A,OCCIDENTAL PERMIAN LTD.,8/20/2015,Producer,HOCKLEY,3780,0,0,Crude,1,0,1,Tank Battery,Equipment Failure,Other,None,,"LABOR 12, LEAGUE 69","VAC TRUCK, BACKHOE BLADED AREA, REMEDIATION",LEVELLAND UNIT,LEVELLAND
2015,1090,8,XTO ENERGY INC.,8/20/2015,Producer,ANDREWS,1770,0,0,Crude,110,100,10,Flow Line,Equipment Failure,Other,None,,"SEC 8, BLK A32, PSL SUR",REMOVED CONTAMINATED SOIL & REPLACED WITH CLEAN SOIL,FULLERTON CLEARFORK UNIT,FULLERTON
2015,888,4,"CANTERA OPERATING, LLC",8/20/2015,Producer,HIDALGO,0,123615,0,Gas Well Liquid,60,35,25,Tank Battery,Act of God,Other,None,,"ZAMORA STATE 3, J.B.F. MCMILLAN, W.D. PARCHMAN #883, ABS 726",REMOVE DAMAGED TANKS & CONTAMINATED SOIL,ZAMORA-STATE,"FLORES (VICKSBURG, LOWER)"
2015,940,8,"WHITE, CECIL",8/20/2015,Producer,WINKLER,35046,0,0,Crude,226,66,160,Tank Battery,Vandalism,Other,None,,"SEC 37, BLK 21, UL SUR","CALLED SHERRIFF OFFICE, VAC TRUCK, HAULED IN CALICHE TO REMEDIATE ","CHEVRON UNIVERSITY ""37""",WAR-WINK (CHERRY CANYON)
2015,949,8,"PARSLEY ENERGY OPERATIONS, LLC",8/19/2015,Producer,MIDLAND,22629,0,0,Crude,19,15,4,Tank Battery,Equipment Failure,Other,None,,"SEC 41, BLK 37, T1S, T&P RR","VAC TRUCK, REMEDIATE IMPACTED AREA, CALICHE & BLENDING","MCALISTER, O. H., -C-",SPRABERRY (TREND AREA)
2015,906,7C,"PIONEER NATURAL RES. USA, INC.",8/18/2015,Producer,UPTON,16349,0,0,Crude,8,4,4,Flow Line,Equipment Failure,Other,None,,"31.447523, 102.017901",BACKFILLING EXCAVATION,XBC GIDDINGS ESTATE,SPRABERRY (TREND AREA)
2015,882,8,PRIME OPERATING COMPANY,8/17/2015,Producer,MARTIN,39849,0,0,Crude,7,0,7,Tank Battery,Equipment Failure,Other,None,,"SEC 18, BLK 38, T & P RR CO SUR A-860",REMEDIATION & ENVIRONMENTAL XPERTS LLC CLEANING UP SITE,PINKERTON,SPRABERRY (TREND AREA)
2015,948,8,"PARSLEY ENERGY OPERATIONS, LLC",8/17/2015,Producer,MIDLAND,27179,0,0,Crude,15,10,5,Tank Battery,Corrosion - Rust,Other,None,,"BLK 38, T2S B F WOLCOTT SUR","VAC TRUCK, REMEDIATE THE IMPACTED AREA, CALICHE & BLENDING",HANKS,SPRABERRY (TREND AREA)
2015,941,8,ENERGEN RESOURCES CORPORATION,8/17/2015,Producer,MITCHELL,20831,0,0,Crude,5,0,5,Tank Battery,Equipment Failure,Repaired Existing Equipment,None,,"32.417090, -101.63629","SHUT IN BATTERY, REPLACE THE ELECTRICAL CARD, PICKED UP FLUID",NORTH WESTBROOK UNIT,WESTBROOK
2015,881,8,ANADARKO E&P ONSHORE LLC,8/17/2015,Producer,WARD,39975,0,0,Combined,10,10,0,Tank Battery,Equipment Failure,Other,None,,"31.560821, -103.3625531","RECOVERED FREE STANDING FLUIDS, REMEDIATE SOIL",MONROE 34-210,PHANTOM (WOLFCAMP)
2015,929,1,CARRIZO (EAGLE FORD) LLC,8/17/2015,Producer,LA SALLE,0,0,5602,Crude,46,0,46,Tank Battery,Theft,Other,None,,"SEC 277, BLK 787","NO RUN TICKET LEFT, NO TRUCKING FOR THIS LEASE,","SMITH, JOEY",NO FIELD NAME
2015,1438,8,"SHERIDAN PRODUCTION COMPANY, LLC",8/16/2015,Producer,HOWARD,41063,0,0,Crude,12,10,2,Other,Equipment Failure,Other,None,,"32.550.69, 101.202738","SCRAPED UP PUT ON PLASTIC, BLENDED WITH FRESH SOIL",WARDER,HOWARD GLASSCOCK (CONSOLIDATED)
2015,1496,8,"SHERIDAN PRODUCTION COMPANY, LLC",8/16/2015,Producer,ANDREWS,21365,0,0,Crude,34,33,1,Tank Battery,Equipment Failure,Other,None,,"32.179324, -102.712218","DIG AND HAUL, BLENDING ON SITE",SOUTH FUHRMAN MASCHO UNIT,FUHRMAN-MASCHO
2015,963,8,ENTERPRISE PRODUCTS TEXAS OP LLC,8/15/2015,Other,REEVES,0,0,0,Combined,5,0,5,Pipe Line,Corrosion - Rust,Other,None,,"31.79125, -103.94576","AFFECTED SOIL WILL BE REMOVED, BLOWN DOWN FOR REPAIR",LONG 13,NO FIELD NAME
2015,1407,7C,LEGACY RESERVES OPERATING LP,8/15/2015,Producer,UPTON,12189,0,0,Crude,15,0,15,Tank Battery,Act of God,Other,None,,"SEC 46, BLK 40",REMOVE CONTAMINATED DIRT AND FILL BACK IN,"DAVIDSON ""86""",SPRABERRY (TREND AREA)
2015,945,8,"LAREDO PETROLEUM, INC.",8/15/2015,Producer,GLASSCOCK,43299,0,0,Crude,160,138,22,Flow Line,Equipment Failure,Other,None,,WELL #1 LOCATION,"OIL & WTR RECOVERED, SURFACTANT FLUSH, BACKHOE BLENDED ALL SOIL",GLASS 214,JAILHOUSE (FUSSELMAN)
2015,1293,1,JENEX PETROLEUM CORPORATION,8/15/2015,Producer,FRIO,802,0,0,Combined,15,15,0,Tank Battery,Equipment Failure,Other,None,,"GC&SF RR CO SUR NO 3, A-803","VAC TRUCK, DELINEATED & EXCAVATED AFFECTED SOIL, REMOVED SOIL","BURNS, JANE -B-",KYOTE
2015,934,8,OXY USA INC.,8/14/2015,Producer,MARTIN,43669,0,0,Crude,11,7,4,Tank Battery,Corrosion - Rust,Other,None,,"SEC 28, BLK 34, SUR T&P RR CO",ON SITE ENHANCED BIOREMEDIATION,WRIGHT,SPRABERRY (TREND AREA)
2015,1335,8,XTO ENERGY INC.,8/14/2015,Producer,MIDLAND,39040,0,0,Crude,6,5,1,Tank Battery,Equipment Failure,Other,None,,"SEC 29, BLK 40, T1S, T&P RR CO","VAC TRUCK, BACKHOE TO REMEDIATE SOIL",NOBLES,SPRABERRY (TREND AREA)
2015,884,8,"PIONEER NATURAL RES. USA, INC.",8/14/2015,Producer,MIDLAND,32122,0,0,Crude,23,20,3,Tank Battery,Equipment Failure,Other,None,,"32.047950, -102.008311","VAC TRUCK, EXCAVATED, BLENDED WITH FRESH SOIL, BIOREMEDIATION AID ","ELKIN ""L""",SPRABERRY (TREND AREA)
2015,880,8,"LRE OPERATING, LLC",8/13/2015,Producer,CRANE,36606,0,0,Crude,220,100,120,Tank Battery,Equipment Failure,Other,None,,"SEC 48, BLK X, CCSD&RGNG RR CO",REMOVE CONTAMINATED SOIL & HAUL TO LANDFARM,"COWDEN RANCH ""48""",ROEPKE (UPPER DEVONIAN)
2015,904,7C,SUMMIT PETROLEUM LLC,8/13/2015,Producer,UPTON,16008,0,0,Crude,240,73,167,Tank Battery,Equipment Failure,Other,None,,"SEC 5, BLK 41, T & P RR CO","VACUUMED OIL, SCRAPPED LOCATION, REMEDIAL PROCEDURE",CYNTHIA,SPRABERRY (TREND AREA)
2015,905,7C,"DEVON ENERGY PRODUCTION CO, L.P.",8/13/2015,Producer,REAGAN,17793,0,0,Crude,10,10,0,Tank Battery,Equipment Failure,Other,None,,"BLK 43, SEC 15","VAC FLUIDS, ROUSTABOUT CREW UTILIZED STREAM THE LINER",UNIVERSITY 43-15,LIN (WOLFCAMP)
2015,1552,8A,OXY USA WTP LP,8/13/2015,Producer,YOAKUM,19308,0,0,Crude,5,0,5,Tank Battery,Equipment Failure,Other,None,,"SEC 737, BLK D, JOHN H GIBSON SUR",SOIL REMEDIATED,WILLARD UNIT,WASSON
2015,933,8,OXY USA INC.,8/13/2015,Producer,HOWARD,43916,0,0,Crude,9,3,6,Tank Battery,Equipment Failure,Other,None,,"SEC 31, BLK 34, SUR T&P RR CO ABS 418",ON SITE ENHANCED BIOREMEDIATION,FRYAR,SPRABERRY (TREND AREA)
2015,1030,3,"SHIDLER, MARK L., INC.",8/13/2015,Producer,WHARTON,0,146623,0,Crude,23,0,23,Tank Battery,Theft,Other,None,,"J. BOENISH SUR NO 52, A-635",FILED REPORT WITH WHARTON COUNTY SHERIFF'S DEPARTMENT,PATOS GAS UNIT,EAGLE'S CLAW (YEGUA)
2015,854,8A,OXY USA WTP LP,8/13/2015,Producer,DAWSON,14783,0,0,Crude,25,20,5,Tank Battery,Equipment Failure,Other,None,,WWU TR 58,"PICKED UP FREE LIQUIDS, MIXING FRESH SOIL",WEST WELCH UNIT,WELCH
2015,877,10,"CHAPARRAL ENERGY, L.L.C.",8/12/2015,Producer,OCHILTREE,9347,0,0,Crude,11,10,1,Tank Battery,Equipment Failure,Other,None,,"SEC 1099, BLK 43, A-301 H&TC","FLUID PICKED UP, FRESH SOIL, OIL ABSORBENT",PERRY 1014,ALLEN-PARKER (MARMATON)
2015,924,2,MARATHON OIL EF LLC,8/12/2015,Producer,KARNES,9876,0,0,Crude,650,70,580,Pipe Line,Corrosion - Rust,Other,None,,"28.502837554, 98.022100061","CLAMP WAS PLACED, CHEMICAL TREATMENT PROGRAM IMPLEMENTED",BEAM-MEYER UNIT,EAGLEVILLE (EAGLE FORD-2)
2015,874,10,"CHAPARRAL ENERGY, L.L.C.",8/12/2015,Producer,OCHILTREE,2959,0,0,Crude,36,35,1,Valve,Equipment Failure,Other,None,,WELLHEAD,"FLUID PICKED UP, OIL ABSORB, FRESH SOIL HAVE BEEN TILLED INTO",FARNSWORTH UNIT,FARNSWORTH (MORROW UPPER)
2015,849,8,MEMORIAL PRODUCTION OPER. LLC,8/11/2015,Producer,LOVING,38547,0,0,Combined,700,0,700,Tank Battery,Equipment Failure,Repaired Existing Equipment,None,,"31.513400, -103.292000",REPLACED WITH NEW POLY LINE,RENDOVA STATE,DIMMITT (DELAWARE CONS)
2015,942,8,"LAREDO PETROLEUM, INC.",8/11/2015,Producer,GLASSCOCK,41973,0,0,Crude,50,36,14,Tank Battery,Equipment Failure,Other,None,,39 TANK BATTERY,"RECOVERED FREE OIL, WASHED PASTURE, BACKHOE, REMEDIATION",W. JOST OIL UNIT,SPRABERRY (TREND AREA)
2015,915,1,"SN OPERATING, LLC",8/11/2015,Producer,LA SALLE,15457,0,0,Crude,279,0,279,Tank Battery,Theft,Other,None,,"SEC 658, CCSD&RGNG RR CO",OIL STOLEN,BRIDWELL LIMITED UNIT,EAGLEVILLE (EAGLE FORD-1)
2015,857,8,"PLAINS MARKETING, L.P.",8/11/2015,Transporter,LOVING,0,0,0,Crude,19,0,19,Tank Battery,Equipment Failure,Other,None,,"31.7102, 103.3783",BROUGHT TO THE SURFACE FOR ON SITE BIO REMEDIATION,CALVERLEY -A-,NO FIELD NAME
2015,1568,8A,CHEVRON U. S. A. INC.,8/11/2015,Producer,HOCKLEY,60271,0,0,Crude,9,9,0,Tank Battery,Corrosion - Rust,Other,None,,POST MONTGOMERY BATTERY,"VAC TRUCK, LINE REPAIRED AND RETURNED TO SERVICE",POST-MONTGOMERY,LEVELLAND
2015,923,2,MARATHON OIL EF LLC,8/11/2015,Producer,KARNES,9596,0,0,Crude,10,0,10,Flow Line,Corrosion - Rust,Other,None,,"28.4723, 98.023583952","CLAMP PLACED, CHEMICAL TREATMENT IMPLEMENTED",TURNBULL UNIT A,EAGLEVILLE (EAGLE FORD-2)
2015,1037,4,"HIGH PLAINS GAS SYSTEMS, INC.",8/11/2015,Producer,SAN PATRICIO,8948,0,0,Crude,35,32,3,Tank Battery,Equipment Failure,Other,None,,BLK 1 OF TP MCCAMPBELL SUBDIVISION,"WASHED, FREE OIL RECOVERED, HAULED, ABSORBENT PADS",USHER,ARANSAS PASS
2015,879,7B,WALTER EXPLORATION COMPANY,8/10/2015,Producer,NOLAN,30048,0,0,Crude,8,0,8,Tank Battery,Equipment Failure,Other,None,,"SEC 95, BLK 21, T&P RR CO",REMEDIATION,JOE YOUNG,MONROE-YOUNG (STRAWN)
2015,870,8,OXY USA WTP LP,8/10/2015,Producer,REEVES,40370,0,0,Combined,20,6,14,Tank Battery,Equipment Failure,Other,None,,"SEC 41, BLK 51 T7S, SUR T&P RR CO",RECOVER FLUIDS & REMEDIATE IN PLACE,CHEVRON MINERALS 41,WOLFBONE (TREND AREA)
2015,1009,7C,PLAINS PIPELINE L.P.,8/10/2015,Transporter,UPTON,0,0,0,Crude,15,0,15,Tank Battery,Corrosion - Rust,Other,None,,"31.136905, -102.19236",BROUGHT TO SURFACE FOR ON SITE BIO REMEDIATION,"HANSON, VIVIAN BIGBY",NO FIELD NAME
2015,1197,7C,APACHE CORPORATION,8/10/2015,Producer,REAGAN,14552,0,0,Crude,8,3,5,Tank Battery,Equipment Failure,Other,None,,"31.532486, -101.645913","FLUIDS RECOVERED, OIL ABSORBENT ADDED, BLENDING & TILLING",SAU 28-4,SPRABERRY (TREND AREA)
2015,878,7B,WALTER EXPLORATION COMPANY,8/10/2015,Producer,NOLAN,30389,0,0,Crude,10,0,10,Tank Battery,Equipment Failure,Other,None,,"SEC 95, BLK 21, T&P RR CO",REMEDIATION,JOE YOUNG,HARDROCK (KING SAND)
2015,852,8,ENERGEN RESOURCES CORPORATION,8/10/2015,Producer,WARD,41411,0,0,Crude,21,20,1,Tank Battery,Equipment Failure,Other,None,,"31.642905, -103.421111","REPAIRED DUMP VALVE, PICKED UP FREE STANDING FLUID",PRUETT 23,TWO GEORGES (BONE SPRING)
2015,867,8,RKI EXPLORATION & PRODUCTION LLC,8/10/2015,Producer,LOVING,46522,0,0,Combined,135,135,0,Tank Battery,Equipment Failure,Other,None,,"SEC 2, BLK 56, T.1. T&P RAILWAY SUR","VAC TRUCK,",CBR 2,PHANTOM (WOLFCAMP)
2015,830,10,"CHESAPEAKE OPERATING, L.L.C.",8/10/2015,Producer,HEMPHILL,0,271488,0,Crude,25,0,25,Tank Battery,Corrosion - Rust,Other,None,,"SEC 29, BLK 43, H&TC RR CO",REMEDIATION WILL TAKE PALCE,VIOLET 29 HMH,"LIPSCOMB, S.E. (CLEVELAND)"
2015,869,8,OXY USA INC.,8/9/2015,Producer,WARD,27230,0,0,Combined,10,6,4,Tank Battery,Equipment Failure,Other,None,,PRIEST E BATTERY,RECOVER FLUIDS & REMEDIATE IN PLACE,PRIEST -E-,COLLIE (DELAWARE)
2015,871,8A,OCCIDENTAL PERMIAN LTD.,8/9/2015,Producer,GAINES,18910,0,0,Crude,15,10,5,Pipe Line,Corrosion - Rust,Other,None,,DENVER UNIT 76C HEADER 4,"VAC TRUCK, REMEDIATION",DENVER UNIT,WASSON
2015,903,7C,UNIT PETROLEUM COMPANY,8/9/2015,Producer,CROCKETT,4348,0,0,Crude,80,0,80,Tank Battery,Equipment Failure,Other,None,,"30.85074677, -101.51427877","EXCAVATE SOIL, REMEDIATION WILL BE PERFORMED","TODD, J. S.",TODD (SAN ANDRES)
2015,850,8,MEMORIAL PRODUCTION OPER. LLC,8/9/2015,Producer,WINKLER,42564,0,0,Crude,15,13,2,Tank Battery,Equipment Failure,Other,None,,"31.50172, 103.103443","CONTAINED, VACCUMN & RESURFACE, HEADSWITCH WAS REPAIRED",HENDRICK 32 SWD,HENDRICK
2015,1002,8A,KATY RESOURCES LLC,8/9/2015,Producer,DAWSON,62373,0,0,Crude,279,0,279,Tank Battery,Act of God,Other,None,,"SEC 10, BLK C-38, PUBLIC SCHOOL LANDS","REMEDIATED SOIL, REPLACED WITH NEW SOIL, DISPOSED OF AT FACILITY","DRENNAN ""40""",WELCH
2015,1023,7C,HENRY RESOURCES LLC,8/9/2015,Producer,REAGAN,17807,0,0,Crude,8,2,6,Tank Battery,Equipment Failure,Other,None,,"SEC 21, BLK 07, UNIVERSITY LANDS","VAC TRUCK, TILLED, REMEDIATED,",UNIVKEISHA,SPRABERRY (TREND AREA)
2015,868,8,ANADARKO E&P ONSHORE LLC,8/8/2015,Producer,REEVES,45238,0,0,Crude,10,10,0,Tank Battery,Equipment Failure,Other,None,,"31.3054139, -103.2657583","RECOVERED STANDING FLUIDS, WASH CONTAINMENT & DISPOSE",BILL WATSON 1,WOLFBONE (TREND AREA)
2015,950,8,OXY USA INC.,8/7/2015,Producer,ANDREWS,39295,0,0,Crude,30,20,10,Tank Battery,Equipment Failure,Other,None,,"32.360006, -102.4125","REMOVAL FROM SPILL SITE, ON SITE NATURAL BIOREMEDIATION",UNIVERSITYCAITLIN,SAINT WILMA (STRAWN)
2015,1491,8,"SHERIDAN PRODUCTION COMPANY, LLC",8/7/2015,Producer,ANDREWS,10871,0,0,Crude,10,0,10,Flow Line,Corrosion - Rust,Other,None,,"3216.4317, 10241.0585",DIG AND HAUL,"KUYKENDALL, J. W.",FUHRMAN-MASCHO
2015,855,8,ENERGEN RESOURCES CORPORATION,8/6/2015,Producer,GLASSCOCK,31951,0,0,Crude,30,5,25,Tank Battery,Corrosion - Rust,Other,None,,"31.833772, -101.726027","SHUT OUT TANK, PICKED UP AS MUCH FREESTANDING FLUID AS POSSIBLE",CALVERLEY -A-,SPRABERRY (TREND AREA)
2015,902,7C,ANADARKO E&P ONSHORE LLC,8/6/2015,Producer,CROCKETT,10412,0,0,Crude,15,10,5,Tank Battery,Equipment Failure,Other,None,,"30.772947, -101.214897","VACUUMED UP, TREATED WITH REMEDIAL AGENT","BAGGETT ""C""","OZONA, NW. (CANYON)"
2015,853,8,"7S OIL & GAS, LLC",8/6/2015,Producer,PECOS,23369,0,0,Crude,8,4,4,Tank Battery,Equipment Failure,Other,None,,"SEC 36, BLK 3, H&TC",K&G WAS CALLED OUT TO CLEAN THE SPILL,"PVOC ""LUKE""",PECOS VALLEY (LOW GRAVITY)
2015,920,2,"PENN VIRGINIA OIL & GAS, L.P.",8/6/2015,Producer,LAVACA,9701,0,0,Crude,30,28,2,Tank Battery,Company Human Error,Other,None,,"STRODE, W 52","VAC TRUCK, GRAVEL WITHIN LINED FIREWALL HAULED OFF & DISPOSED OF",ORYX HUNTER,EAGLEVILLE (EAGLE FORD-2)
2015,970,8A,"PLAINS MARKETING, L.P.",8/6/2015,Transporter,BORDEN,0,0,0,Crude,10,0,10,Tank Battery,Corrosion - Rust,Other,None,,"32.66835, -101.62436",WILL BE BROUGHT TO SURFACE FOR ON SITE BIO REMEDIATION,"POOL, LOUISE ET AL",NO FIELD NAME
2015,1103,8,APACHE CORPORATION,8/5/2015,Producer,WINKLER,13866,0,0,Crude,30,30,0,Tank Battery,Act of God,Other,None,,"31.873575, -103070011","FREE FLUIDS RECOVERED, SOILS WILL BE BLENDED","CAMPBELL, SETH",KEYSTONE (CLEAR FORK)
2015,860,8,OXY USA INC.,8/5/2015,Producer,REEVES,27167,0,0,Crude,67,65,2,Tank Battery,Equipment Failure,Other,None,,"SEC 2, BLK 6, SURVEY H&GN RR CO RANDALS, B",SOILY DIRT REMOVED DOWN TO CLEAN DIRT,PERKINS -F-,COLLIE (DELAWARE)
2015,1040,4,"EOG RESOURCES, INC.",8/5/2015,Producer,KLEBERG,0,197918,0,Crude,35,35,0,Pipe Line,Equipment Failure,Other,None,,"27.343325, -98.023841","PICKED UP FREE STANDING FLUIDS, CONTAMINATED SOIL HAULED OFF",KING RANCH CANELO,CANELO (I-08)
2015,891,4,"DCP MIDSTREAM, LP",8/5/2015,Transporter,NUECES,0,0,0,Gas Well Liquid,6,6,0,Tank Battery,Corrosion - Rust,Other,None,,"27.6230705, -97.9021434","VAC TRUCK, EXCAVATED AREA BACKFILLED & GEOTEXTILE MATERIAL",Z&T 20,NO FIELD NAME
2015,872,8A,OCCIDENTAL PERMIAN LTD.,8/5/2015,Producer,HOCKLEY,66895,0,0,Crude,77,75,2,Tank Battery,Equipment Failure,Other,None,,"LABOR 1, LEAGUE 30","VAC TRUCK, BACKHOE BLADED AREA, REMEDIATION",JACKSON,LEVELLAND
2015,873,8A,OCCIDENTAL PERMIAN LTD.,8/5/2015,Producer,GAINES,18910,0,0,Crude,30,25,5,Tank Battery,Equipment Failure,Other,None,,DENVER UNIT WTR INJ STATION #6,REMEDIATION,DENVER UNIT,WASSON
2015,1566,8,"FASKEN OIL AND RANCH, LTD.",8/4/2015,Producer,ANDREWS,21010,0,0,Combined,35,20,15,Tank Battery,Equipment Failure,Other,None,,"SEC 10, BLK 8, UNIVERSITY LAND SUR","ALARMS FIXED, LIQUIDS PICKED UP, HYDROCARBONS DELINEATED",STATE UNIVERSITY HUTEX CONS.,HUTEX (DEVONIAN)
2015,1101,8,APACHE CORPORATION,8/4/2015,Producer,WINKLER,13866,0,0,Crude,10,10,0,Tank Battery,Equipment Failure,Other,None,,"31.876356, -103.060913","SYSTEM SHUT DOWN, FIRE DEPARTMENT CALLED. ALLOWED FIRE TO BURN OUT","CAMPBELL, SETH",KEYSTONE (CLEAR FORK)
2015,1100,8A,APACHE CORPORATION,8/4/2015,Producer,COCHRAN,6035,0,0,Crude,20,15,5,Pipe Line,Equipment Failure,Other,None,,"33.504131, -102.735719","FREE FLUIDS RECOVERED, SOILS WILL BE BLENDED","DEAN, C. S. ""A""",SLAUGHTER
2015,846,9,"DEVON ENERGY PRODUCTION CO, L.P.",8/4/2015,Producer,WISE,0,136993,0,Combined,53,10,43,Tank Battery,Equipment Failure,Other,None,,"33.113330, -97.525070",WELL SHUT IN CONTAINMENT & LOCATION CLEANED UP,"PATTERSON, M. L.","NEWARK, EAST (BARNETT SHALE)"
2015,900,7C,"PARSLEY ENERGY OPERATIONS, LLC",8/4/2015,Producer,UPTON,18916,0,0,Crude,11,5,6,Tank Battery,Corrosion - Rust,Other,None,,"SEC 25, BLK B, A-1487","VAC TRUCK, REMEDIATE, BLENDING WITH CLEAN CALICHE",MORGAN 25,SPRABERRY (TREND AREA) R 40 EXC
2015,1102,8,APACHE CORPORATION,8/3/2015,Producer,WINKLER,13866,0,0,Crude,13,10,3,Tank Battery,Equipment Failure,Other,None,,"31.876356, -103.060913","FREE FLUIDS RECOVERED, SOILS WILL BE BLENDED","CAMPBELL, SETH",KEYSTONE (CLEAR FORK)
