MasterYear,Form Number,District,OperatorNumber,DateofLoss,Type_Company_Cd,County,LeaseNumber,Gasident,CommNbr,TypeLiquid,GrossLoss,Recovered,Net Loss,Facility,CauseofLoss,Remedy,Water,WaterName,Location,Remarks,LeaseName,FieldNumber,FieldNumber,Into_Water,Unique_ID
2014,296,10,EXXCEL PRODUCTION COMPANY,7/8/2014,Producer,WHEELER,1409,0,0,Crude,143,0,143,Tank Battery,Theft,Other,0,None,,W/2 NE/4 SECTION 49 BLK 24 H&GN SUR,THEFT FROM TANKS. 88 BBLS OF CRUDE OIL & 55 BBLS OF CONDENSATE.,WILLIAMS,PANHANDLE WHEELER COUNTY FIELD,FALSE,62595
2014,640,1,"SN OPERATING, LLC",7/8/2014,Producer,LA SALLE,15655,0,0,Crude,40,20,20,Pipe Line,Equipment Failure,Other,0,None,,WRIGHT RANCH C-7,"REMOVED & DISPOSE OF SOIL, BLENDED",WRIGHT RANCH,EAGLEVILLE (EAGLE FORD-1),FALSE,62915
2014,593,8,ENDEAVOR ENERGY RESOURCES L.P.,7/8/2014,Producer,MIDLAND,0,180362,0,Crude,90,75,15,Pipe Line,Human Error - Other,Other,0,None,,"31.572347, -1023074621",REMEDIATION IN PROGRESS,"INDUSTRIAL ""A""","MIDLAND, SW. (DEVONIAN)",FALSE,62868
2014,543,7B,APACHE CORPORATION,7/7/2014,Producer,FISHER,11416,0,0,Crude,20,10,10,Tank Battery,Equipment Failure,Other,0,None,,"32.86566, -100.28133",VACUUM TRUCK RECOVERED FREE FLUIDS. HEAVY EQUIPMENT USED TO BLEND ,ROUND TOP /PALO PINTO REEF/,ROUND TOP (PALO PINTO REEF),FALSE,62818
2014,1335,8A,OCCIDENTAL PERMIAN LTD.,7/7/2014,Producer,YOAKUM,62541,0,0,Crude,20,0,20,Tank Battery,Corrosion - Rust,Other,0,None,,"SEC 760, BLK D, J.H. GIBSON SUR",SOIL WAS REMEDIATED,GIBSON UNIT,WASSON 72,FALSE,63610
2014,397,8,"PLAINS MARKETING, L.P.",7/6/2014,Transporter,WARD,0,0,0,Crude,10,0,10,Pump Station or Terminal,Equipment Failure,Other,0,None,,"N 31.51489, W 103.45635","VALVE ON HEADER OPEN, BROUGHT TO SURF FOR ON SITE BIO REMEDIATION ",CORVETTE,NO FIELD NAME,FALSE,62681
2014,275,7C,ATLAS PIPELINE MID-CONTINENT LLC,7/6/2014,Other,CROCKETT,0,0,0,Crude,9,7,2,Tank Battery,Equipment Failure,Repaired Existing Equipment,0,None,,SEC 3 BLK 29 SURVEY UNIVERSITY LANDS,VACUUM TRUCK TO PULL FREE STANDING OIL. CO WILL REMEDIATE,NOELKE,NO FIELD NAME,FALSE,62575
2014,1219,8,"PLAINS MARKETING, L.P.",7/6/2014,Transporter,WARD,0,0,0,Crude,10,0,10,Tank Battery,Equipment Failure,Other,0,None,,"31.51489, 103.45635",BROUGHT TO THE SURFACE FOR ON SITE BIOREMEDIATION,PARKER TRUST 20,NO FIELD NAME,FALSE,63494
2014,433,7C,DIAMONDBACK E&P LLC,7/6/2014,Producer,UPTON,18318,0,0,Crude,10,5,5,Valve,Corrosion - Rust,Repaired Existing Equipment,0,None,,"31.28351, 101.99062","VACUUM TRUCK RECOVER CRUDE OIL, REMEDIAL ACTIVITIES STARTED",CHARLOTTE A UNIT,SPRABERRY (TREND AREA),FALSE,62711
2014,615,10,"TRADITIONS OIL & GAS, LLC",7/5/2014,Producer,HUTCHINSON,903,0,0,Crude,267,178,89,Tank Battery,Equipment Failure,Other,0,None,,"SECT 7, BLK M-21,",OFF SITE REMEDIATION IN PROGRESS,PITTS,PANHANDLE HUTCHINSON COUNTY FLD.,FALSE,62890
2014,551,4,MORSEY OIL & GAS CORP.,7/5/2014,Producer,DUVAL,1085,0,0,Crude,2,0,2,Flow Line,Equipment Failure,Other,0,None,,402 N MAIN ST,"CONTAMINATE SOIL DUE OUT & REMOVED, LEAK REPAIRED, BACK FILLED","TANKERSLEY, A. L.","GOVT. WELLS, N.",FALSE,62826
2014,607,8A,APACHE CORPORATION,7/5/2014,Producer,YOAKUM,60407,0,0,Crude,3,0,3,Tank Battery,Equipment Failure,Other,0,None,,"33.199415, -102.843575","HYDROCARBONS CONSUMED IN FIRE, NO FURTHER ACTION WARRANTED",PLAINS UNIT,BRAHANEY,FALSE,62882
2014,293,10,"CHESAPEAKE OPERATING, INC.",7/5/2014,Producer,HEMPHILL,0,230925,0,Combined,8,4,4,Tank Battery,Company Human Error,Other,0,None,,SEC 16 BLK A1 H&GN RR CO A-962 660 FNL & 1320 FWL,PRODUCTION TANKS RAN OVER AND SPILLEDD. RRC NOTIFIED.,WATERFIELD 16,BUFFALO WALLOW (GRANITE WASH),FALSE,62592
2014,434,7C,DIAMONDBACK E&P LLC,7/5/2014,Producer,UPTON,15800,0,0,Crude,10,6,4,Valve,Equipment Failure,Other,0,None,,"31.29243, 101.93958","VACUUM TRUCK RECOVER RELEASED CRUDE OIL, REMEDIAL AVTIVITIES","NEAL ""8""",SPRABERRY (TREND AREA),FALSE,62712
2014,1005,8,OXY USA WTP LP,7/4/2014,Producer,ECTOR,21431,0,0,Crude,10,0,10,Tank Battery,Vandalism,Other,0,None,,"SEC 42, BLK 46, T & P RR CO SURVEY",MIX AND TIL,TXL DEVONIAN MAIN PAY UNIT,TXL (DEVONIAN-MAIN PAY),FALSE,63280
2014,419,8A,"WALSH PETROLEUM, INC.",7/4/2014,Producer,YOAKUM,61626,0,0,Crude,12,8,4,Other,Equipment Failure,Other,0,None,,SECTION 423,"COW BROKE CONNECTION AT WELLHEAD, LIQUID PICKED UP VACUUM TRUCK","WEBB, J. D. ESTATE",BRAHANEY,FALSE,62702
2014,608,8,APACHE CORPORATION,7/4/2014,Producer,GLASSCOCK,43138,0,0,Crude,15,0,15,Valve,Equipment Failure,Other,0,None,,"32.03347, -101.46529","OIL REMOVED NEAR WELLHEAD, PRESSURE WASHING OF VEGETATION",AMBERJACK 39,JAILHOUSE (FUSSELMAN),FALSE,62883
2014,379,8,PRIME OPERATING COMPANY,7/4/2014,Producer,MARTIN,30002,0,0,Crude,10,0,10,Other,Act of God,Other,0,None,,SEC 5 BLK 35 T&P RR COMPANY,OIL WASHED ON TO LOW LYING AREAS BY RAINWATER OVERFLOW. REMEDIATE ,HERZOG -A-,SPRABERRY (TREND AREA),FALSE,62665
2014,306,5,SM ENERGY COMPANY,7/3/2014,Producer,LIMESTONE,0,179493,0,Crude,0,0,0,Tank Battery,Act of God,Installed New Equipment,0,None,,THORTON A-1,"LIGHTNING STRUCK, CLEAN UP IMMEDIATLEY, TANKS REPLACED.",WHITE,BOX CHURCH (TRAVIS PEAK),FALSE,62605
2014,545,10,"LINN OPERATING, INC.",7/3/2014,Producer,HUTCHINSON,848,0,0,Crude,6,4,2,Flow Line,Corrosion - Rust,Repaired Existing Equipment,0,None,,SEC 135 5-T SURVEY T&NO,IMPLEMENTED SPILL CONTAINMENT & COUNTER MEASURES.,KNUDSEN,PANHANDLE HUTCHINSON COUNTY FLD.,FALSE,62820
2014,290,10,SABINE OIL & GAS LLC,7/3/2014,Producer,ROBERTS,8820,0,0,Crude,169,0,169,Tank Battery,Theft,Other,0,None,,SEC 5 BLK 46 H&TC RR CO A-207,OIL IN TANK STOLEN. REPORTED. SETTING UP CAMERAS AND LOCKS,MESA VISTA 5,LARD RANCH (GRANITE WASH -C-),FALSE,62590
2014,421,8,ENERGEN RESOURCES CORPORATION,7/3/2014,Producer,ANDREWS,21220,0,0,Crude,5,0,5,Flow Line,Equipment Failure,Other,0,None,,"32.22454, -102.68447","HOLE IN BALL VALVE, VACUUM TRUCK PICK UP FREE FLUID WORKED SOIL",WEST FUHRMAN-MASCHO UNIT,FUHRMAN-MASCHO,FALSE,62704
2014,1122,8A,"CR3 OPERATING COMPANY, L.L.C.",7/3/2014,Producer,TERRY,70265,0,0,Crude,20,2,18,Tank Battery,Equipment Failure,Other,0,None,,"SEC 44, BLK DD, J.H. GIBSON SURVEY",CLEAN UP AND REMEDIATE THE SPILL AREA.,ADAIR 1592,WELLMAN (KINDERHOOK),FALSE,63397
2014,403,8A,ENTERPRISE CRUDE PIPELINE LLC,7/3/2014,Transporter,SCURRY,0,0,0,Crude,300,251,49,Pipe Line,Corrosion - Rust,Other,0,Creek,BULLCREEK,"32.608210, -101.08034","EXTERNAL CORROSION, BOOM INSTALLED, REMEDIAL ACTION TAKEN",CORVETTE,NO FIELD NAME,FALSE,62686
2014,881,8,PLAINS PIPELINE L.P.,7/3/2014,Transporter,MIDLAND,0,0,0,Crude,10,0,10,Tank Battery,Equipment Failure,Other,0,None,,"31.66159, 102.20698",WILL BE BROUGHT TO SURFACE FOR ON SITE BIO REMEDIATION,MCDOWELL SWD,NO FIELD NAME,FALSE,63156
2014,707,8A,COVE PETROLEUM CORPORATION,7/3/2014,Producer,LUBBOCK,60693,0,0,Crude,13,0,13,Tank Battery,Act of God,Other,0,None,,"SEC 25, BLK A, JOHN H GIBON SURVEY","TANK REPLACED, FIRE BURNED CRUDE OIL","BROWN, N.",LEE HARRISON,FALSE,62982
2014,310,3,ANADARKO E&P ONSHORE LLC,7/2/2014,Producer,BURLESON,23909,0,0,Crude,15,12,3,Tank Battery,Corrosion - Rust,Other,0,None,,30.625364/-96.583696 NAD 27,LEAK IN HEATER TREATER FIRE TUBE. VACUUMED UP & SOIL TREATED,CALVIN-FACHORN UNIT,GIDDINGS (AUSTIN CHALK-3),FALSE,62609
2014,858,8,CONOCOPHILLIPS COMPANY,7/2/2014,Producer,ECTOR,36703,0,0,Crude,10,0,10,Tank Battery,Corrosion - Rust,Other,0,None,,"31.74212, -102.634",REMEDIATION IS BEING DONE IN PLACE,MILLARD -A-,PENWELL (WICHITA ALBANY),FALSE,63133
2014,930,1,HOUSTON PIPE LINE COMPANY LP,7/2/2014,Transporter,MCMULLEN,0,0,0,Gas Well Liquid,7,0,7,Pipe Line,Corrosion - Rust,Other,0,None,,COUNTY RD 305,EXCAVATE ALL CONTAMINATED SOIL,TARZAN SWD,NO FIELD NAME,FALSE,63205
2014,929,8,"HIGH SIERRA CRUDE OIL & MKTG,LLC",7/1/2014,Transporter,ANDREWS,0,0,0,Crude,13,0,13,Tank Battery,Equipment Failure,Other,0,None,,"32.303009, 102.545297",REMEDIATE,TARZAN SWD,NO FIELD NAME,FALSE,63204
2014,920,8,"HIGH SIERRA TRANSPORTATION, LLC",7/1/2014,Transporter,ANDREWS,0,0,0,Crude,13,0,13,Tank Battery,Human Error - Other,Other,0,None,,"32.303009, 102.545297",SITE CLEAN UP,BERGER-PORTERFIELD,NO FIELD NAME,FALSE,63195
2014,1220,8,OXY USA WTP LP,7/1/2014,Producer,REEVES,42864,0,0,Crude,59,59,0,Tank Battery,Equipment Failure,Other,0,None,,"SEC 21, BLK 51, T&P RR CO","PICK UP FLUID, MIX & TILL",LYDA 21,WOLFBONE (TREND AREA),FALSE,63495
2014,617,7C,OCCIDENTAL PERMIAN LTD.,6/30/2014,Producer,SCHLEICHER,15086,0,0,Crude,13,10,3,Tank Battery,Equipment Failure,Repaired Existing Equipment,0,None,,"SECTION 11, BLOCK TT, SURVEY TC RR CO",PRODUCTION STIPPED UNTIL WELL CASING WAS INSPECTED & REPAIRED,"BROOKS ""11""",BUTLER (CANYON),FALSE,62892
2014,408,8,APACHE CORPORATION,6/30/2014,Producer,ECTOR,43701,0,0,Crude,155,140,15,Tank Battery,Equipment Failure,Other,0,None,,"31.9825, -102.3874",ALARM SYSTEM MALFUNCTION CLOSED EQUALIZING LINE OVERFLOWED.,"BARROW, AUGUSTA",SPRABERRY (TREND AREA),FALSE,62691
2014,670,8,"HIGH ROLLER WELLS, L.L.C.",6/30/2014,Transporter,HOWARD,44018,0,0,Crude,8,0,8,Other,Human Error - Other,Other,0,None,,"32.27297, 101.67308",VACUUM TRUCKS USED TO RECOVER RELEASED CRUDE OIL,HRW HOWARD SWD,SPRABERRY (TREND AREA),FALSE,62945
2014,716,8,BURLINGTON RES O & G CO-MIDLAND,6/30/2014,Producer,CRANE,1224,0,0,Crude,91,90,1,Tank Battery,Equipment Failure,Repaired Existing Equipment,0,None,,"N 31 33 29.13, W 102 26 52.86",AREA REMEDIATED,"WADDELL, W. N.",DUNE,FALSE,62991
2014,659,8,"VANGUARD PERMIAN, LLC",6/29/2014,Producer,CRANE,15268,0,0,Crude,170,10,160,Tank Battery,Corrosion - Rust,Other,0,None,,"SEC 3, BLK 32, SURVEY PSL","SOIL REMOVED, PLACED ON PLASTIC FOR REMEDIATION","LEA, KATIE W. A/C 5",SAND HILLS (JUDKINS),FALSE,62934
2014,298,6,"QUANTUM RESOURCES MANAGEMENT,LLC",6/29/2014,Producer,GREGG,8032,0,0,Crude,15,14,1,Tank Battery,Equipment Failure,Repaired Existing Equipment,0,None,,"GPS 32.3654952, -94.8871300",FLEX LINE STOPPED UP. WASH DOWN IS IN PROGRESS. WILL REMEDIATE.,STATE OF TEXAS HILL RANCH G.U.,NO FIELD NAME,FALSE,62597
2014,407,8,APACHE CORPORATION,6/29/2014,Producer,ECTOR,20487,0,0,Crude,17,15,2,Tank Battery,Equipment Failure,Other,0,None,,"31.8762, -102.7073","RUPTURE OF FLOWLINE, VACUUM TRUCK RECOVERED FREE FLUIDS",TXL NORTH UNIT,TXL (TUBB),FALSE,62690
2014,552,6,"KOVAR OPERATING, LLC",6/28/2014,Producer,DUVAL,13909,0,0,Crude,94,0,94,Tank Battery,Act of God,Other,0,None,,"A-143, SIR T.HICKMAN","ALL RELEASE WAS CONTAINED WITHIN THE FIREWALL, WILL BE MIXED",CHAMPION INT'L UNIT A-143,"BROOKELAND (AUSTIN CHALK, 8800)",FALSE,62827
2014,380,8,"ACME ENERGY SERVICES, INC.",6/27/2014,Producer,MARTIN,26796,0,0,Crude,5,0,5,Stuffing Box,Equipment Failure,Repaired Existing Equipment,0,None,,32.4075928,OIL TANK OVERFLOWED,HOLCOMB,SPRABERRY (TREND AREA),FALSE,62666
2014,362,8,"PIONEER NATURAL RES. USA, INC.",6/27/2014,Producer,MIDLAND,15254,0,0,Crude,15,13,2,Valve,Company Human Error,Other,0,None,,"31.705094, -101.878770","PUMP LEFT ON WITH CLSED VALVE, REMEDIATION IN PROCESS",MIDKIFF UNIT,SPRABERRY (TREND AREA),FALSE,62648
2014,867,7C,"RUNNELS S.W.D.,INC.",6/27/2014,Other,RUNNELS,14397,0,0,Crude,5,5,0,Tank Battery,Equipment Failure,Other,0,None,,JOHN LYNCH SURVEY 422 ABS 346,PULLED FLUID OUT OF DIKE AND PUT BACK INTO TANKS,"POE, W.J.",POE (GOEN SAND),FALSE,63142
2014,364,8,"DISCOVERY OPERATING, INC.",6/27/2014,Producer,MIDLAND,36561,0,0,Crude,23,20,3,Tank Battery,Equipment Failure,Repaired Existing Equipment,0,None,,SEC 40 BLK 39 T&P RR CO SURVEY,GASKET RUPTURED USE VACUUM TRUCK DUG OUT MIX IT WITH CLEAN SOIL,WINDHAM 40,SPRABERRY (TREND AREA),FALSE,62650
2014,384,8,DIAMONDBACK E&P LLC,6/26/2014,Producer,MIDLAND,40653,0,0,Crude,149,80,69,Tank Battery,Human Error - Other,Other,0,None,,APPROX 11 MILES WEST OF MIDLAND OFF OF FM 1788,FRAC TANK OVERFLOWED VACUUM TRUCKS USED REMEDIATE,ST NW,SPRABERRY (TREND AREA),FALSE,62670
2014,414,8A,LEGACY RESERVES OPERATING LP,6/26/2014,Producer,DAWSON,60521,0,0,Crude,20,10,10,Pipe Line,Corrosion - Rust,Repaired Existing Equipment,0,None,,"SEC 37, BLK 35 T4N T&P RR CO",INTERNAL CORROSION EXCAVATED AND BIOREMEDIATED ON SITE,ACKERLY /DEAN/ FIELD UNIT,ACKERLY (DEAN SAND),FALSE,62697
2014,383,8,ENDEAVOR ENERGY RESOURCES L.P.,6/26/2014,Producer,MIDLAND,0,184047,0,Crude,25,20,5,Pump Station or Terminal,Equipment Failure,Other,0,None,,31.573868,SEPARATOR MALFUNCTION,"INTERSTATE ""B""","MIDLAND, SW. (DEVONIAN)",FALSE,62669
2014,273,7C,ATLAS PIPELINE MID-CONTINENT LLC,6/26/2014,Other,REAGAN,0,0,0,Crude,7,2,5,Flow Line,Human Error - Other,Other,0,None,,SECTION BARTLETT WG/BLOCK 4/SURVEY GC&SF RR CO,VACUMM TRUCK PULLING STANDING LIQUID. REMEDIATE SITE,EASTHAM STATE PRISON FARM,NO FIELD NAME,FALSE,62573
2014,425,8,"EQT PRODUCTION TEXAS, LLC",6/26/2014,Producer,STERLING,32743,0,0,Crude,9,0,9,Flow Line,Corrosion - Rust,Repaired Existing Equipment,0,None,,"SEC 14, BLK 31, T5S, T&P RR CO",AREA WILL BE EXCAVATED AND BIOREMEDIATED ON SITE,GLASS -G-,CONGER (LEONARD),FALSE,62708
2014,284,10,"DEVON ENERGY PRODUCTION CO, L.P.",6/25/2014,Producer,ROBERTS,6329,0,0,Crude,11,6,5,Tank Battery,Act of God,Other,0,None,,SEC 4 BS&F SURVEY,LIGTNING STRIKE & FIRE. PERFEX ENER CONTACTED TO EVAL & REMEDIATE ,"FLOWERS TRUST ""A""","MENDOTA, NW. (GRANITE WASH, SW.)",FALSE,62584
2014,286,10,"CHESAPEAKE OPERATING, INC.",6/25/2014,Producer,LIPSCOMB,0,264790,0,Crude,7,6,1,Tank Battery,Corrosion - Rust,Repaired Existing Equipment,0,None,,INSIDE OF CONTAINMENT AT THE HT,CORROSION. REMEDIATION WILL CONSIST OF TILLING & TREATING SOIL,J O PRICE TRUST 100 LIP,LIPSCOMB (CLEVELAND),FALSE,62586
2014,285,10,"CHESAPEAKE OPERATING, INC.",6/25/2014,Producer,HEMPHILL,8201,0,0,Crude,15,6,9,Tank Battery,Other,Other,0,None,,,"WELL KICKED, REMEDIATION CONSIST OF TILLING & TREATING THE SOIL","MORRIS, J. A.",FELDMAN (TONKAWA),FALSE,62585
2014,316,1,TEXAS PETROLEUM INVESTMENT CO.,6/24/2014,Producer,GUADALUPE,2799,0,0,Crude,385,375,10,Tank Battery,Equipment Failure,Other,0,None,,JOEL ROBINSON SURVEY,ON SITE BIOREMEDIATION OF AFFECTED SOILS IN PROGRESS,"KNOBLOCH, C. -A-",DARST CREEK (EDWARDS),FALSE,62615
2014,1118,8,ENERGEN RESOURCES CORPORATION,6/23/2014,Producer,REEVES,45017,0,0,Crude,41,40,1,Tank Battery,Equipment Failure,Other,0,None,,"31.751769, -103.953576",CHANGED FUSE & PICKED UP STANDING FLUIDS WITH VACUUM TRUCK,WINCHESTER 57-10,PHANTOM (WOLFCAMP),FALSE,63393
2014,288,10,BLACK'S OIL & GAS,6/23/2014,Producer,GRAY,7036,0,0,Crude,175,0,175,Tank Battery,Act of God,Installed New Equipment,0,None,,SEC 112 B;L 3 O&GN SUR,LIGHTNING STRUCK. CALL FIRE DEPT AND SHERIFF.,"HAGGARD, JOHN",PANHANDLE GRAY COUNTY FIELD,FALSE,62588
2014,287,10,"TRADITIONS OIL & GAS, LLC",6/23/2014,Producer,HUTCHINSON,4341,0,0,Crude,130,0,130,Tank Battery,Theft,Other,0,None,,SEC 3 BLK 23 BS&F SURVEY,"130 BBLS STOLEN, 16 BBLS BS&W SPILLED. REMEDIATE SOIL",SOUTHLAND,PANHANDLE HUTCHINSON COUNTY FLD.,FALSE,62587
2014,295,10,PANTERA ENERGY COMPANY,6/23/2014,Producer,CARSON,5518,0,0,Crude,28,0,28,Tank Battery,Theft,Other,0,None,,SEC 25 BLK 4,THEFT. COUNTY SHERIFF CALLED,ENSEARCH,PANHANDLE CARSON COUNTY FIELD,FALSE,62594
2014,664,8,ANADARKO E&P ONSHORE LLC,6/22/2014,Producer,WARD,41507,0,0,Combined,10,0,10,Other,Equipment Failure,Other,0,None,,"31.6397881, -103.5036039",EXCAVATE & BLEND SOIL,EAST VERMEJO 33-66,PHANTOM (WOLFCAMP),FALSE,62939
2014,354,8,ENERGEN RESOURCES CORPORATION,6/22/2014,Producer,WARD,43873,0,0,Crude,27,26,1,Tank Battery,Equipment Failure,Repaired Existing Equipment,0,None,,31.52688,"FIRE TUBE GASKET BLEW. ISOLATED HEATER TREATER, USED VACUUM TRUCK ",UNIVERSITY 17-18,TWO GEORGES (BONE SPRING),FALSE,62640
2014,482,10,"SAMSON LONE STAR, LLC",6/22/2014,Producer,HEMPHILL,0,205483,0,Gas Well Liquid,7,0,7,Tank Battery,Act of God,Repaired Existing Equipment,0,None,,"SEC 87, BLK M1, H&GN RR CO SURVEY ABS 156","STRUCK BY LIGHTNING, WILL REMEDIATE IN PLACE",FILLINGIM-TEAS 87,BUFFALO WALLOW (GRANITE WASH),FALSE,62759
2014,648,8,ANADARKO E&P ONSHORE LLC,6/22/2014,Producer,WARD,41507,0,0,Combined,10,0,10,Other,Equipment Failure,Other,0,None,,"31.6397881, -103.5036039","EXCAVATE, BLEND SOIL",EAST VERMEJO 33-66,PHANTOM (WOLFCAMP),FALSE,62923
2014,406,8,APACHE CORPORATION,6/22/2014,Producer,WINKLER,13866,0,0,Crude,7,0,7,Flow Line,Equipment Failure,Other,0,None,,"31.87965, -103.06918",SPLIT POLY FLOWLINE EQUIPMENT UTILIZED TO BLEND AND TIL SOIL,"CAMPBELL, SETH",KEYSTONE (CLEAR FORK),FALSE,62689
2014,542,10,BP AMERICA PRODUCTION COMPANY,6/22/2014,Producer,HEMPHILL,0,171832,0,Gas Well Liquid,6,0,6,Tank Battery,Act of God,Other,0,None,,"SEC 194, BLOCK C, G&M SURVEY",NO REMEDIATION REQUIRED. ALL CONDENSATE CONSUMED BY FIRE,"WEBB, ARTHUR ET AL ""T""","MENDOTA, NW. (CHEROKEE)",FALSE,62817
2014,343,8,ENDEAVOR ENERGY RESOURCES L.P.,6/22/2014,Producer,MIDLAND,37236,0,0,Crude,10,0,10,Separator-Gun Barrel-Treater,Equipment Failure,Other,0,None,,"31.7442316, -102.0041416",FIRE TUBE MALFUNCTION TREATER CAUGHT FIRE. REMEDIATION IN PROGRESS,"PERRO ROJO ""10""",SPRABERRY (TREND AREA),FALSE,62631
2014,278,7C,"PIONEER NATURAL RES. USA, INC.",6/21/2014,Producer,UPTON,16349,0,0,Crude,19,0,19,Tank Battery,Act of God,Other,0,None,,31.504376 & -101.960967 INSIDE BATTERY,LIGHTNING STRIKE CONSUMED LIQUIDS WILL REMEDIATE,XBC GIDDINGS ESTATE,SPRABERRY (TREND AREA),FALSE,62578
2014,363,8,"PIONEER NATURAL RES. USA, INC.",6/20/2014,Producer,MIDLAND,15254,0,0,Crude,72,70,2,Pipe Line,Company Human Error,Other,0,None,,31.704609 -101.878792,"DURING PREV SPILL POLY LINE STRUCK BY HACKHOE, REMEDIATION IN PROC",MIDKIFF UNIT,SPRABERRY (TREND AREA),FALSE,62649
2014,1126,1,ARGENT ENERGY (US) HOLDINGS INC.,6/20/2014,Producer,GONZALES,17836,0,0,Combined,70,70,0,Tank Battery,Equipment Failure,Other,0,None,,MAKERS #3H,"ROUST-A-BOUT SERVICE & VACUUM TRUCKS, WASHED, SKIMMED UP, DISPOSAL",MAKERS,EAGLEVILLE (EAGLE FORD-1),FALSE,63401
2014,1116,3,VESS OIL CORPORATION,6/20/2014,Producer,BRAZOS,17583,0,0,Crude,12,12,0,Flow Line,Equipment Failure,Other,0,None,,"J. SEALE SURVEY, A-214",VAC TRUCK PICKUP LIQUIDS & ROUSTABOUT CREW TO REMEDIATE,KURTEN WOODBINE UNIT,KURTEN (WOODBINE),FALSE,63391
2014,1276,1,TALISMAN ENERGY USA INC.,6/19/2014,Transporter,MCMULLEN,0,0,0,Combined,10,0,10,Tank Battery,Human Error - Other,Other,0,None,,"99 PLANT CDP, 138 CR 305",RESIDUAL IMPACTED SOIL & GRAVEL WAS EXCAVATED BY HAND,STS NORTH UNIT 18,NO FIELD NAME,FALSE,63551
2014,622,10,"PASH ENERGY, INC.",6/19/2014,Producer,HUTCHINSON,1124,0,0,Crude,203,0,203,Tank Battery,Act of God,Other,0,None,,"SEC 24, LB K Y A&B",SOILED AREA REMOVED AND NEW SOIL WORKED IN.,"WEATHERLY, J. F., EST.",PANHANDLE HUTCHINSON COUNTY FLD.,FALSE,62897
2014,1376,8,PRIME OPERATING COMPANY,6/19/2014,Producer,MARTIN,46728,0,0,Crude,130,109,21,Tank Battery,Act of God,Other,0,None,,"SEC 29, BLK 35, T & P RR COMPANY","CONTAINED, CLEANED, SOIL REMEDIATED, NEW TANK PURCHASED",HEIDELBERG A,SPRABERRY (TREND AREA),FALSE,63651
2014,289,10,BP AMERICA PRODUCTION COMPANY,6/19/2014,Producer,LIPSCOMB,0,160475,0,Gas Well Liquid,12,0,12,Tank Battery,Act of God,Other,0,None,,SEC 770 BLK 43 T&TC SURVEY,LIGHTNING STRUCK. FIRE BURNED OUT. REMEDIATED AS NEEDED,"DUKE, C. C.",LIPSCOMB (CLEVELAND),FALSE,62589
2014,344,8,LEGACY RESERVES OPERATING LP,6/18/2014,Producer,MARTIN,30469,0,0,Crude,33,15,18,Tank Battery,Equipment Failure,Other,0,None,,SEC 2 BLK 38 T2N T&P RR CO,OVERFLOW OF STORAGE TANKS FREE FLIUDS REMOVED EXCAVATION TO FOLLOW,"ORSON, DR.",SPRABERRY (TREND AREA),FALSE,62632
2014,381,8,"PIONEER NATURAL RES. USA, INC.",6/18/2014,Producer,MIDLAND,33713,0,0,Crude,40,35,5,Tank Battery,Equipment Failure,Other,0,None,,N 31.842866,TANKS OVERFILL VACUUM TRUCK USED BIOLOGICAL REMEDIATION AID,BETH -A-,SPRABERRY (TREND AREA),FALSE,62667
2014,826,7C,ENTERPRISE CRUDE PIPELINE LLC,6/18/2014,Transporter,UPTON,15489,0,0,Crude,300,260,40,Flow Line,Equipment Failure,Other,0,None,,"31.614230, -102.24484",ALL IMPACTED SOIL WILL BE BLENDED DOWN TO LESS 1% TPH,DORCUS,SPRABERRY (TREND AREA),FALSE,63101
2014,313,3,APACHE CORPORATION,6/17/2014,Producer,WHARTON,20327,0,0,Crude,7,6,1,Flow Line,Equipment Failure,Other,0,None,,BROUSSARD TRUST #2 WATER LINE,"LEAK IN PVC LINE, PICKED UP VACUUM TRUCK, REMEDIATION STARTED.",BROUSSARD TRUST,MAGNET WITHERS,FALSE,62612
2014,724,7C,"ASPEN OPERATING COMPANY, L.L.C.",6/17/2014,Producer,CROCKETT,4689,0,0,Crude,154,150,4,Tank Battery,Act of God,Other,0,None,,OLSON BATTERY,"VACUUM TRUCK GOT REMAINING FLUIDS, REPLENISH WITH FRESH SOIL",OLSON UNIT,OLSON,FALSE,62999
2014,300,6,SABINE OIL & GAS LLC,6/17/2014,Producer,HARRISON,0,238986,0,Gas Well Liquid,8,0,8,Tank Battery,Act of God,Installed New Equipment,0,None,,"LITTLE, W SURVEY, A-397","LIGHTING STRUCK, CLEANED UP WTR/FOAM. BRINGING A STEEL WELDED TANK",HOLLOWAY GAS UNIT,OAK HILL (COTTON VALLEY),FALSE,62599
2014,352,8,ENDEAVOR ENERGY RESOURCES L.P.,6/16/2014,Producer,HOWARD,41771,0,0,Crude,60,0,60,Tank Battery,Act of God,Installed New Equipment,0,None,,32.1275668N,LIGHTENING STRUCK WATER TANK,BARBEE,SPRABERRY (TREND AREA),FALSE,62638
2014,900,7C,DISCOVERY NATURAL RESOURCES LLC,6/16/2014,Producer,IRION,17374,0,0,Crude,25,20,5,Tank Battery,Equipment Failure,Other,0,None,,"SEC 3004, BLK 24, A583, H&RC RR CO SURVEY","RECOVERED WITH VAC TRUCK, AREA FLUSHED WITH FRESH WATER",CONCHO A,SPRABERRY (TREND AREA),FALSE,63175
2014,1049,7C,"EOG RESOURCES, INC.",6/16/2014,Producer,UPTON,0,134832,0,Crude,180,15,165,Tank Battery,Corrosion - Rust,Other,0,None,,"SEC 107, BLK D, CCSD, RGNG SURVEY","EXCAVATED & STOCKPILED ON SITE, BLENDED,","WINDHAM, R. S. ""A""",AMACKER-TIPPETT (DEVONIAN),FALSE,63324
2014,548,8,"FASKEN OIL AND RANCH, LTD.",6/16/2014,Producer,MIDLAND,41192,0,0,Crude,20,10,10,Pipe Line,Equipment Failure,Repaired Existing Equipment,0,None,,"SECTION 7, BLOCK 40, T1S, T&P RR CO SURVEY","TRUCK LINE REPAIRED, VACUUM TRUCK COLLECTED FREE LIQUIDS.","FEE ""BE""",SPRABERRY (TREND AREA),FALSE,62823
2014,558,8,"DEVON ENERGY PRODUCTION CO, L.P.",6/16/2014,Producer,CRANE,33220,0,0,Crude,50,50,0,Other,Equipment Failure,Other,0,None,,"SEC 2, BLK B-21, PSL SURVEY, A-1109","PICK UP OIL, STEAM CLEAN TANKS,","MCKNIGHT, M. B.",SAND HILLS (TUBB),FALSE,62833
2014,315,7B,MERIT ENERGY COMPANY,6/16/2014,Producer,NOLAN,8712,0,0,Crude,75,50,25,Tank Battery,Equipment Failure,Other,0,None,,SEC 91 BLK 22 T&P RR SURV,"VACUUM TRUCKS FLUSHED 600 BBLS, REMEDIATING SOIL",LAKE TRAMMEL UNIT,"LAKE TRAMMEL, W. (CANYON)",FALSE,62614
2014,559,8,ENERGEN RESOURCES CORPORATION,6/16/2014,Producer,REEVES,41259,0,0,Crude,102,100,2,Other,Equipment Failure,Repaired Existing Equipment,0,None,,31.6085972 -103.6488446,"SHUT IN WELL, REPAIRED WELLHEAD, AND RESTARTED THE PUMP",STATE 54-8,ARNO (DELAWARE SAND),FALSE,62834
2014,688,8A,ENDEAVOR ENERGY RESOURCES L.P.,6/16/2014,Producer,GARZA,10175,0,0,Combined,200,0,200,Flow Line,Corrosion - Rust,Repaired Existing Equipment,0,Lake,LKALAN,"32.9921418, -101.1273768",REMEDIATION IN PROGRESS,"ALEXANDER, BIRDIE R.",DORWARD,FALSE,62963
2014,282,7C,CALLON PETROLEUM OPERATING CO,6/16/2014,Producer,UPTON,17203,0,0,Crude,6,4,2,Other,Equipment Failure,Repaired Existing Equipment,0,None,,SEC 3 BLK G; G.C. & S.F. EE CO SURVEY,"GLASS BROKE ON TESTER, SPILL CONTAINED, READY FOR REMEDIATION.",NEAL,SPRABERRY (TREND AREA),FALSE,62582
2014,793,8,OXY USA INC.,6/15/2014,Producer,REEVES,27162,0,0,Crude,250,230,20,Tank Battery,Corrosion - Rust,Repaired Existing Equipment,0,None,,"SEC 2, BLK 5, H. & G. N. RR CO SURVEY","PICK UP FLUID, MIX & TIL",COLLIE -B-,COLLIE (DELAWARE),FALSE,63068
2014,1357,1,GOODRICH PETROLEUM COMPANY,6/15/2014,Producer,LA SALLE,15361,0,0,Crude,10,0,10,Valve,Equipment Failure,Other,0,None,,"TT RR CO ABS 823, SEC 667","VACUUM TRUCK, EXCAVATED & DISPOSED AT A PERMITTED DISPOSAL",BURNS RANCH A,BRISCOE RANCH (EAGLEFORD),FALSE,63632
2014,1352,8A,OCCIDENTAL PERMIAN LTD.,6/14/2014,Producer,YOAKUM,18910,0,0,Crude,250,100,150,Other,Act of God,Other,0,None,,STATION 6,"VAC TRUCKS, SOIL REMEDIATED",DENVER UNIT,WASSON,FALSE,63627
2014,276,7C,"PIONEER NATURAL RES. USA, INC.",6/14/2014,Producer,CROCKETT,1300,0,0,Crude,18,15,3,Tank Battery,Equipment Failure,Other,0,None,,"N 31.475011, W 101.725167 W",CONTACTED NOVA TO PERFORM CLEAN UP,"ALDWELL ""K""",SPRABERRY (TREND AREA),FALSE,62576
2014,279,7C,"PIONEER NATURAL RES. USA, INC.",6/14/2014,Producer,UPTON,16349,0,0,Crude,80,0,80,Tank Battery,Act of God,Other,0,None,,"N 31.49418, W 102.03248 W",LIGHTNING STRIKE. NOVA TO REMEDIATE,XBC GIDDINGS ESTATE,SPRABERRY (TREND AREA),FALSE,62579
2014,314,7B,"WAPITI OPERATING, LLC",6/13/2014,Producer,STEPHENS,16956,0,0,Crude,30,30,0,Tank Battery,Equipment Failure,Other,0,None,,E. WALKER SURVEY A-932 LUNATIC ASYLUM LANDS SECTION 3,THREE INCH FREE WATER KNOCKOUT COLLAR,BURCH UNIT,STEPHENS COUNTY REGULAR,FALSE,62613
2014,304,6,"JAMEX, INC.",6/13/2014,Producer,ANDERSON,15285,0,0,Crude,105,60,45,Tank Battery,Human Error - Other,Repaired Existing Equipment,0,None,,JAS MCCOWN SURVEY A-554,BUTTERFLY VALVE STRIPPED. UNABLE TO CLOSE VALVE. REMEDIATED.,HERRINGTON,"PURT, E. (GOODLAND)",FALSE,62603
2014,280,7C,SM ENERGY COMPANY,6/13/2014,Producer,UPTON,16107,0,0,Crude,17,15,2,Tank Battery,Equipment Failure,Other,0,None,,SEC 47 BLK 42 T&P RR CO,FREE STANDING FLUID RECOVERED REMEDIATION BEGUN IMMEDIATELY,REXENE,SPRABERRY (TREND AREA),FALSE,62580
2014,281,7C,SM ENERGY COMPANY,6/13/2014,Producer,UPTON,16094,0,0,Crude,14,10,4,Tank Battery,Equipment Failure,Other,0,None,,SEC 47 BLK 42 T&P RR CO,FREE STANDING FLUID RECOVERED REMEDIATION BEGUN IMMEDIATELY,TYLER,SPRABERRY (TREND AREA),FALSE,62581
2014,1003,8,OXY USA INC.,6/13/2014,Producer,REEVES,42894,0,0,Crude,60,20,40,Other,Equipment Failure,Other,0,None,,"SEC 23, BLK, C-6, PSL/RITZ SURVEY","PCIK UP FLUID, MIX AND TIL",ANNAKATHERINE 23,WOLFBONE (TREND AREA),FALSE,63278
2014,422,8,OXY USA WTP LP,6/12/2014,Producer,ECTOR,36367,0,0,Crude,22,15,7,Tank Battery,Corrosion - Rust,Other,0,None,,"SEC 5, BLK 42, T2S, T&P RR CO",CIRC HEATER TREATER FAILURE SOIL MIXED & TILLED,RJ 5,FOSTER (CLEARFORK-BAXTER),FALSE,62705
