MasterYear,Form Number,District,OperatorNumber,DateofLoss,Type_Company_Cd,County,LeaseNumber,Gasident,CommNbr,TypeLiquid,GrossLoss,Recovered,Net Loss,Facility,CauseofLoss,Remedy,Water,WaterName,Location,Remarks,LeaseName,FieldNumber,FieldNumber,Into_Water,Unique_ID
2014,591,8A,"RAW OIL & GAS, INC.",4/9/2014,Producer,DAWSON,69682,0,0,Crude,46,17,29,Flow Line,Equipment Failure,Other,0,None,,"SEC. 69, BLK. 8, EL&RR RR CO SURVEY",SOIL REMEDIATION PLAN IN PROGRESS,BLACK PEARL,WILLENE (FUSSELMAN),FALSE,62866
2014,237,3,"SILVER OAK ENERGY, LLC",4/8/2014,Producer,HARDIN,23679,0,0,Crude,15,14,1,Flow Line,Equipment Failure,Other,0,None,,FLOWLINE FROM BROOKS 58 TO BROOKS BATTERY 1,VACUUMED FREE FLUID AND SOIL REMEDIATION PLAN IN PROGRESS,"BROOKS, G. W. FEE",SILSBEE (2),FALSE,62537
2014,979,8,ANADARKO E&P ONSHORE LLC,4/8/2014,Producer,LOVING,0,273927,0,Combined,15,15,0,Tank Battery,Equipment Failure,Other,0,None,,"31.9403649, -103.6890372","RECOVER FREE STANDING FLUIDS, WASH CONTAINMENT & DISPOSE OF",MDJ 54-1-30,SANDBAR (BONE SPRING),FALSE,63254
2014,215,3,"KD ENERGY, LLC",4/8/2014,Producer,MATAGORDA,21884,0,0,Crude,23,22,1,Flow Line,Equipment Failure,Other,0,None,,"S.PERKINS, A-371",VACUUMED FREE FLUID AND REMEDIATED AREA.,SOUTHLAND TRULL,"PHEASANT, SW. (8150 B-1)",FALSE,62515
2014,522,8,"PIONEER NATURAL RES. USA, INC.",4/8/2014,Producer,MARTIN,37534,0,0,Crude,20,15,5,Tank Battery,Equipment Failure,Other,0,None,,"N32.27378, W-102.13306",VACUUM FREE FLUID AND REMEDIATION PLAN IN PROGRESS,SCHARBAUER RANCH,SPRABERRY (TREND AREA),FALSE,62797
2014,812,8A,OCCIDENTAL PERMIAN LTD.,4/8/2014,Producer,YOAKUM,61063,0,0,Crude,15,0,15,Tank Battery,Equipment Failure,Other,0,None,,PRENTICE CWC UNIT,"VACUUMED UP FLUIDS, WILL REMEDIATE",CWC PRENTICE UNIT,PRENTICE (6700),FALSE,63087
2014,353,8,OXY USA WTP LP,4/8/2014,Producer,REEVES,42864,0,0,Crude,9,8,1,Tank Battery,Equipment Failure,Other,0,None,,"SECTION 21, BLK 51 T7S","GASKET ON MANWAY FAILED, PICK UP FLUID, MIX AND TIL",LYDA 21,WOLFBONE (TREND AREA),FALSE,62639
2014,813,8A,OCCIDENTAL PERMIAN LTD.,4/7/2014,Producer,YOAKUM,16808,0,0,Crude,15,0,15,Tank Battery,Equipment Failure,Other,0,None,,COBB ET AL,"VACUUMED UP STANDING FLUIDS, WILL REMEDIATE",COBB ET AL,"PRENTICE (CLEAR FORK, LOWER)",FALSE,63088
2014,255,7C,"PIONEER NATURAL RES. USA, INC.",4/7/2014,Producer,UPTON,16349,0,0,Crude,51,2,49,Flow Line,Corrosion - Rust,Other,0,None,,"N31.439081 DEG, W-102.0129360 DEG.",NOVA TO PERFORM REMEDIATION.,XBC GIDDINGS ESTATE,SPRABERRY (TREND AREA),FALSE,62555
2014,1395,8,"ENERVEST OPERATING, L.L.C.",4/7/2014,Producer,WICHITA,0,278631,0,Crude,204,0,204,Tank Battery,Theft,Other,0,None,,"SCOTT, RR A-695",MONTAGUE COUNTY SHERIFF'S OFFICE WAS CONTACTED,WHITE A-B,NO FIELD NAME,FALSE,63670
2014,469,8,XTO ENERGY INC.,4/6/2014,Producer,ANDREWS,39152,0,0,Crude,90,3,87,Tank Battery,Equipment Failure,Other,0,None,,"SEC 10, BLK 9, UNIVERSITY LANDS SURVEY",SPILL WAS CONTAINED UNDER FRAC TANKS,UNIVERSITY BLOCK 9,UNIVERSITY BLOCK 9 (DEVONIAN),FALSE,62746
2014,1354,8,XTO ENERGY INC.,4/6/2014,Producer,ANDREWS,39152,0,0,Crude,90,3,87,Tank Battery,Equipment Failure,Other,0,None,,"SEC 10, BLK 9, UNIVERSITY LANDS SUR",SPILL WAS CONTAINED UNDER FRAC TANKS,UNIVERSITY BLOCK 9,UNIVERSITY BLOCK 9 (DEVONIAN),FALSE,63629
2014,1409,7C,APACHE CORPORATION,4/6/2014,Producer,UPTON,18419,0,0,Crude,20,20,0,Flow Line,Equipment Failure,Other,0,None,,"31.5801, -101.9244","FIRE CONTAINED, EXTINGUISHED, SOILS WILL BE TILLED",MILLER 36,SPRABERRY (TREND AREA),FALSE,63684
2014,465,8,CIMAREX ENERGY CO. OF COLORADO,4/6/2014,Producer,WARD,38719,0,0,Crude,17,14,3,Tank Battery,Equipment Failure,Other,0,None,,"SEC 18, BLK 33 H & T.C. RR",LOCATION WILL BE REMEDIATED,EFFIE PONDER EST. 33-18,PHANTOM (WOLFCAMP),FALSE,62742
2014,976,8,ENERGEN RESOURCES CORPORATION,4/6/2014,Producer,REEVES,44948,0,0,Combined,7,6,1,Tank Battery,Equipment Failure,Other,0,None,,"31.6272029, -103.5240489",RECOVERED FREE STANDING LIQUIDS & BEGAN REMEDIATION,BENTON 3-12,PHANTOM (WOLFCAMP),FALSE,63251
2014,1107,6,"P.O.&G. OPERATING, LLC",4/5/2014,Producer,WOOD,4065,0,0,Crude,5,5,0,Flow Line,Equipment Failure,Other,0,None,,"J. STARK SURVEY,","SOIL MOVED FROM THE SITE, SOIL WILL BE USED TO IMPROVE FIREWALL",FOREST HILL SUB-CLKVLE. SD. UNIT,FOREST HILL,FALSE,63382
2014,241,6E,"DYERSDALE ENERGY, L.P.",4/5/2014,Producer,SHELBY,7105,0,0,Crude,10,5,5,Tank Battery,Theft,Other,0,None,,J.HILLIARD&J.MOFFETT SVY. 1 MI. N OF I-20 ON HWY 42,THEFT.,HUGHEY & ROSS,EAST TEXAS,FALSE,62541
2014,1274,1,HUNT OIL COMPANY,4/5/2014,Producer,MCMULLEN,17756,0,0,Combined,20,20,0,Valve,Equipment Failure,Other,0,None,,S.W.T. & P. RR CO A-533,"BACKHOE USED TO SCRAPE & SCOOP, REMOVED",STS NORTH UNIT 18,EAGLEVILLE (EAGLE FORD-1),FALSE,63549
2014,921,7C,"CHARLES A. BIRD, ESTATE",4/5/2014,Other,REAGAN,3526,0,0,Crude,38,8,30,Tank Battery,Corrosion - Rust,Repaired Existing Equipment,0,None,,"SEC 41, BLK C, L & S V RRCO SURVEY",REMEDIATE,"BIRD, F. A. ESTATE -B-",SPRABERRY (TREND AREA),FALSE,63196
2014,229,7C,"PLAINS MARKETING, L.P.",4/5/2014,Transporter,REAGAN,0,0,0,Crude,16,0,16,Tank Battery,Company Human Error,Other,0,None,,"GPS: N31.2355, W-101.575",SOIL REMEDIATION PLAN IN PROGRESS,NEAL,NO FIELD NAME,FALSE,62529
2014,1121,8,"PIONEER NATURAL RES. USA, INC.",4/5/2014,Producer,ANDREWS,40532,0,0,Crude,6,4,2,Tank Battery,Human Error - Other,Other,0,None,,"32.35236, -102.28323","REMOVED W/ VAC TRUCK, EXCAVATED & BLENDED, BIOLOGICAL REMEDIATION ","UNIVERSITY ""7-43""",SPRABERRY (TREND AREA),FALSE,63396
2014,476,7C,CALLON PETROLEUM OPERATING CO,4/4/2014,Producer,REAGAN,0,698067,0,Crude,389,122,267,Flow Line,Equipment Failure,Other,0,None,,NEAL 500 TB- NEAL 501 IS NEAR,VACUUMED FREE FLUID AND REMEDIATED SOIL.,SCHWARTZ,NO FIELD NAME,FALSE,62753
2014,257,7C,COG OPERATING LLC,4/4/2014,Producer,UPTON,17147,0,0,Crude,35,30,5,Pipe Line,Equipment Failure,Other,0,None,,"SEC. 42, BLK. 40, T&P RR CO SURVEY",SOIL REMEDIATION PLAN IN PROGRESS,PEGASUS SPRABERRY UNIT,PEGASUS (CONSOLIDATED),FALSE,62557
2014,581,8,DIAMONDBACK E&P LLC,4/4/2014,Producer,MIDLAND,41364,0,0,Crude,20,0,20,Tank Battery,Human Error - Other,Other,0,None,,"N 31.930420, W 102.230920",REMEDIATION IN PROCESS,ST S,SPRABERRY (TREND AREA),FALSE,62856
2014,470,8,ENERGEN RESOURCES CORPORATION,4/4/2014,Producer,WARD,44434,0,0,Crude,35,26,9,Tank Battery,Equipment Failure,Other,0,None,,"SEC 7, BLK 1, W&NW RR CO",RECOVERED FREESTANDING LIQUIDS & BEGAN REMEDIATION,ROCA UNIT 7,TWO GEORGES (BONE SPRING),FALSE,62747
2014,1273,8,"DISCOVERY OPERATING, INC.",4/3/2014,Producer,ANDREWS,26172,0,0,Crude,80,74,6,Tank Battery,Equipment Failure,Other,0,None,,"SEC 10, BLK 11, UNIVERSITY LANDS SURVEY","VACUUM TRUCK, AFFECTED SOIL DUG OUT, THEN DILUTED MIX W/CLEAN SOIL","UNIVERSITY ""11A""","BLOCK 11 (WICHITA, LO)",FALSE,63548
2014,365,8,CIMAREX ENERGY CO. OF COLORADO,4/3/2014,Producer,ANDREWS,26861,0,0,Crude,7,3,4,Tank Battery,Equipment Failure,Other,0,None,,SEC 6,TRIPLEX PUMP WENT DOWN LOCATION WILL BE REMEDIATED,LITTMAN -A-,LITTMAN (SAN ANDRES),FALSE,62651
2014,649,8,CIMAREX ENERGY CO.,4/3/2014,Producer,CULBERSON,0,273366,0,Crude,100,0,100,Tank Battery,Equipment Failure,Other,0,None,,"SECTION 20, BLK 59, T1S",IMPACTED SOIL WILL BE REMEDIATED,DAYSTAR 20 UNIT,DERBY (BONE SPRING),FALSE,62924
2014,471,8,"W&T OFFSHORE, INC.",4/3/2014,Producer,MARTIN,40332,0,0,Crude,35,30,5,Tank Battery,Equipment Failure,Repaired Existing Equipment,0,None,,"SEC 10, BLK H A LANIER, SUR ABS A-942",CHANGING OUT POLLYLINE & HAVE STARTED RECLAMATION OF DAMAGED AREA ,CHENIN,SPRABERRY (TREND AREA),FALSE,62748
2014,349,8,"PIONEER NATURAL RES. USA, INC.",4/2/2014,Producer,MIDLAND,18187,0,0,Crude,25,20,5,Tank Battery,Equipment Failure,Repaired Existing Equipment,0,None,,N 31.834633 W -101.889387,"TANK OVERFILLED, FREE LIQUIDS REMOVED USING VACUUM TRUCK REMEDIAT.",SHACKELFORD SPRABERRY UNIT,SPRABERRY (TREND AREA),FALSE,62635
2014,490,8,APACHE CORPORATION,4/2/2014,Producer,GLASSCOCK,42096,0,0,Crude,26,20,6,Pipe Line,Company Human Error,Other,0,None,,"31.9671, -101.50712","VACUUM TRUCK PICK UP STANDING FLUID, MICROBLAZE WAS APPLIED",NEWELL 12,SPRABERRY (TREND AREA),FALSE,62767
2014,351,8,"PIONEER NATURAL RES. USA, INC.",4/2/2014,Producer,MIDLAND,18187,0,0,Crude,25,20,5,Tank Battery,Equipment Failure,Other,0,None,,N 31.834633,"TANK OVERFILLED, USED VACUUM TRUCK, BIOLOGICAL REMEDIATION",SHACKELFORD SPRABERRY UNIT,SPRABERRY (TREND AREA),FALSE,62637
2014,630,1,TEXAS PETROLEUM INVESTMENT CO.,4/2/2014,Producer,GUADALUPE,2796,0,0,Crude,1,0,1,Other,Equipment Failure,Other,0,None,,SUR JOEL ROBINSON A-275,"PICKED UP ALL FREE FLUIDS, ON SITE BIOREMEDIATION EFF SOILS,","KNOBLOCH, C.",DARST CREEK (EDWARDS),FALSE,62905
2014,472,8,"SHERIDAN PRODUCTION COMPANY, LLC",4/1/2014,Producer,HOWARD,41062,0,0,Crude,15,10,5,Tank Battery,Equipment Failure,Other,0,None,,"SEC 15, BLK 33, T2 S, AB 106, SUR T&P RR CO","VACUUM TRUCK TO PICK UP STANDING FLUID, REMEDIATE AREA","GLASSCOCK, HOWARD W. (G-S) UNIT",HOWARD GLASSCOCK (CONSOLIDATED),FALSE,62749
2014,453,8,"ARES ENERGY, LTD.",4/1/2014,Producer,ANDREWS,29005,0,0,Crude,137,0,137,Tank Battery,Theft,Other,0,None,,"SEC 17, BLK A-47 PSL","THEFT OF TANK BATTERY, SHERIFF NOTIFIED, CAMERAS IN PLACE",LINDLEY -C-,FUHRMAN-MASCHO,FALSE,62730
2014,491,8,APACHE CORPORATION,4/1/2014,Producer,ANDREWS,20882,0,0,Crude,10,5,5,Flow Line,Equipment Failure,Other,0,None,,"32.27, -102.5349","VACUUM TRUCK PICK UP STANDING FLUID, SOILS WERE BLENDED & TILLED",BAKKE UNIT,BAKKE (WOLFCAMP),FALSE,62768
2014,256,7C,"LAREDO PETROLEUM, INC.",3/31/2014,Producer,REAGAN,16734,0,0,Crude,1,0,1,Other,Company Human Error,Other,0,None,,WELL #11N,PORTABLE FLARE LIT OIL ON FIRE. ALL OIL RELEASED CONSUMED BY FIRE ,SUGG-B-,SPRABERRY (TREND AREA),FALSE,62556
2014,1330,2,"PENN VIRGINIA OIL & GAS, L.P.",3/30/2014,Producer,LAVACA,10035,0,0,Crude,25,0,25,Tank Battery,Equipment Failure,Other,0,None,,H. RUSSELL A-376,"SHUT IN WELLS, PICK UP LIQUIDS INSIDE LINED FIREWALL",SCHACHERL UNIT,EAGLEVILLE (EAGLE FORD-2),FALSE,63605
2014,441,8,ENERGEN RESOURCES CORPORATION,3/30/2014,Producer,REEVES,41697,0,0,Combined,92,90,2,Tank Battery,Equipment Failure,Repaired Existing Equipment,0,None,,"SEC 11, BLK 3, H&GN RR CO SURVEY",MADE REPAIRS & BEGAN REMEDIATION IN PLACE,KATH 3-11,TWO GEORGES (BONE SPRING),FALSE,62718
2014,440,8,"RESOLUTE NATURAL RES. CO., LLC",3/30/2014,Producer,MIDLAND,40265,0,0,Crude,13,3,10,Valve,Equipment Failure,Other,0,None,,"SEC 21, BLK 41 T1S, T&P RR CO","FREE STANDING FLUID VACUUM, CLEAN SOIL BROUGHT IN FOR BACKFILING",PEARL JAM,SPRABERRY (TREND AREA),FALSE,62717
2014,424,8,ANADARKO E&P ONSHORE LLC,3/30/2014,Producer,LOVING,40729,0,0,Combined,43,40,3,Tank Battery,Equipment Failure,Other,0,None,,"31.660376, -103.456391","SITE GLASS BROKE RELEASING FLUID, DISPOSE OF WASH FLUIDS",APC FEE 1-40,PHANTOM (WOLFCAMP),FALSE,62707
2014,378,8,APACHE CORPORATION,3/30/2014,Producer,HOWARD,42795,0,0,Crude,4,4,0,Tank Battery,Equipment Failure,Other,0,None,,32.36892,RUPTURE OF THE FIRE TUBE FLANGE GASKET IMMEDIATELY SHUT IN,BURNETT 17,SPRABERRY (TREND AREA),FALSE,62664
2014,520,8,"EQT PRODUCTION TEXAS, LLC",3/29/2014,Producer,GLASSCOCK,43657,0,0,Crude,13,8,5,Tank Battery,Equipment Failure,Other,0,None,,"SEC. 11, BLK. 35 T3S",VACUUMED FREE FLUID AND REMEDIATED AREA.,EDMONDSON A,SPRABERRY (TREND AREA),FALSE,62795
2014,228,7C,CALLON PETROLEUM OPERATING CO,3/29/2014,Producer,UPTON,17203,0,0,Crude,7,4,3,Tank Battery,Equipment Failure,Other,0,None,,"LAT. 31 DEG. 17'58.50'N, LONG. 101 DEG. 53'49.61""W",VACUUMED FREE FLUID AND REMEDIATED AREA.,NEAL,SPRABERRY (TREND AREA),FALSE,62528
2014,238,3,PALMER PETROLEUM INC.,3/29/2014,Producer,MADISON,24722,0,0,Crude,510,510,0,Tank Battery,Act of God,Other,0,None,,"STRANGE SED #1,J. YOUNG SVY. A-247",STORM DAMAGED OVERFLOW LINE. RELEASED INTO CONTAINMENT.,STRANGE SWD,GIN CREEK (BUDA),FALSE,62538
2014,106,1,GOODRICH PETROLEUM COMPANY,3/29/2014,Producer,LA SALLE,15361,0,0,Crude,20,0,20,Flow Line,Equipment Failure,Other,0,None,,"SEC.680, SVY. KEY WEST IRR CO, ABS. 804",SOIL REMEDIATION PLAN IN PROGRESS,BURNS RANCH A,BRISCOE RANCH (EAGLEFORD),FALSE,62409
2014,141,8A,"CROSS TIMBERS ENERGY, LLC",3/29/2014,Producer,TERRY,5938,0,0,Crude,300,200,100,Valve,Equipment Failure,Other,0,None,,MALLET LAND AND CATTLE CO.,SPILL WAS COVERED AND REMEDIATION PLAN IN PROGRESS,MALLET LAND & CATTLE COMPANY,SLAUGHTER,FALSE,62444
2014,377,8,APACHE CORPORATION,3/29/2014,Producer,ANDREWS,43190,0,0,Gas Well Liquid,8,0,8,Tank Battery,Company Human Error,Other,0,None,,32.1437,GAS ESCAPING FROM PACKING WAS IGNITED FIRE DEPART EXTIN FIRE,THREE BAR SHALLOW UNIT,THREE BAR (WICHITA),FALSE,62663
2014,258,7C,"TRINITY ENVIRONMENTAL SWD,L.L.C",3/28/2014,Other,UPTON,16341,0,0,Crude,10,9,1,Tank Battery,Equipment Failure,Other,0,None,,"SEC. 26, BLK. B, CCSD & RGNG",VACUUMED FREE FLUID AND REMEDIATED AREA WITH BACKHOE,WESTLAND 26,SPRABERRY (TREND AREA),FALSE,62558
2014,259,7C,"EOG RESOURCES, INC.",3/28/2014,Producer,IRION,17666,0,0,Crude,20,19,1,Tank Battery,Equipment Failure,Other,0,None,,"1139, C&M RR CO., A-54",VACUUMED FREE FLUID AND REMEDIATED AREA.,FAUDREE,LIN (WOLFCAMP),FALSE,62559
2014,366,8,CIMAREX ENERGY CO.,3/28/2014,Producer,REEVES,41596,0,0,Crude,10,0,10,Tank Battery,Corrosion - Rust,Repaired Existing Equipment,0,None,,"SEC 32 BLK 1 H&GN RR CO/GASSON, JG","HOLE IN FIRE TUBE ON HEATER TREATER, WILL BE REMEDIATED",DARCY STATE 32,TWO GEORGES (BONE SPRING),FALSE,62652
2014,1369,6,ANADARKO E&P ONSHORE LLC,3/28/2014,Transporter,GREGG,0,0,0,Gas Well Liquid,5,0,5,Tank Battery,Act of God,Other,0,None,,"32.3801, -94.5942","MOST LIQUIDS BURNED, REMAINING FLUIDS REMOVED VAC TRUCK, EXCAVATED","BYWATERS, B. A.",NO FIELD NAME,FALSE,63644
2014,261,7C,"PIONEER NATURAL RES. USA, INC.",3/27/2014,Producer,UPTON,16499,0,0,Crude,40,30,10,Tank Battery,Equipment Failure,Other,0,None,,"31.221904, -101.797378",OIL IN FIREWALL.VACUUMED FREE FLUID AND REMEDIATION COMPLETED,"UNIVERSITY ""3-31""",SPRABERRY (TREND AREA),FALSE,62561
2014,96,3,SANCHEZ OIL & GAS CORPORATION,3/27/2014,Producer,FAYETTE,26105,0,0,Crude,23,22,1,Separator-Gun Barrel-Treater,Equipment Failure,Other,0,None,,"COTTLE, GW A-35",VACUUMED FREE FLUID AND SOIL REMEDIATION PLAN IN PROGRESS,PROST UNIT A,SOUTHERN BAY (EAGLE FORD),FALSE,62400
2014,260,7C,"DCP MIDSTREAM, LP",3/27/2014,Transporter,CROCKETT,0,0,0,Gas Well Liquid,10,2,8,Pipe Line,Corrosion - Rust,Other,0,None,,"LAT.30.626531, LONG. 101.315563",SOIL REMEMDIATION PLAN IN PROGRESS,FAUDREE,NO FIELD NAME,FALSE,62560
2014,262,7C,"BOAZ ENERGY II OPERATING, LLC",3/27/2014,Producer,REAGAN,17853,0,0,Crude,20,20,0,Tank Battery,Equipment Failure,Other,0,None,,"BLK. 48, SEC. 2, UNIVERSITY LANDS",VACUUMED FREE FLUID AND REMEDIATED AREA.,UNIVERSITY 48-2WX,FARMER (SAN ANDRES),FALSE,62562
2014,367,8A,"ROGERS, S. K. OIL, INC.",3/27/2014,Producer,HOCKLEY,64574,0,0,Crude,198,0,198,Tank Battery,Equipment Failure,Other,0,None,,SOUTH 52 OF LAB 11,TANK RUPTURED. IN-SITU BIOREMEDIATION.,MARATHON,LEVELLAND,FALSE,62653
2014,140,8,CONOCOPHILLIPS COMPANY,3/26/2014,Producer,HOWARD,41251,0,0,Crude,224,220,4,Flow Line,Corrosion - Rust,Other,0,None,,SETTLES A 52 FLOWLINE,FREE FLUID RECOVERED AND SOIL REMEDIATION PLAN IN PROGRESS,"SETTLES, W. R. -A-",HOWARD GLASSCOCK (CONSOLIDATED),FALSE,62443
2014,227,7C,"ASPEN OPERATING COMPANY, L.L.C.",3/26/2014,Producer,CROCKETT,4689,0,0,Crude,15,12,3,Tank Battery,Equipment Failure,Other,0,None,,WEL #1202 OLSON UNIT,VACUUMED FREE FLUID AND SOIL REMEDIATION PLAN IN PROGRESS,OLSON UNIT,OLSON,FALSE,62527
2014,92,10,"LINN OPERATING, INC.",3/26/2014,Producer,HUTCHINSON,1197,0,0,Crude,12,0,12,Flow Line,Equipment Failure,Other,0,None,,"BLK. M24, TC RR CO SURVEY -101.54058, 35.90548",REMEDIATION PLAN IN PROGRESS,CROSBY & HATCHER -A-,PANHANDLE HUTCHINSON COUNTY FLD.,FALSE,62396
2014,975,8,ANADARKO E&P ONSHORE LLC,3/25/2014,Producer,LOVING,0,273927,0,Combined,5,5,0,Tank Battery,Equipment Failure,Other,0,None,,"31.9403649, -103.6890372","RECOVERED FREE STANDING FLUIDS, WASHED & FLUIDS DISPOSED OF",MDJ 54-1-30,SANDBAR (BONE SPRING),FALSE,63250
2014,263,7C,"PIONEER NATURAL RES. USA, INC.",3/24/2014,Producer,UPTON,16349,0,0,Crude,10,9,1,Stuffing Box,Equipment Failure,Other,0,None,,ON THE WELL PAD AT THE XBC GIDDINGS 1036,FREE FLUID RECOVERED AND AREA REMEDIATED.,XBC GIDDINGS ESTATE,SPRABERRY (TREND AREA),FALSE,62563
2014,226,7C,APACHE CORPORATION,3/24/2014,Producer,UPTON,17543,0,0,Crude,350,275,75,Tank Battery,Equipment Failure,Other,0,None,,"LAT. 31.5299, LONG. -102.033",VACUUMED FREE FLUID AND SOIL REMEDIATION PLAN IN PROGRESS,NEAL 38,SPRABERRY (TREND AREA),FALSE,62526
2014,122,6,GOODRICH PETROLEUM COMPANY,3/24/2014,Producer,PANOLA,0,230940,0,Crude,130,130,0,Tank Battery,Equipment Failure,Other,0,None,,"BUFFORD, W ABS 67",VACUUMED FREE FLUID AND SOIL REMEMDIATION PLAN IN PROGRESS,"JONES, A. GU",BECKVILLE (COTTON VALLEY),FALSE,62425
2014,216,3,"DECKER OPERATING CO., L.L.C.",3/24/2014,Producer,MADISON,26251,0,0,Crude,3,1,2,Tank Battery,Equipment Failure,Other,0,None,,J.S HUNTER A-110,SOIL REMEDIATION PLAN SUCCESSFUL.,SHELDON UNIT,HALLIDAY (WOODBINE),FALSE,62516
2014,254,4,"COLUMBUS ENERGY, LLC",3/24/2014,Producer,WEBB,0,196616,0,Gas Well Liquid,15,0,15,Tank Battery,Equipment Failure,Other,0,None,,HUBBERD #61 CITY OF LAREDO POR 50,VACUUMED FREE FLUID AND REMEDIATED AREA.,HUBBERD,LIZ (9200),FALSE,62554
2014,253,6,J-O'B OPERATING COMPANY,3/24/2014,Producer,TITUS,3061,0,0,Crude,5,1,4,Flow Line,Corrosion - Rust,Other,0,None,,ALIHU BELCHER SURVEY A-646,REPLACED AND REPAIRED FLOWLINE.,"BELCHER, A., ETAL",TRIX-LIZ (WOODBINE -D-),FALSE,62553
2014,242,6,NABORS COMPLETION & PROD SERV CO,3/24/2014,Other,GREGG,0,16916,0,Crude,175,100,75,Tank Battery,Equipment Failure,Other,0,None,,"SEC.33, BLK. 38T1S, SURVEY T&P RR CO 32.046756, -102.0183589",VACUUMED FREE FLUID AND REMEDIATED AREA.,"MARTIN, B. F.",WILLOW SPRINGS (RODESSA),FALSE,62542
2014,387,6,"BKEP PIPELINE, L.L.C.",3/24/2014,Transporter,GREGG,0,0,0,Crude,650,590,60,Pipe Line,Equipment Failure,Repaired Existing Equipment,0,None,,32.47599,CRACK ON THE THREADED CONNECTION OF A LINE TRAP VALVE. REPLACED.,ODONNELL,NO FIELD NAME,FALSE,62673
2014,95,7C,"OPAL RESOURCES OPERATING CO.,LLC",3/23/2014,Producer,UPTON,18255,0,0,Crude,74,10,64,Tank Battery,Equipment Failure,Other,0,None,,"SEC.43, SURVEY D&SE RR CO.",SOIL REMEDIATION PLAN IN PROGRESS,EMERALD,SHEEP MOUNTAIN (CONSOLIDATED),FALSE,62399
2014,98,4,SMITH PRODUCTION INC.,3/23/2014,Producer,STARR,0,0,6153,Gas Well Liquid,140,0,140,Tank Battery,Theft,Other,0,None,,"26.366390, -98.617780",THEFT.,PROST UNIT A,NO FIELD NAME,FALSE,62401
2014,473,8,"SHERIDAN PRODUCTION COMPANY, LLC",3/22/2014,Producer,LOVING,38207,0,0,Crude,8,7,1,Tank Battery,Equipment Failure,Other,0,None,,"SEC 35, BLK 53, T2, SUR T&P RR CO","VACUUM TRUCK TO PICK STADNING FLUID, WILL REMIDATE AREA",SLASH -C-,DIMMITT (DELAWARE CONS),FALSE,62750
2014,94,3,APACHE CORPORATION,3/22/2014,Producer,WHARTON,3349,0,0,Crude,100,99,1,Tank Battery,Equipment Failure,Other,0,None,,"I&GN RR SUR.39, A-405","VACUUMED FREE FLUID AND REMEDIATED AREA,",PIERCE ESTATES -A-,PICKETT RIDGE,FALSE,62398
2014,566,1,FOREST OIL CORPORATION,3/22/2014,Producer,GONZALES,17754,0,0,Crude,23,20,3,Tank Battery,Other,Other,0,None,,"SMALL, W. A-425",REMEDIATION PLAN IN PROGRESS,CARL SAMPLE,EAGLEVILLE (EAGLE FORD-1),FALSE,62841
2014,87,6,FOREST OIL CORPORATION,3/21/2014,Producer,RUSK,0,236698,0,Gas Well Liquid,114,112,2,Tank Battery,Equipment Failure,Other,0,None,,"SEC.1, JUAN XIMENES SURVEY, A-47",VACUUMED FREE FLUID AND REMEDIATION PLAN IN PROGRESS,STROUD GAS UNIT NO. 1,"HENDERSON, E. (COTTON VALLEY)",FALSE,62391
2014,88,6,"SAMSON LONE STAR, LLC",3/20/2014,Producer,GREGG,0,241931,0,Gas Well Liquid,40,37,3,Tank Battery,Equipment Failure,Other,0,None,,"HENRY WELLS SURVEY, A-222",FREE FLUIDS RECOVERED AND SOIL REMEDIATION PLAN IN PROGRESS,"DANIELS, JUDGE G.U. 1",DANVILLE (TP-CV CONS.),FALSE,62392
2014,477,7C,"EP ENERGY E&P COMPANY, L.P.",3/20/2014,Producer,REAGAN,17576,0,0,Crude,22,0,22,Valve,Equipment Failure,Other,0,None,,UNIVERSITY 44-13 DH,SOIL EXCAVATED & REPLACED. SOIL DISPOSED OF PROPERLY.,UNIVERSITY EAST,LIN (WOLFCAMP),FALSE,62754
2014,524,8,"SHERIDAN PRODUCTION COMPANY, LLC",3/20/2014,Producer,ECTOR,22275,0,0,Crude,17,15,2,Tank Battery,Company Human Error,Other,0,None,,PERMIAN SW/CORA LONGBOTHAM,VACUUMED FREE FLUID AND REMEDIATION PLAN IN PROGRESS,"LONGBOTHAM, CORA -A-","COWDEN, SOUTH (CANYON 8790)",FALSE,62799
2014,1119,8,"RED WILLOW PRODUCTION, LLC",3/20/2014,Producer,REEVES,45605,0,0,Crude,20,18,2,Tank Battery,Human Error - Other,Other,0,None,,"SEC 96, BLK 1, T&TC RR CO SURVEY","SHUT DOWN, OPENED VALVE TO OTHER TANK TO EQUALIZE TANK LEVELS",HOEFS RANCH STATE 1-96,HOEFS T-K (WOLFCAMP),FALSE,63394
2014,119,3,"MILAGRO EXPLORATION, LLC",3/19/2014,Producer,WHARTON,2899,0,0,Products,200,195,5,Tank Battery,Equipment Failure,Other,0,None,,SYLVANUS CASTLEMAN A-12,LINE HAS BEEN REPAIRED AND AREA REMEDIATED.,"COCKBURN, H. C.",MAGNET WITHERS,FALSE,62422
2014,124,7B,CHARTER PETROLEUM COMPANY,3/19/2014,Producer,CALLAHAN,25662,0,0,Crude,165,145,20,Tank Battery,Equipment Failure,Other,0,None,,"NE/4 SECTION 20, D&DAL SURVEY",VACUUMED FREE FLUID AND SOIL REMEDIATED,GEORGE 20,"PUTNAM, WEST (DUFFER)",FALSE,62427
2014,115,3,"ENERVEST OPERATING, L.L.C.",3/18/2014,Producer,WASHINGTON,21758,0,0,Products,90,90,0,Tank Battery,Equipment Failure,Other,0,None,,SAMUEL HINCH A-60,VACUUMED FREE FLUID AND REMEDIATED AREA.,HAMMANN-NIXON UNIT,GIDDINGS (AUSTIN CHALK-3),FALSE,62418
2014,529,5,"COMSTOCK OIL & GAS, LP",3/18/2014,Producer,LOVING,0,79262,0,Crude,81,80,1,Tank Battery,Equipment Failure,Other,0,None,,"YOUNG SEETON SURVEY, A-764",SOIL REMEDIATION PLAN IN PROGRESS,BLACK MAMBA 1-57,NO FIELD NAME,FALSE,62804
2014,221,7C,"FOUR STARR PRODUCTION, LLC",3/18/2014,Producer,CROCKETT,7221,0,0,Crude,224,0,224,Tank Battery,Theft,Other,0,None,,"SVY 1, BLK. 9, D&SE RR CO. SURVEY ABST. 1722",THEFT,STRAUSS-PFLUGER ET AL,"WEGER, SW. (GRAYBURG-SAN ANDRES)",FALSE,62521
2014,108,4,CHEVRON U. S. A. INC.,3/17/2014,Producer,ZAPATA,0,131943,0,Gas Well Liquid,100,0,100,Tank Battery,Theft,Other,0,None,,JV BORRECO SURVEY A-209,THEFT.,"VIDAURRI, R. ET AL",LA PERLA (LOBO CONS.),FALSE,62411
2014,1373,8A,OCCIDENTAL PERMIAN LTD.,3/17/2014,Producer,HOCKLEY,18244,0,0,Crude,60,50,10,Tank Battery,Equipment Failure,Other,0,None,,"LAB 15, LGE 49, SCURRY CSL","VAC TRUCK, BACKHOE BLADED AREA, REMEDIATION",CENTRAL MALLET UNIT,SLAUGHTER,FALSE,63648
2014,91,3,GEOSOUTHERN ENERGY CORPORATION,3/17/2014,Producer,MADISON,15686,0,0,Crude,200,40,160,Tank Battery,Equipment Failure,Other,0,River,NAVASOTARVR.,THOMAS FITZGERALD A-97,SOIL REMEDIATION AND REMEDIATION OF RIVER IN PROGRESS,JUDI UNIT,KURTEN (AUSTIN CHALK),FALSE,62395
2014,1410,10,SABINE OIL & GAS LLC,3/17/2014,Producer,ROBERTS,8888,0,0,Crude,53,52,1,Tank Battery,Human Error - Other,Other,0,None,,INSIDE FIRE WALL AROUND TANKS,"PUT LINER DOWN, FIRE WALL AROUND IT, CONTAMINATED DIRT INSIDE",MESA VISTA 4,LARD RANCH (GRANITE WASH -C-),FALSE,63685
2014,264,7C,"LAREDO PETROLEUM, INC.",3/17/2014,Producer,REAGAN,16507,0,0,Crude,13,10,3,Flow Line,Equipment Failure,Other,0,None,,WELL 158 #4HM,RECOVERED FREE FLUID AND REMEDIATED AREA.,SUGG-A-,SPRABERRY (TREND AREA),FALSE,62564
2014,1290,8,QEP ENERGY COMPANY,3/16/2014,Producer,MARTIN,41735,0,0,Crude,50,49,1,Tank Battery,Company Human Error,Other,0,None,,"SEC 16, BLK 39, T3N, G&MMB&A","PICKED UP ALL FLUIDS, FLUSHED AREA, REPLACED CRUSHED CHAT",MABEE X,SPRABERRY (TREND AREA),FALSE,63565
2014,224,7C,ENTERPRISE PRODUCTS OPERATINGLLC,3/16/2014,Other,SUTTON,0,0,0,Products,5,1,4,Separator-Gun Barrel-Treater,Company Human Error,Other,0,None,,"OFF FM 405, 7MI. W OF HWY 277, SUTTON CO., TX",SAMPLING SOIL TO CREATE A REMEDIATION PLAN,EVANS,NO FIELD NAME,FALSE,62524
2014,167,10,"CHESAPEAKE OPERATING, INC.",3/16/2014,Producer,OCHILTREE,2857,0,0,Crude,8,5,3,Tank Battery,Corrosion - Rust,Other,0,None,,"SEC.0009, BLK. IT, SURVEY TW & NG RR CO.",SOIL REMEDIATION PLAN IN PROGRESS,FRANK -F-,SPICER (MARMATON),FALSE,62469
2014,89,10,PERRYTON OPERATING COMPANY,3/15/2014,Producer,OCHILTREE,0,22529,0,Gas Well Liquid,117,0,117,Tank Battery,Equipment Failure,Other,0,None,,"SEC.13, BLK. 11, W. AHREN BECK & BROS. SURVEY","REPLACED TANK, NO DAMAGE TO PROPERTY.","GEORGE, A. J. UNIT","PERRYTON (MORROW, LOWER)",FALSE,62393
2014,125,6,"EXCO/HGI JV ASSETS, LLC",3/14/2014,Producer,HARRISON,0,221471,0,Crude,20,20,0,Tank Battery,Corrosion - Rust,Other,0,None,,FURR H OIL UNIT NO.1,VACUUMED FREE FLUID AND REMEDIATED AREA,FURRH OIL UNIT,WASKOM (SANDERS SAND),FALSE,62428
2014,168,2,FREEPORT-MCMORAN OIL & GAS LLC,3/14/2014,Producer,KARNES,9558,0,0,Crude,35,0,35,Tank Battery,Equipment Failure,Other,0,None,,"DANIEL B. MCCONDDELL SURVEY,A-191 29 10'8.22""N 97 43'51.23""W",SOIL REMEDIATION PLAN IN PROGRESS,JULIE,EAGLEVILLE (EAGLE FORD-2),FALSE,62470
2014,402,8A,CENTURION PIPELINE L.P.,3/13/2014,Transporter,HOCKLEY,0,0,0,Crude,15,7,8,Pipe Line,Human Error - Other,Other,0,None,,"SEC 66, BLK 66 HARDEMAN CSL","LEAK CAUSED BY THIRD PARTY HIT, REMEDIATE",CORVETTE,NO FIELD NAME,FALSE,62685
2014,225,7C,"VANGUARD PERMIAN, LLC",3/13/2014,Producer,TOM GREEN,11991,0,0,Crude,104,70,34,Tank Battery,Equipment Failure,Other,0,None,,"ROEDER, G. SURVEY/ABS. 4511818, SVY. 18190",SOIL REMEDIATION PLAN IN PROGRESS,"ANSON, LOUISE ""B""",H-J (STRAWN),FALSE,62525
2014,633,1,"SEA EAGLE FORD, LLC",3/12/2014,Producer,MCMULLEN,16859,0,0,Crude,5,0,5,Valve,Company Human Error,Other,0,None,,"G.W.T.&P. RR A-1044 SUR,",CONTAMINATED SOIL WAS MIXED WITH BIOREMEDIATION PRODUCT,SHANNON EFS,EAGLEVILLE (EAGLE FORD-1),FALSE,62908
2014,527,8,"DEVON ENERGY PRODUCTION CO, L.P.",3/12/2014,Producer,CRANE,20349,0,0,Crude,301,210,91,Tank Battery,Equipment Failure,Other,0,None,,"BLK. 26, SEC. 4",SOIL REMEDIATION PLAN IN PROGRESS,C-BAR SAN ANDRES UNIT,C-BAR (SAN ANDRES),FALSE,62802
